,user_name,game_name,title,viewer_count,started_at,api_call_time
0,AdinRoss,Just Chatting,SUS UNATHLETIC MAN GAMBLES WITH SSB !duelbits !sub !prime,82376,2021-05-27 01:52:03,2021-05-27T04:06:03.226352
1,ThisIsNotGeorgeNotFound,Minecraft,Dream Coded This...,69403,2021-05-27 02:07:20,2021-05-27T04:06:03.226352
2,Trainwreckstv,Slots,18+ !stake BUFFALO KING BUFFALO KING #ad | !twitter | !youtube | !podcast,38502,2021-05-26 05:07:31,2021-05-27T04:06:03.226352
3,RatedEpicz,Grand Theft Auto V,Most Wanted! Randy Bullet | Chang Gang | GTA V RP | !newvid !youtube,31903,2021-05-26 20:16:56,2021-05-27T04:06:03.226352
4,shroud,World of Warcraft,COME CARRY MY PALLY. FAERLINA HORDE.|    Follow @shroud on socials,24285,2021-05-26 14:49:59,2021-05-27T04:06:03.226352
5,sodapoppin,World of Warcraft,Making Shroud eat a disgusting pizza | Merch !comp | www.sodapoppin.shop (Discount code: POOR),23724,2021-05-26 14:35:30,2021-05-27T04:06:03.226352
6,Swagg,Call of Duty: Warzone,Use Code SWAGG in the Store | Nuke Squad | FaZe Clan | !sub !blm,22341,2021-05-27 00:02:11,2021-05-27T04:06:03.226352
7,PENTA,Grand Theft Auto V,Mike Block | Nopixel,20042,2021-05-26 23:00:54,2021-05-27T04:06:03.226352
8,TSM_ImperialHal,Apex Legends,Ranked w/ Snipe and Baron !youtube,19669,2021-05-26 22:01:31,2021-05-27T04:06:03.226352
9,moistcr1tikal,Just Chatting,Youtube night,18543,2021-05-27 00:31:44,2021-05-27T04:06:03.226352
10,RiceGum,Just Chatting,MEET MY NEW DOG (Stream pet),17452,2021-05-27 01:21:09,2021-05-27T04:06:03.226352
11,Ramee,Grand Theft Auto V,Vault Heist! | Ramee | !Twitter | NoPixel | Chang Gang ,16086,2021-05-26 19:12:36,2021-05-27T04:06:03.226352
12,sinatraa,VALORANT,SEN Sinatraa | gaming !newvid,13301,2021-05-26 20:10:51,2021-05-27T04:06:03.226352
13,LVNDMARK,Escape from Tarkov,FILTER EMOTE | !YOUTUBE | !GFUEL | !MERCH | Follow @LVNDMARK_tv on socials,10806,2021-05-26 20:49:52,2021-05-27T04:06:03.226352
14,nl_Kripp,Hearthstone,BGs | !Xtrfy To Checkout My Gear! | Drilled Eyeball Streamer ,9194,2021-05-27 02:04:07,2021-05-27T04:06:03.226352
15,Ninja,Final Fantasy XI Online,[Wings] FFXI addict,9068,2021-05-26 18:53:30,2021-05-27T04:06:03.226352
16,EsfandTV,Grand Theft Auto V,CAPTAIN CLETUS CORNWOOD,8395,2021-05-26 23:33:05,2021-05-27T04:06:03.226352
17,Ray__C,Grand Theft Auto V,HUGE Vault Heist Today Woo!! + RE Village After! ,8152,2021-05-27 00:06:01,2021-05-27T04:06:03.226352
18,hannahxxrose,Minecraft,Minecraft Bedwars on Hypixel 🌹 girl boss moments,7776,2021-05-27 00:12:07,2021-05-27T04:06:03.226352
19,Punz,VALORANT,dont talk to me im gaming | !gfuel !merch | @Punztw on Twitter and Insta,7546,2021-05-27 02:18:09,2021-05-27T04:06:03.226352
20,pealeaf,Music,Playing Asian music to celebrate #AsianHeritageMonth (Charity Stream) !AAPI,7393,2021-05-27 02:18:21,2021-05-27T04:06:03.226352
21,ironmouse,Knockout City,UHH ITS WEDNESDAY MY WEEBS HANGING WITH NYAN,7076,2021-05-26 23:57:17,2021-05-27T04:06:03.226352
22,BeyondTheSummit,Dota 2,LIVE: Hokori vs. The Cut (Bo2) - LOOT.BET Pro Series 6: NA/SA Group Stage w/ KMart & ET,7000,2021-05-26 14:37:50,2021-05-27T04:06:03.226352
23,fuslie,Dead by Daylight,DEAD BY DAYLIGHT WITH TOAST JOHN 5UPPP KKATAMIINAAAAA!!,6547,2021-05-26 23:57:17,2021-05-27T04:06:03.226352
24,supertf,Overwatch,"brutal pummeling of the opposition imminent, re6 later with daph",6124,2021-05-27 02:56:02,2021-05-27T04:06:03.226352
25,Aydan,World of Warcraft,World of Warcraft w/ Chat | !servers !giveaway,6020,2021-05-26 20:56:21,2021-05-27T04:06:03.226352
26,Whippy,Grand Theft Auto V,BORING DUNDEE STREAM NoPixel l !mavix | !honey | !merch | !meta | twitter.com/whippynotpoopy,5866,2021-05-27 00:59:48,2021-05-27T04:06:03.226352
27,Xposed,Slots,💰⭐ HIGH ROLLER ACTION ⭐💰 !roobet !giveaway $5000 CASH + 2 PCS,5784,2021-05-27 02:30:40,2021-05-27T04:06:03.226352
28,AnthonyZ,Grand Theft Auto V,"!Giveaway | Tony ""GAMBA"" Corleone | NoPixel | STREAMS MON-SAT 9:30AM CT",5772,2021-05-27 02:27:32,2021-05-27T04:06:03.226352
29,Sanchovies,League of Legends,Yo! 😂😂😂😂😂😂😂😂,5399,2021-05-26 21:10:03,2021-05-27T04:06:03.226352
30,tarik,Counter-Strike: Global Offensive,FPL @tarik // !45,5281,2021-05-27 01:36:22,2021-05-27T04:06:03.226352
31,Scarra,Teamfight Tactics,new !offlinetv vid out | tft -> erbs later,5194,2021-05-26 17:56:58,2021-05-27T04:06:03.226352
32,ImKaiCenat,Fall Guys: Ultimate Knockout,"FIRST DAY AS A PARTNER, 200K TODAY??",4923,2021-05-27 01:50:34,2021-05-27T04:06:03.226352
33,Masayoshi,Dead by Daylight,Detective Masayoshi,4905,2021-05-26 20:24:51,2021-05-27T04:06:03.226352
34,Atrioc,Just Chatting,NOBODY REALLY DOIN IT LIKE IM DOIN IT YOU KNOW WHAT IM SAYIN ,4873,2021-05-27 02:36:45,2021-05-27T04:06:03.226352
35,VALORANT,VALORANT,(REBROADCAST) KRU Esports vs YNG Sharks - VCT Masters Reykjavík,4818,2021-05-26 23:53:02,2021-05-27T04:06:03.226352
36,CobaltStreak,The Binding of Isaac: Repentance,🔪All Character Random Streak + 2nd Save Slot Unlocks!🔪 ,4504,2021-05-27 00:22:14,2021-05-27T04:06:03.226352
37,Hungrybox,Super Smash Bros. Ultimate,"THE LUNCH BOX #11 Feat. Sparg0, Cosmos, Maister, Mr.E, LeoN, Sonix, Jake, Peanut, Mabel and more! ~ !box !youtube",4123,2021-05-26 21:07:36,2021-05-27T04:06:03.226352
38,5uppp,Dead by Daylight,dbd with friends! | !displate !artcompetition,4108,2021-05-27 02:39:07,2021-05-27T04:06:03.226352
39,boxbox,Grand Theft Auto V,Bo Xbox has a BRILLIANT TECH IDEA to investigate today (NoPixel 3.0),4096,2021-05-26 23:52:19,2021-05-27T04:06:03.226352
40,KYR_SP33DY,Call Of Duty: Modern Warfare,An Uproarious Evening On COD!! Modern Warfare,4071,2021-05-27 01:21:19,2021-05-27T04:06:03.226352
41,MuTeX,Call of Duty: Warzone,20-20 MAX SENS GAMEPLAY! ,4006,2021-05-26 21:36:43,2021-05-27T04:06:03.226352
42,Rescue,Dead by Daylight,Click here for pandas,3990,2021-05-27 01:11:43,2021-05-27T04:06:03.226352
43,KhaosAdam,Grand Theft Auto V,Adam Ababwa | NoPixel 3.0 RP | MNDM MANDEM,3976,2021-05-27 01:37:01,2021-05-27T04:06:03.226352
44,scoped,Fortnite,Typical Gamer Trio Cup!,3849,2021-05-27 02:55:59,2021-05-27T04:06:03.226352
45,WARDELL,VALORANT,OPERATOR ONLY USER,3838,2021-05-27 02:03:33,2021-05-27T04:06:03.226352
46,ANGRYPUG,Dead by Daylight,Going against killer mains with training wheels on all night aka red ranks,3769,2021-05-27 00:07:37,2021-05-27T04:06:03.226352
47,Gladd,Biomutant,We mutate now | !socials !nexus !suggest,3536,2021-05-26 21:17:57,2021-05-27T04:06:03.226352
48,Annoying,NBA 2K21,LOSING MONEY ON 2K WAGERS | | CEO SUB-A-THON DAY 24 (SLEEPING COUNTS) | !sub !prime !yt,3534,2021-05-26 14:42:19,2021-05-27T04:06:03.226352
49,kkatamina,Dead by Daylight,BIG CHILL,3528,2021-05-27 00:54:40,2021-05-27T04:06:03.226352
50,Yassuo,Call of Duty: Warzone,CANT WIN SO I PLAY WARZONE TO LOSE,3420,2021-05-26 21:37:36,2021-05-27T04:06:03.226352
51,TheNicoleT,"Pools, Hot Tubs, and Beaches",Can i be your Waifu ~ ASMR Later !socials !ytasmr,3390,2021-05-27 00:45:32,2021-05-27T04:06:03.226352
52,Calebhart42,Final Fantasy VII,FF7 SPEEDRUNS FOR SUB 7 | @calebhart42 IG/Twitter,3380,2021-05-27 00:56:13,2021-05-27T04:06:03.226352
53,rlly,Grand Theft Auto V,Nopixel - Shelly,3339,2021-05-26 22:50:32,2021-05-27T04:06:03.226352
54,Kurumx,Teamfight Tactics,Liquid Kurumx | RANK 8 NA 1311 LP START | SLAMMING GAMES ON NEW PATCH TO LEARN | NEW !YT VID UP !set5 !comps !youtube !esports !twitter,3301,2021-05-27 00:48:28,2021-05-27T04:06:03.226352
55,GamesDoneQuick,Outlast,Speedruns From the Crypt - Outlast featuring TheDarkenedRose,3292,2021-05-26 22:52:22,2021-05-27T04:06:03.226352
56,KristoferYee,Grand Theft Auto V,Jay Que | No Pixel 3.0 | @KristoferYee on socials,3269,2021-05-26 19:21:42,2021-05-27T04:06:03.226352
57,Akademiks,Music,"BACK AGAIN
",3207,2021-05-27 01:27:22,2021-05-27T04:06:03.226352
58,SmiteGame,SMITE,Late Night Dad Vibes w/ !LokiDad,3158,2021-05-27 01:59:39,2021-05-27T04:06:03.226352
59,erobb221,Call of Duty: Warzone,xD,3139,2021-05-27 00:58:23,2021-05-27T04:06:03.226352
60,Umbra,Dead by Daylight,back to live servers because i miss short queue times,3048,2021-05-27 02:33:51,2021-05-27T04:06:03.226352
61,Beaulo,Tom Clancy's Rainbow Six Siege,Yo | !prime !charm !r6loot,3046,2021-05-27 03:31:08,2021-05-27T04:06:03.226352
62,Criken,Kenshi,The Fog Man Cometh - Kenshi Hive Adventures Series Ep. 4 !hive,2961,2021-05-27 00:26:23,2021-05-27T04:06:03.226352
63,EternaLEnVyy,Dota 2,years late for 10k trying new ideas b4 11k !raffle !binance,2903,2021-05-26 23:19:43,2021-05-27T04:06:03.226352
64,AussieAntics,Fortnite,"Viewing Party for Typical Gamer $10,000 Trio Tourney | Predictions Pog",2794,2021-05-26 23:24:30,2021-05-27T04:06:03.226352
65,Sequisha,Dead by Daylight,🏝️SLOT-TUB Stream🍀,2787,2021-05-26 23:04:15,2021-05-27T04:06:03.226352
66,keife_,NBA 2K21,Wager Vs Neon !sub !prime,2748,2021-05-27 03:16:12,2021-05-27T04:06:03.226352
67,TeamSp00ky,Street Fighter V,Next Level Battle Circuit 63 SFV Teams - 1 sub = $1 crowdfund | !bracket !teamscore !matcherino !metaview !nordvpn !spooky ,2747,2021-05-26 23:20:57,2021-05-27T04:06:03.226352
68,SunBaconRelaxer,Hearthstone,YA ,2743,2021-05-26 22:35:08,2021-05-27T04:06:03.226352
69,KarasMai,League of Legends,NA Challenger JG - Best Kayn NA - Rank 1 Grind !discord !youtube ,2714,2021-05-27 01:00:06,2021-05-27T04:06:03.226352
70,iateyourpie,Pokémon FireRed/LeafGreen,!YoC !Lastrun | LONG Kaizo !ironMON Stream | I'll be off May 27th-29th,2704,2021-05-26 21:44:59,2021-05-27T04:06:03.226352
71,roflgator,Grand Theft Auto V,(NoPixel) EARLY ROBERT POG - Then Hangout with friends,2693,2021-05-27 03:00:13,2021-05-27T04:06:03.226352
72,mang0,Super Smash Bros. Melee,hungover man gets back to work,2610,2021-05-26 23:10:54,2021-05-27T04:06:03.226352
73,Faide,Apex Legends,solo pubs // !socials !playlist !youtube !newvid,2606,2021-05-27 01:31:12,2021-05-27T04:06:03.226352
74,AsmodaiTV,Hearthstone,Top 50 leaderboard climb! !youtube,2600,2021-05-27 01:01:01,2021-05-27T04:06:03.226352
75,Chica,Fortnite,RANDOMSSSSSS:D || LG CHICA !sub,2496,2021-05-27 02:01:52,2021-05-27T04:06:03.226352
76,Arcadum,Solasta: Crown of the Magister,Solasta / Hardcore Run / No Elp Needed / Sponsored Stream,2491,2021-05-27 00:52:25,2021-05-27T04:06:03.226352
77,actingliketommy,Fortnite,Typical Gamer Cup w/delay | Oldest Pro Grinding  (Your Mom) ❤️ !newvid !podcast !fncs !locker GET INSPIRED BOSS ❤️,2478,2021-05-27 02:34:14,2021-05-27T04:06:03.226352
78,JessuTV,Music,beats guaranteed to boost your serotonin ♪ ♫ ♬,2472,2021-05-27 01:01:07,2021-05-27T04:06:03.226352
79,Quantum,League of Legends,"Oldge GM Midlaner Soloq grind - Nick at Night - !discord
",2396,2021-05-27 02:05:05,2021-05-27T04:06:03.226352
80,Zapman,SMITE,Hunters nerfed to the ground. Time to switch roles? | Solar Scarabs,2378,2021-05-26 21:24:34,2021-05-27T04:06:03.226352
81,daltoosh,Dread Hunger,Sweet epic dope crazy awesome hair reveal ,2354,2021-05-26 22:03:52,2021-05-27T04:06:03.226352
82,CalebDMTG,Magic: The Gathering,Vintage Cube! :o MH2 Spoiler @ 8 CST | Gaby-and-LSV Cube ,2345,2021-05-26 22:53:12,2021-05-27T04:06:03.226352
83,Artosis,StarCraft,S RANK GO. Also HUGE goal with !Star Trek #ad,2339,2021-05-27 00:27:59,2021-05-27T04:06:03.226352
84,Wendy_Hower,Slots,💎 Road to 30+ BTC / $50K GIVEAWAY! Passive Income @ $200/day strategy - !stake To Follow The Strategy 💎,2329,2021-05-27 02:29:53,2021-05-27T04:06:03.226352
85,BarbarousKing,God of War II,Titan Mode - God of War MARATHON,2296,2021-05-26 23:01:53,2021-05-27T04:06:03.226352
86,CrReaM,Generation Zero,You Just Gonna Ask What We Playing Anyway - !engage !VPN,2278,2021-05-27 01:14:27,2021-05-27T04:06:03.226352
87,zwebackhd,FIFA 21,SERIE A TOTS FULL SEND! BARELLA GRIND! @ZWEBACKHD,2200,2021-05-27 00:10:36,2021-05-27T04:06:03.226352
88,MarineMammalRescue,"Pools, Hot Tubs, and Beaches",🦦 Chill with Rescued Sea Otters 🦦 🪀 NEW TOYS 🐻 THICCEST FUR 🔥 HOTTEST 🔥 #1 Cold Tub 🧊🛁💦🌊 Stream :P,2167,2021-05-25 05:44:45,2021-05-27T04:06:03.226352
89,BobbyPoffGaming,Call of Duty: Warzone,Warzone w/ Envy BobbyPoff | Code BOBBYPOFF in COD store | !cameo !code !envy !wr,2141,2021-05-26 20:35:15,2021-05-27T04:06:03.226352
90,Silvervale,Biomutant,🌸GIVEAWAY!! KUNGFU RODENT ADVENTURES! 🌸 【VTuber】 VSHOJO !giveaway !music !ashes !merch !links !mods,2074,2021-05-27 02:04:38,2021-05-27T04:06:03.226352
91,BigEx,,yaooo was poppin,2039,2021-05-27 03:20:42,2021-05-27T04:06:03.226352
92,TapL,Minecraft,(1.16 SPEEDRUNS) WE WILL GET PB TODAY.,2027,2021-05-27 03:30:06,2021-05-27T04:06:03.226352
93,FanumTV,Fall Guys: Ultimate Knockout,"AMP FANUM ON FALL GUYS BUT HE DONT FALL
",2015,2021-05-27 02:12:14,2021-05-27T04:06:03.226352
94,DaddyDimmuTV,MLB The Show 21,!NMS NEW COLLECTION COMIN  !youtube !twitter !merch,2001,2021-05-27 03:00:32,2021-05-27T04:06:03.226352
95,kianlawley,Just Chatting,"CHILL L8 NITE STREEM, COME HANG",1995,2021-05-27 03:40:00,2021-05-27T04:06:03.226352
96,Snip3down,Apex Legends,Ranked w/ Hal and Baron // !webull,1943,2021-05-26 21:18:06,2021-05-27T04:06:03.226352
97,Linkus7,Minecraft,Minecraft Any% RSG runs to DESTROY Smallant!,1937,2021-05-26 18:35:54,2021-05-27T04:06:03.226352
98,Jay3,Overwatch,Hello and good day | !gfuel !corsair !social !merch,1911,2021-05-27 01:03:05,2021-05-27T04:06:03.226352
99,Aphromoo,League of Legends,league bby,1890,2021-05-27 01:55:23,2021-05-27T04:06:03.226352
