,user_name,game_name,title,viewer_count,started_at,api_call_time
0,Mizkif,Just Chatting,"OTK SCHOOLED $10,000 FINALE | powered by Cash App | !otkmerch",107666,2021-06-21 20:01:23,2021-06-21T21:06:03.143789
1,xQcOW,Grand Theft Auto V,{NoPixel Public} X SEARCHES FAR AND WIDE FOR LOST GREEN LIBRARY CARD (FINAL CHAPTER),65137,2021-06-21 05:49:47,2021-06-21T21:06:03.143789
2,Rainbow6,Tom Clancy's Rainbow Six Siege,Team Secret vs Rogue | European League 2021 Stage 2 Playday 2,44418,2021-06-21 15:15:08,2021-06-21T21:06:03.143789
3,NICKMERCS,Call of Duty: Warzone,Fraggin' | Code: MFAM | @NICKMERCS,40611,2021-06-21 15:42:47,2021-06-21T21:06:03.143789
4,HasanAbi,Just Chatting,TALKING TO ETHAN KLEIN ABOUT SAM SEDER VS. CROWDER!!!! !guest,40162,2021-06-21 18:50:40,2021-06-21T21:06:03.143789
5,Philza,Minecraft,Hardcore boi weeeeee - !s4 - 1.17,34744,2021-06-21 17:00:31,2021-06-21T21:06:03.143789
6,TimTheTatman,Call of Duty: Warzone,NEW MERCH! GET IT BEFORE ITS GONE! timthetatman.com/merch ,33045,2021-06-21 15:08:38,2021-06-21T21:06:03.143789
7,buddha,Grand Theft Auto V,Lang Buddha - NoPixel | !website !tiktok,30155,2021-06-21 16:11:42,2021-06-21T21:06:03.143789
8,Nihachu,Minecraft,Beating 1.17 for the first time with Rotpilz!!,25809,2021-06-21 20:29:49,2021-06-21T21:06:03.143789
9,RatedEpicz,Grand Theft Auto V,Randy Bullet | Chang Gang | NoPixel | !youtube !newvid,22400,2021-06-21 19:34:51,2021-06-21T21:06:03.143789
10,Crendor,World of Warcraft,"More chill WoW TBC Leveling, #sponsored by Metro by T-Mobile",21293,2021-06-21 19:09:11,2021-06-21T21:06:03.143789
11,LIRIK,TrackMania,LOL,20962,2021-06-21 16:16:20,2021-06-21T21:06:03.143789
12,Aydan,Call of Duty: Warzone,$100k JGOD Quals w/ Rated | !yt !gfuel,19927,2021-06-21 17:40:05,2021-06-21T21:06:03.143789
13,Jankos,League of Legends,"Solo Q, SUMMER SPLIT PREP. The best player in the world pushing S11 !YT",15213,2021-06-21 17:20:01,2021-06-21T21:06:03.143789
14,Brawlhalla,Brawlhalla, Esports PRO dev stream!,14918,2021-06-21 20:52:39,2021-06-21T21:06:03.143789
15,AdmiralBahroo,Terraria,"God Gamer Vs Clown in Terraria Deathmatch | !Vacation
",14347,2021-06-21 15:00:44,2021-06-21T21:06:03.143789
16,Swagg,Call of Duty: Warzone,"$100,000 JGOD Tourney | CODE: SWAGG | !sub !blm",13953,2021-06-21 18:05:17,2021-06-21T21:06:03.143789
17,Gorgc,Dota 2,time to win (lose),11865,2021-06-21 14:32:09,2021-06-21T21:06:03.143789
18,forsen,ppL: The Animated Adventures,ppL The Animated Adventures!,11823,2021-06-21 17:04:57,2021-06-21T21:06:03.143789
19,Ramee,Grand Theft Auto V,Ramee | !Twitter | Chang Gang | NoPixel,11426,2021-06-21 18:53:26,2021-06-21T21:06:03.143789
20,Quin69,Terraria,THE BATTLE OF THE GOD GAMERS ft. a panda VTuber & a deranged clownhaired man,11356,2021-06-21 14:02:21,2021-06-21T21:06:03.143789
21,vinnie,VALORANT,playin w saul,9822,2021-06-21 17:56:23,2021-06-21T21:06:03.143789
22,Otzdarva,Dead by Daylight,Still no perks to make the Killer's ass fatter 😪 || !faq !merch !streak,9582,2021-06-21 17:00:04,2021-06-21T21:06:03.143789
23,Yassuo,Slots,18+ 10K to 100K Challenge (attempt #3) !rollbit !profit #ad,9188,2021-06-21 20:09:32,2021-06-21T21:06:03.143789
24,AsunaWEEB,VALORANT,100T Asuna LAST DAY OF SEASON | [!duo] [!newvid] [!socials] [!patch],8684,2021-06-21 12:47:56,2021-06-21T21:06:03.143789
25,Northernlion,Just Chatting,SCHOOLED FINALS | !wealthsimple !docket !prime,8416,2021-06-21 17:39:29,2021-06-21T21:06:03.143789
26,BoomerNA,Minecraft,🐸 BOOMERNA Hey :) 🐸 ⚬ !merch !cloak !socials ⚬ !discord ⚬ Twitter @BoomrNA,8348,2021-06-21 20:47:39,2021-06-21T21:06:03.143789
27,DiazBiffle,Call of Duty: Warzone,"$100,000 2v2 JGOD Tournament (DELAY) | !scuf | !youtube | @DiazBiffle",7706,2021-06-21 19:49:15,2021-06-21T21:06:03.143789
28,Pestily,Escape from Tarkov,Free Labs lets gooo | !MEME,7662,2021-06-21 18:40:55,2021-06-21T21:06:03.143789
29,TangoTek,Minecraft,Hermitcraft Season 8!,7607,2021-06-21 20:31:23,2021-06-21T21:06:03.143789
30,itsRyanHiga,Minecraft,Talent Show day...  (OTV SMP),7392,2021-06-21 18:03:57,2021-06-21T21:06:03.143789
31,Chess,Chess,GM Hess and GM Naroditsky host 2021 Junior Speed Chess Championship - Qualifier 4 - !jscc !format !chesskid,7348,2021-06-21 14:44:31,2021-06-21T21:06:03.143789
32,fuslie,Minecraft,MINECRAFT TALENT SHOW then GTA COP RP public server!! ,7127,2021-06-21 20:22:31,2021-06-21T21:06:03.143789
33,MuTeX,Call of Duty: Warzone,"$100,000 Jgod Tournament w/ ScummN !tourney !socials",7078,2021-06-21 17:52:40,2021-06-21T21:06:03.143789
34,veibae,Ratchet & Clank: Rift Apart,hardest difficulty | furries welcome ❤ !yt !jp !prime,6958,2021-06-21 18:49:16,2021-06-21T21:06:03.143789
35,Payo,World of Warcraft,ALL-STAR EU RAID | ROGUE PVP - NEW !video,5879,2021-06-21 15:31:32,2021-06-21T21:06:03.143789
36,jakenbakeLIVE,Just Chatting,IRL Beach Stream w/ HAchubby + Wawa - Follow @jakenbakeLIVE on !Socials !YouTube,5756,2021-06-21 17:56:19,2021-06-21T21:06:03.143789
37,ClassyBeef,Slots,🔥 18+ | INSANE BONUS BUYS AND HIGHROLL!!🔥 !Tournament | !Stake for best Casino |,5601,2021-06-21 02:17:10,2021-06-21T21:06:03.143789
38,sweetdreams,Apex Legends,NRG Sweet ~ Ranked with Waz & Carson! !tiktok !youtube,5585,2021-06-21 20:29:38,2021-06-21T21:06:03.143789
39,SmallAnt,Minecraft,BEATING MY SPEEDRUN RECORD,5475,2021-06-21 20:08:21,2021-06-21T21:06:03.143789
40,Elajjaz,Mass Effect 3,First time Mass Effect 3 (day 6!) - !Displate @Elajjaz Twitter/Instagram,5336,2021-06-21 13:59:36,2021-06-21T21:06:03.143789
41,AbdulHD,Grand Theft Auto V,"Abdul ""Race Mogul"" NoPixel !SneakEnergy !Mayor 9kAndy !Socials #GoodVibes #ToxicFree [#1UAE]",5232,2021-06-21 15:02:51,2021-06-21T21:06:03.143789
42,Destiny,Just Chatting,Waiting for the Schooled Finale to start @ 1300 PST,5045,2021-06-21 18:37:27,2021-06-21T21:06:03.143789
43,dasMEHDI,Grand Theft Auto V,Ofc Knight - HUNTING YUNG DAB - NoPixel | !gfuel !merch !epic | TWITTER: @dasMEHDI,5042,2021-06-21 14:32:14,2021-06-21T21:06:03.143789
44,Tomato,Prison Simulator,Keeping these animals in line.,4828,2021-06-21 19:28:24,2021-06-21T21:06:03.143789
45,AvoidingThePuddle,Police Simulator: Patrol Officers,Police Simulator - Shirts and Mugs http://teespring.com/stores/ATP,4781,2021-06-21 20:06:56,2021-06-21T21:06:03.143789
46,ops1x,Just Chatting,tik tok w/ chat (118/8700 hours stream),4697,2021-06-21 07:12:09,2021-06-21T21:06:03.143789
47,Jinnytty,Just Chatting,Los Angeles Day 2 Market and Santa Monica Pier,4674,2021-06-21 18:23:36,2021-06-21T21:06:03.143789
48,Sacriel,Escape from Tarkov,Bri'ish Snipah || Follow @Sacriel 4 memes,4330,2021-06-21 14:09:09,2021-06-21T21:06:03.143789
49,daltoosh,Apex Legends,Sup goobers ,4199,2021-06-21 20:31:03,2021-06-21T21:06:03.143789
50,DanTDM,Minecraft,ONE BLOCK ONLY HARDCORE MODE,4171,2021-06-21 19:34:06,2021-06-21T21:06:03.143789
51,Shotz,Grand Theft Auto V,Vinny Pistone | Chang Gang | NoPixel | !VBI !PObox !Gfuel !Merch,4130,2021-06-21 14:42:46,2021-06-21T21:06:03.143789
52,Evo,Guilty Gear: Strive,FGC Arcade EVO Edition - EU Region : PS Tournaments,3990,2021-06-21 16:45:17,2021-06-21T21:06:03.143789
53,Craysin,Escape from Tarkov,Howdy Howdy Howdy!! l lvl 55 | Bitbot ( off ) ,3960,2021-06-21 16:02:39,2021-06-21T21:06:03.143789
54,TeePee,Call of Duty: Warzone,"WZ w/ EnVy TeeP | Code TEEP in COD Store #CODpartner | !cali | !monster | !merch | !guns | 2,150+ Wins, 5.15 KD | TylerTeeP on socials",3899,2021-06-21 13:34:38,2021-06-21T21:06:03.143789
55,HusKerrs,Call of Duty: Warzone,Duo Quads w/ JoeWo !slayout | Follow @HusKerrs on all !Socials !GFuel,3852,2021-06-21 19:59:21,2021-06-21T21:06:03.143789
56,NiceWigg,Apex Legends,BeSt CoNtRolLeR pLaYeR oN PC - !DROPS ENABLED! - LONGBOW HOURS - !socials ,3744,2021-06-21 18:10:52,2021-06-21T21:06:03.143789
57,kennybeats,Music,MONDAY BEAT BATTLE ,3716,2021-06-21 19:01:56,2021-06-21T21:06:03.143789
58,Emiru,Just Chatting,schooled finals uh oh !nordvpn !charity,3709,2021-06-21 17:43:59,2021-06-21T21:06:03.143789
59,OfficialBoaster,VALORANT,🔥FNATIC BOASTER RANKED VALORANT SCHOOL🔥 ,3661,2021-06-21 19:35:36,2021-06-21T21:06:03.143789
60,KhaosAdam,Grand Theft Auto V,Adam Ababwa | NoPixel | MDM | GNE GNE GNE,3646,2021-06-21 18:26:06,2021-06-21T21:06:03.143789
61,JGOD_Gaming,Call of Duty: Warzone,Day 3 of the $100k 2v2 JGOD Tourney !Bracketdetails !Bracket !Players !100k !loadout !meta,3621,2021-06-21 17:40:45,2021-06-21T21:06:03.143789
62,chocoTaco,PLAYERUNKNOWN'S BATTLEGROUNDS,TSM chocoTaco || PMA Monday,3533,2021-06-21 17:12:04,2021-06-21T21:06:03.143789
63,JustaMinx,Just Chatting,BOOKING A HAUNTED CASTLE,3532,2021-06-21 20:12:40,2021-06-21T21:06:03.143789
64,melina,Just Chatting,"very chill, a little hangover, come make me smile   | insta: melina.goransson",3511,2021-06-21 20:27:31,2021-06-21T21:06:03.143789
65,Zentreya,Subnautica,#banmonday ITS FUNDAY / WELCOME HOME CHAT | !merch ,3507,2021-06-21 16:37:15,2021-06-21T21:06:03.143789
66,RollingStone,Music,Tom DeLonge stops by to talk new 'Angels & Airwaves' and more! | RS Daily,3471,2021-06-21 19:54:48,2021-06-21T21:06:03.143789
67,Whaazz,World of Warcraft,@Whaazz 3v3 RLD! BlizzCon Champion 3655XP RETAIL ANDY taking over TBC PvP?! ,3398,2021-06-21 16:07:24,2021-06-21T21:06:03.143789
68,kyliebitkin,Grand Theft Auto V,Nopixel WL | Lt. Brittany Angel (: | !merch !discord !links,3384,2021-06-21 15:33:13,2021-06-21T21:06:03.143789
69,CurtisRyan,Grand Theft Auto V,Curtis - NoPixel WL - Twitter: @CurtisRyan__,3368,2021-06-21 16:57:55,2021-06-21T21:06:03.143789
70,Distortion2,Resident Evil Village,RE8 No Intro Village of Shadows Speedruns !displate !nointro,3364,2021-06-21 15:01:14,2021-06-21T21:06:03.143789
71,itsHafu,Slots,HAFU -- 18+ Gamba stream !stake #ad ,3354,2021-06-21 18:29:17,2021-06-21T21:06:03.143789
72,Hirona,Grand Theft Auto V,Trooper Copper | GTARP NoPixel,3312,2021-06-21 17:56:49,2021-06-21T21:06:03.143789
73,MiltonTPike1,Grand Theft Auto V,MASTER OF SCIENCE Kiki Chanel | NP 3.0 WL | !NordVPN,3250,2021-06-21 19:01:14,2021-06-21T21:06:03.143789
74,NateHill,Fortnite,Thanos cup with Funk at 6:00 | !positivity !situps,3166,2021-06-21 18:58:23,2021-06-21T21:06:03.143789
75,scruffoftheneck,Music,Scruff of the Neck TV - Fredrik Ferrier & KoolKid LIVE,3029,2021-06-21 18:29:51,2021-06-21T21:06:03.143789
76,Sajam,Guilty Gear: Strive,"Sajam: Will It Kill Friday, Strive Character Strength, Lab Q&A, Gaming! ",3014,2021-06-21 19:48:39,2021-06-21T21:06:03.143789
77,SmiteGame,SMITE,Fully a Twitch Streamer Now :) !nvad3,2990,2021-06-21 20:11:31,2021-06-21T21:06:03.143789
78,TheRunningManZ,DayZ,"Some DayZ maybe expy, maybe not. !patch !pc !merch",2909,2021-06-21 12:38:18,2021-06-21T21:06:03.143789
79,Natsumiii,Just Chatting,big moist stream |  mc talent show @ 3pm <3 ,2857,2021-06-21 17:33:47,2021-06-21T21:06:03.143789
80,Taylor_Jevaux,"Pools, Hot Tubs, and Beaches",LARA CROFT WORKOUT+TRY ON 🔥 !socials,2691,2021-06-21 19:06:46,2021-06-21T21:06:03.143789
81,Grimm,VALORANT,"IM BACK, THE SAGE GUY IS BACK | no delay, !STR",2637,2021-06-21 19:01:11,2021-06-21T21:06:03.143789
82,QuickyBaby,World of Tanks,TIME FOR TANKS - Finishing Battle Pass & Getting Char Futur 4 - 3300+WN8 - 21/06/2021,2635,2021-06-21 14:58:50,2021-06-21T21:06:03.143789
83,PDPlays1,Sports,The End of Group B Watch Party!,2632,2021-06-21 19:02:57,2021-06-21T21:06:03.143789
84,BotezLive,Just Chatting,MIZKIF SCHOOLED,2590,2021-06-21 20:24:26,2021-06-21T21:06:03.143789
85,Linkus7,The Legend of Zelda: The Wind Waker,Crowd Control for Wind Waker FIRST SHOWCASE,2582,2021-06-21 18:10:05,2021-06-21T21:06:03.143789
86,GernaderJake,Destiny 2,Trials Powered By !Xfinity #Sponsored,2564,2021-06-21 13:58:38,2021-06-21T21:06:03.143789
87,bmkibler,Hearthstone,I survived Vegas. Pls sub with prime to cover my blackjack losses. ,2545,2021-06-21 17:02:05,2021-06-21T21:06:03.143789
88,Wardiii,StarCraft II,ESL Open Cup EU | !MERCH !NORDVPN,2502,2021-06-21 10:53:25,2021-06-21T21:06:03.143789
89,spoopykitt,"Pools, Hot Tubs, and Beaches",💫 Hoop Dancing 💫 !snap !fansign,2482,2021-06-21 16:18:54,2021-06-21T21:06:03.143789
90,KristoferYee,Just Chatting,Glass Keyboard Giveaway :) | !giveaway,2459,2021-06-21 19:24:04,2021-06-21T21:06:03.143789
91,Emongg,Overwatch,GOING TO WIN MORE GAMES BY WINNING - !shock !ibuypower !minecraft,2436,2021-06-21 14:43:38,2021-06-21T21:06:03.143789
92,Kirsty_Bell,Slots,💎 $50K GIVEAWAY ($400K START) 💎 !stake IN THE CHAT FOR SIGNUP BONUSES 🔥 Passive Betting Strategy for $200+/day 🔥,2369,2021-06-21 12:01:34,2021-06-21T21:06:03.143789
93,Sanchovies,League of Legends,lets get carter his nuggets guys,2347,2021-06-21 19:59:51,2021-06-21T21:06:03.143789
94,FollowGrubby,Heroes of the Storm,New Patch again?? - Stukov back? - w/ cassmocam,2321,2021-06-21 17:11:34,2021-06-21T21:06:03.143789
95,Leffen,Guilty Gear: Strive,MILLA CAN DO IT? (COPIUM) - PC Mods | TSM FTX,2278,2021-06-21 19:42:52,2021-06-21T21:06:03.143789
96,ChompixGaming,Dota 2,SG e-sports vs Infamous | INVIE - Official EN broadcast ,2254,2021-06-21 19:52:34,2021-06-21T21:06:03.143789
97,Lobanjicaa,Counter-Strike: Global Offensive,!FPL & SURPRISE VIDEO TONIGHT | KNIFE GIVEAWAY TONIGHT | !gamersupps !hellcase !gamdom !shadowpay,2240,2021-06-21 19:38:47,2021-06-21T21:06:03.143789
98,BTMC,TETR.IO,"JUST ONE GAME, I PROMISE | COPIUM | !honey !gfuel",2225,2021-06-21 17:07:40,2021-06-21T21:06:03.143789
99,cyr,Grand Theft Auto V,UCHI JONES - NOPIXEL 3.0. APRIL-CHAN/RAMEE DRAMA. IT GOES DOWN TODAY. RAMEE MALDING SIMULATOR 8.0 SPECIAL DELUXE EDITION !YT !TIKTOK,2192,2021-06-21 17:41:17,2021-06-21T21:06:03.143789
