,user_name,game_name,title,viewer_count,started_at,api_call_time
0,xQcOW,Slots,+18 !stake MAN GAMBLES HIS 401K AWAY IN MINUTES,129226,2021-05-27 19:51:09,2021-05-28T00:06:02.506991
1,RanbooLive,Life is Strange,Being strange? Idk I sure hope it does! (TW FOR UNSETTLING CONTENT. BE SAFE!),73898,2021-05-27 21:30:04,2021-05-28T00:06:02.506991
2,Sykkuno,Grand Theft Auto V,yuno does the things !,47311,2021-05-27 17:31:32,2021-05-28T00:06:02.506991
3,shroud,Conan Exiles,[drops enabled] !Conan Exiles Isle of Siptah #ad | Follow @shroud on socials,43402,2021-05-27 14:52:19,2021-05-28T00:06:02.506991
4,loltyler1,League of Legends,ANGER HIM ! AND WHAT happen ? well finder the way outs if do it lol not going liked this !,40083,2021-05-27 15:58:13,2021-05-28T00:06:02.506991
5,HasanAbi,Just Chatting,"NEW COUPLE, SAME CHICKEN. 90DAY NOW!!! | !texas !podcast",30644,2021-05-27 18:35:34,2021-05-28T00:06:02.506991
6,Maya,Just Chatting,HOUSEWIVES IN PERSON ,27830,2021-05-27 22:21:22,2021-05-28T00:06:02.506991
7,MOONMOON,Grand Theft Auto V,[powergaming] NoPixel cop | tasing any criminal in range instantly,25429,2021-05-27 22:22:44,2021-05-28T00:06:02.506991
8,buddha,Grand Theft Auto V,VAULT DAY - Lang Buddha - NoPixel,25025,2021-05-27 16:07:36,2021-05-28T00:06:02.506991
9,futs0004,,,18549,2021-05-27 23:05:46,2021-05-28T00:06:02.506991
10,RatedEpicz,Grand Theft Auto V,Randy Bullet | Chang Gang | GTA V RP | NoPixel | !youtube !newvid,17972,2021-05-27 19:59:31,2021-05-28T00:06:02.506991
11,HusKerrs,Call of Duty: Warzone,"$25,000 Code Red Tournament !giveaway !slayout | Follow @HusKerrs on all !Socials !GFuel",17836,2021-05-27 18:15:58,2021-05-28T00:06:02.506991
12,ludwig,Just Chatting,STREAMER OF THE YEAR XQC'S BEST FRIEND LIVE IN TEXAS,16747,2021-05-27 23:07:07,2021-05-28T00:06:02.506991
13,pokimane,VALORANT,diamond solo q climb 💪😤,16612,2021-05-27 20:26:47,2021-05-28T00:06:02.506991
14,RiceGum,Just Chatting,I need a GF! OMG,15688,2021-05-27 23:28:16,2021-05-28T00:06:02.506991
15,Mizkif,Conan Exiles,PLAYING CONAN EXILES WITH SHROUD! New Conan Exiles DLC: Isles of Siptah !conan #ad,15004,2021-05-27 22:23:01,2021-05-28T00:06:02.506991
16,Doublelift,League of Legends,Doublelift - seeing how ADC feels after the patch,12807,2021-05-27 19:54:58,2021-05-28T00:06:02.506991
17,btscsgo,Counter-Strike: Global Offensive,LIVE: Extra Salt vs EXTREMUM (Bo3) - cs_summit 8 NA RMR - Playoffs: Day 2,11693,2021-05-27 21:00:59,2021-05-28T00:06:02.506991
18,Ramee,Grand Theft Auto V,Ramee | !Twitter | NoPixel | Chang Gang ,11286,2021-05-27 19:04:04,2021-05-28T00:06:02.506991
19,DiazBiffle,Call of Duty: Warzone,25k Code Red Tourney | !scuf | !gfuel | !youtube | @DiazBiffle,10664,2021-05-27 20:05:17,2021-05-28T00:06:02.506991
20,LVNDMARK,Escape from Tarkov,FILTER EMOTE | !YOUTUBE | !GFUEL | !MERCH | Follow @LVNDMARK_tv on socials,10144,2021-05-27 19:35:54,2021-05-28T00:06:02.506991
21,luxx,League of Legends: Wild Rift,I am a Samsung Mobile Hero!⭐🎵🌠🎶⭐ opening a very cool Samsung VIP box & playing on my Galaxy S21 #ad powered by Samsung Galaxy,9705,2021-05-27 22:07:23,2021-05-28T00:06:02.506991
22,Zerkaa,Grand Theft Auto V,TOMMY TATE | NoPixel RP (!sidemenrp - !rp - !meta - !chathopping),9446,2021-05-27 19:10:33,2021-05-28T00:06:02.506991
23,BoweryPresents,Music,"SHAED - Live from Brooklyn Steel, presented by Toyota",8937,2021-05-27 22:54:51,2021-05-28T00:06:02.506991
24,BeyondTheSummit,Dota 2,LIVE: 4 Zoomers vs. D2 Hustlers (Bo2) - LOOT.BET Pro Series 6: NA/SA Group Stage w/ KMart & ET,8920,2021-05-27 14:25:29,2021-05-28T00:06:02.506991
25,CohhCarnage,Chivalry 2,CHIVALRY 2ARRGGHH! - Solasta continues TOMORROW! - !FinalWeek - !VODChat - #EpicPartner Creator Code: Cohh,8798,2021-05-27 22:32:25,2021-05-28T00:06:02.506991
26,masondota2,Dota 2,+1000MMR IN 6 DAYS,7692,2021-05-27 19:46:47,2021-05-28T00:06:02.506991
27,ChilledChaos,Gartic Phone,THESE DRAWINGS ARE CURSED! (Gartic Phone w/ Friends) | Among Us x ToS after!,7581,2021-05-27 18:40:13,2021-05-28T00:06:02.506991
28,Foolish__Gamers,Minecraft,Twitch Rivals REAL WINNER'S POV ,7142,2021-05-27 15:27:48,2021-05-28T00:06:02.506991
29,Ninja,Final Fantasy XI Online,"[Wings] FFXI addict WingsXI.com | SUPER CHILL stream today, hang out, vibe LEVELING | ",6817,2021-05-27 17:05:46,2021-05-28T00:06:02.506991
30,SmallAnt,Minecraft,BEATING DREAMS SPEEDRUN (I need to save 7s),6654,2021-05-27 20:21:54,2021-05-28T00:06:02.506991
31,TeeGrizzley,Grand Theft Auto V,We Outside...,6637,2021-05-27 22:42:51,2021-05-28T00:06:02.506991
32,daltoosh,Apex Legends,INTENSE CRAZY SWEATY ARENA QUEUE SNIPES WITH CRACKED GAMERS !yt,6627,2021-05-27 20:33:35,2021-05-28T00:06:02.506991
33,agrandeao,Special Events,iHeart Radio Music Awards 2021,6434,2021-05-27 23:55:43,2021-05-28T00:06:02.506991
34,Pieface23,FIFA 21,(UK) The Final Shot for CR7! (Potential for F1 Later),6245,2021-05-27 21:39:52,2021-05-28T00:06:02.506991
35,Punz,Minecraft,TWITCH RIVALS | !gfuel !merch | @Punztw on Twitter and Insta,6106,2021-05-27 19:56:49,2021-05-28T00:06:02.506991
36,Tectone,Genshin Impact,MIMI TOMO ROMANCING HILLICHURLS (HOPE I DON'T GET PREGNANT CX),5986,2021-05-27 23:12:27,2021-05-28T00:06:02.506991
37,BotezLive,Just Chatting,HARDCORE CHESS TRAINING | !chess !insta,5920,2021-05-27 21:59:14,2021-05-28T00:06:02.506991
38,ironmouse,Just Chatting,ONCE AGAIN I MAKE A BAD DECISION WHEN WILL I LEARN,5853,2021-05-27 23:22:03,2021-05-28T00:06:02.506991
39,Nightblue3,League of Legends,CRACKO MODE UNFATHOMABLE ACTIONS PER MINUTE CHALLENGER PLAYER,5725,2021-05-27 18:54:00,2021-05-28T00:06:02.506991
40,Kiyoon,Teamfight Tactics,"TSM Kiyoon | 1265 LP START | it clicked, 3 star your kids at 6 | !yt !blitz
",5638,2021-05-27 20:21:35,2021-05-28T00:06:02.506991
41,QuarterJade,VALORANT,hello fellow gamers,5581,2021-05-27 20:36:13,2021-05-28T00:06:02.506991
42,TeePee,Call of Duty: Warzone,"WZ w/ EnVy TeeP | Code TEEP in COD Store #CODpartner | !cod | !monster | !merch | !envy | 2,045+ Wins, 5.09 KD | TylerTeeP on socials",5513,2021-05-27 14:56:41,2021-05-28T00:06:02.506991
43,Albralelie,Apex Legends,Evaluating the value of life while pubbing in apex,5392,2021-05-27 04:06:40,2021-05-28T00:06:02.506991
44,Rescue,Dead by Daylight,Click here for pandas,5179,2021-05-27 18:53:34,2021-05-28T00:06:02.506991
45,fuslie,Grand Theft Auto V,APRIL FOOZE | GTA RP NO PIXEL 3.0 ,5041,2021-05-27 22:19:15,2021-05-28T00:06:02.506991
46,Indiefoxx,"Pools, Hot Tubs, and Beaches",🍒GOT JUST DANCE FOR MY JACUZZI🍒👀💗IG:indiefoxx.tv💗!socials 💗 !incent,5036,2021-05-27 19:31:42,2021-05-28T00:06:02.506991
47,Tomato,Conan Exiles,Tomato and Dave say 'no' to weapons. Punch instead. Punch very hard. (Conan Exiles Permadeath),4716,2021-05-27 19:01:06,2021-05-28T00:06:02.506991
48,ops1x,Fortnite,skin cup,4670,2021-05-27 16:47:38,2021-05-28T00:06:02.506991
49,Scarra,Teamfight Tactics,new !offlinetv vid out | tft -> erbs with lily,4426,2021-05-27 16:58:55,2021-05-28T00:06:02.506991
50,snuffy,Just Chatting,we watch funny video and we cry | ( ᵔ︠ ᴗ ︡ᵔ) vtuber !merch !links !gfuel,4424,2021-05-27 22:34:24,2021-05-28T00:06:02.506991
51,Dezsaras,Warframe,!stjude | [Warframe Creator] Matching donations >$250 !match | Delete my Gear !incentives | !giveaway !yt !discord,4423,2021-05-27 23:29:31,2021-05-28T00:06:02.506991
52,lilypichu,Eternal Return: Black Survival,borgor,4398,2021-05-27 21:28:05,2021-05-28T00:06:02.506991
53,MuTeX,Call of Duty: Warzone,Code Red Warzone $25k Tournament w/ ClutchBelk,4379,2021-05-27 19:39:29,2021-05-28T00:06:02.506991
54,Pestily,Age of Empires II,THE GREAT SHAVE DAY! | !AMA,4315,2021-05-27 18:57:53,2021-05-28T00:06:02.506991
55,SmiteGame,SMITE,Controller Queues with Olympian !biackeye,4288,2021-05-27 21:29:56,2021-05-28T00:06:02.506991
56,VALORANT,VALORANT,(REBROADCAST) NUTURN Gaming vs Version1 - VCT Masters Reykjavík,4233,2021-05-27 23:36:07,2021-05-28T00:06:02.506991
57,Zoomaa,Call of Duty: Black Ops Cold War,"THE FLANK, STAGE 4 WEEK 1",4211,2021-05-27 22:32:20,2021-05-28T00:06:02.506991
58,hexy,Dead by Daylight,NEW STUFF HOLY MOLLY - #SAFEMOON HODL 🚀 - @hexytv,4196,2021-05-27 19:33:12,2021-05-28T00:06:02.506991
59,NBA2KLeague,NBA 2K21,Season 4 Week 1  - Bounce Pass Thursdays,4142,2021-05-27 22:45:06,2021-05-28T00:06:02.506991
60,Destroy,Call of Duty: Warzone,"$25,000 2v2 Code Red Tourney w/ ZLaner!",4079,2021-05-27 16:46:41,2021-05-28T00:06:02.506991
61,BoomTV,Call of Duty: Warzone,"$25,000 Warzone Code Red !bracket",3890,2021-05-27 19:49:52,2021-05-28T00:06:02.506991
62,Purpled,Minecraft,Twitch Rivals Winning POV,3828,2021-05-27 19:57:15,2021-05-28T00:06:02.506991
63,FENGRUSH,Enlisted,FG 42 IS STRONGK - !Artesian for Custom PC Builds ,3797,2021-05-27 16:28:45,2021-05-28T00:06:02.506991
64,NiceWigg,Apex Legends,ROAD TO MASTERS WITH GAMECUBE CONTROLLER ON PC (SILVER 3) - WE GOT IT FIXED - !SOCIALS ,3793,2021-05-27 18:44:13,2021-05-28T00:06:02.506991
65,SquishyMuffinz,Rocket League,ROAD TO 1 MILLI | Chillin | follow me @SquishyMuffinz,3786,2021-05-27 22:07:50,2021-05-28T00:06:02.506991
66,AnthonyZ,Grand Theft Auto V,"!Giveaway | Tony ""GAMBA"" Corleone | NoPixel | STREAMS MON-SAT 9:30AM CT",3762,2021-05-27 20:10:08,2021-05-28T00:06:02.506991
67,Ekuegan,Destiny 2,FARMING !UZUME GODROLL? !YT,3737,2021-05-27 19:53:21,2021-05-28T00:06:02.506991
68,Payo,World of Warcraft,PREPATCH ROGUE ONE SHOT MACRO - !BONUS VIDEO,3719,2021-05-27 16:52:29,2021-05-28T00:06:02.506991
69,superleague,Rocket League,Watch Super League Arena ft Rocket League,3666,2021-05-27 21:57:58,2021-05-28T00:06:02.506991
70,The_Happy_Hob,Dark Souls III,The Final Bet! !newbet - PYRO All Boss No Hit Run Prep /w DLC [122] [Chapter 1896: 100 subs everyday until homeless],3620,2021-05-27 17:50:56,2021-05-28T00:06:02.506991
71,CaptainPuffy,Minecraft,Twitch Rivals: NA MineDraft Showdown 35K TOURNAMENT! | !displate,3515,2021-05-27 18:57:12,2021-05-28T00:06:02.506991
72,Co1azo,Fortnite,Deathstroke Tourney! | !gfuel !scuf !socials !newvid | TSM Co1azo,3459,2021-05-27 21:09:20,2021-05-28T00:06:02.506991
73,KYR_SP33DY,Minecraft,Minecraft Twitch Rivals but I suck and have no sprint key.,3321,2021-05-27 19:31:41,2021-05-28T00:06:02.506991
74,NateHill,Fortnite,(Drops Enabled) Vibing till Creative Mayhem semis at 9 | !positivity !dips,3314,2021-05-27 21:46:48,2021-05-28T00:06:02.506991
75,CollegiateEsportsInv,Fortnite,Collegiate Esports Invitational: Day 2 Presented by Jersey Mikes!,3280,2021-05-27 21:50:34,2021-05-28T00:06:02.506991
76,Rizzo,Rocket League,Gaming with Turbo,3163,2021-05-27 19:14:28,2021-05-28T00:06:02.506991
77,jorbs,Slay the Spire,"84/100 heart kills in 26th/30 days | shorter day of spire today -> #sponsored look at tainted grail, new roguelite deckbuilder",3153,2021-05-27 21:20:10,2021-05-28T00:06:02.506991
78,CodeMiko,Just Chatting,AMA (Ask Me Anything),3056,2021-05-27 22:46:32,2021-05-28T00:06:02.506991
79,Ssaab,Grand Theft Auto V,Detective Samir Baasem - Cat & Mouse - NoPixel | !discord !karma ,3050,2021-05-27 17:49:38,2021-05-28T00:06:02.506991
80,Alinity,Just Chatting,towel in the hot tub,2961,2021-05-27 18:51:14,2021-05-28T00:06:02.506991
81,DannyGoonzalez,Minecraft,minecraft BATTLE,2960,2021-05-27 19:49:19,2021-05-28T00:06:02.506991
82,SpawnOnMe,Super Bomberman R Online,Super Bomberman R Online charity stream for Stand Up To Cancer! |!donate,2958,2021-05-27 21:55:06,2021-05-28T00:06:02.506991
83,Mathil1,Path of Exile,"Mathil - Pestilent Strike, ramping into endgame and thinking of new build?",2936,2021-05-27 20:02:08,2021-05-28T00:06:02.506991
84,IMPACTWrestling,Sports,"IMPACT! TONIGHT at 8/7c - Sami Callihan Kicks Off The Show, 10 KO Tag, TJP and Bahh vs. Petey and Alexander, VBD Address IMPACT and MORE! ",2901,2021-05-27 22:48:57,2021-05-28T00:06:02.506991
85,MiltonTPike1,Conan Exiles,DROPS ON! - !Conan - The Ding of the North! | Conan Exiles: Isle of Siptah #sponsored,2900,2021-05-27 17:00:42,2021-05-28T00:06:02.506991
86,Silvervale,It Takes Two,🌸Anime Waifu Divorce Simulator 🌸 【VTuber】 VSHOJO !music !ashes !merch !links !mods,2864,2021-05-27 22:58:15,2021-05-28T00:06:02.506991
87,Granny,Dead by Daylight,‪🍪 DBD Pride !merch #DeadByDaylightPartner 🍪,2856,2021-05-27 22:08:55,2021-05-28T00:06:02.506991
88,ESL_SC2b,StarCraft II,LIVE: Astrea vs PattyMac - DreamHack SC2 Masters: Summer 2021 - North America Group Stage,2818,2021-05-27 20:46:04,2021-05-28T00:06:02.506991
89,Ray__C,Grand Theft Auto V,BIG VAULT Heist w/ Buddha/Sykkuno/AnthonyZ - Getting the GOLD DONGLE!! !Team,2770,2021-05-27 21:29:22,2021-05-28T00:06:02.506991
90,erobb221,Bloodborne,"positive vibes :)
",2756,2021-05-27 21:00:10,2021-05-28T00:06:02.506991
91,ClassyBeef,Slots,🔥 INSANE BONUS BUYS NOW!! 🔥 | $50.000 !Tournament | !Stake for best Casino,2743,2021-05-27 20:05:03,2021-05-28T00:06:02.506991
92,Sanchovies,League of Legends,hi ✂️,2689,2021-05-27 22:48:06,2021-05-28T00:06:02.506991
93,FollowGrubby,Heroes of the Storm,Bonus Thursday HOTS --- !grubbyhots <- YT Sub to the QT Grub,2686,2021-05-27 16:52:52,2021-05-28T00:06:02.506991
94,Jukeyz,Call of Duty: Warzone,"$25,000 Code Red tourney w/Fifa @9pm BST | !socials !beaver !redbull",2674,2021-05-27 20:08:07,2021-05-28T00:06:02.506991
95,DansGaming,Conan Exiles,TWITCH DROPS! Conan Exiles DLC: Isles of Siptah (PC) *Sponsored*,2659,2021-05-27 21:52:12,2021-05-28T00:06:02.506991
96,MarineMammalRescue,"Pools, Hot Tubs, and Beaches",🦦 Chill with Rescued Sea Otters 🦦 🪀 NEW TOYS 🐻 THICCEST FUR 🔥 HOTTEST 🔥 #1 Cold Tub 🧊🛁💦🌊 Stream :P,2659,2021-05-27 05:44:53,2021-05-28T00:06:02.506991
97,ploo,VALORANT,hiwo | !corsair !elgato !blitz !gfuel,2658,2021-05-27 22:39:45,2021-05-28T00:06:02.506991
98,LCS,League of Legends,CC vs MU | College Championship 2021 – Round of 8 | Columbia vs Maryville,2423,2021-05-27 20:29:19,2021-05-28T00:06:02.506991
99,SunBaconRelaxer,Hearthstone,"Top 10 NA, Solary Tournament tmr at 11 AM PST",2410,2021-05-27 22:46:48,2021-05-28T00:06:02.506991
