,user_name,game_name,title,viewer_count,started_at,api_call_time
0,Flashpoint,Counter-Strike: Global Offensive,Heroic vs G2 | Flashpoint 3 - Day 9 | Upper Bracket Quarterfinals,98543,2021-05-20 15:17:24,2021-05-20T19:06:02.662830
1,NICKMERCS,Call of Duty: Warzone,Fraggin' | Code: MFAM | @NICKMERCS,79299,2021-05-20 14:41:57,2021-05-20T19:06:02.662830
2,Rainbow6Bravo,Tom Clancy's Rainbow Six Siege,Team Empire vs Team oNe eSports // SIX INVITATIONAL 2021 – Quarterfinals – Day 2,66691,2021-05-20 08:12:12,2021-05-20T19:06:02.662830
3,Asmongold,World of Warcraft,HUGE TBC CHANGES--BIG DRAMA LOL--BOOSTED ANDY MC--MOUNT FARMING--COLLECTING ALL ITEMS,53281,2021-05-20 14:37:46,2021-05-20T19:06:02.662830
4,TimTheTatman,Call of Duty: Warzone,warzone update today - !youtube4,48306,2021-05-20 15:32:49,2021-05-20T19:06:02.662830
5,benjyfishy,Fortnite,DUO DREAMHACK FINALS,31423,2021-05-20 17:39:06,2021-05-20T19:06:02.662830
6,buddha,Grand Theft Auto V,Lang Buddha - NoPixel,31032,2021-05-20 16:01:45,2021-05-20T19:06:02.662830
7,Foolish__Gamers,Minecraft,Media Share!!! - Dream SMP,30283,2021-05-20 16:01:27,2021-05-20T19:06:02.662830
8,PlayOverwatch,Overwatch,Overwatch 2 Developer PVP Livestream,22630,2021-05-20 18:45:52,2021-05-20T19:06:02.662830
9,Gorgc,Dota 2,9k before june or bald :) - 8790,20499,2021-05-20 15:07:16,2021-05-20T19:06:02.662830
10,Yassuo,Slots,18+ 10K Start - Gambling is a sin and I'm a sinner !Rollbit #ad,18526,2021-05-20 16:46:38,2021-05-20T19:06:02.662830
11,HasanAbi,Just Chatting,11 DAYS OF BOMBING - 4 CEASEFIRES BLOCKED BY THE US,16885,2021-05-20 18:47:12,2021-05-20T19:06:02.662830
12,forsen,The Last of Us Part II,First playthrough of The Last of Us 2! New 60 fps ps5 patch!,16670,2021-05-20 16:57:54,2021-05-20T19:06:02.662830
13,RatedEpicz,Grand Theft Auto V,Randy Bullet | Chang Gang | GTA V RP | NoPixel | !youtube !newvid,14678,2021-05-20 18:25:36,2021-05-20T19:06:02.662830
14,Jankos,League of Legends,SOLOQ VERY CALM DAY INDEED . The best player in the world pushing S11 !YT,14372,2021-05-20 16:35:34,2021-05-20T19:06:02.662830
15,elonmusk88880,Just Chatting,Elon Musk | Bitcoin and Ethereum Discuss !giveaway,13230,2021-05-20 19:01:27,2021-05-20T19:06:02.662830
16,Quin69,Frostpunk,"5+ GAMES, 1 STREAM - FROSTPUNK - BLIND",12177,2021-05-20 13:59:03,2021-05-20T19:06:02.662830
17,OverwatchLeague,Overwatch,Overwatch 2 Developer PVP Livestream,12153,2021-05-20 18:45:57,2021-05-20T19:06:02.662830
18,Fundy,Minecraft,VAULT HUNTERS DAY 12,11861,2021-05-20 18:49:04,2021-05-20T19:06:02.662830
19,ShivFPS,Apex Legends,Ranked with Sunset and Sanya | !Socials for updates,11442,2021-05-20 17:30:56,2021-05-20T19:06:02.662830
20,evaanna,Just Chatting,💦HOT TUB💦 !soсials !sub !donate ❤️🍑,11351,2021-05-20 16:34:40,2021-05-20T19:06:02.662830
21,ROSHTEIN,Slots,⭐ 100 BONUSES ON GATES ⭐ €1 MIL WIN - !RECORD 💠 check - !MBIT for 150% NON-STICKY💠!LOCO for 150%💠 !SUNPURA for 150%,11282,2021-05-20 18:48:33,2021-05-20T19:06:02.662830
22,DrLupo,Apex Legends,¯\_(ツ)_/¯,10626,2021-05-20 14:03:28,2021-05-20T19:06:02.662830
23,DeuceAce,Slots,🌰 €500.000 Buys & Spins brudda 🌰✨ !BEE for 150% ✨ !PAR for 150% ✨ !SHA for 150%,10321,2021-05-20 16:06:59,2021-05-20T19:06:02.662830
24,EsfandTV,Grand Theft Auto V,CORNWOOD GTARP THEN PREPATCH WOW - SHOOTING VIDEO AT 4 PM CST,10242,2021-05-20 16:05:26,2021-05-20T19:06:02.662830
25,superblindman,The Last of Us Part II,#GAAD and #TheLastOfUs2 Celebration! Superblindman Plays #TLOU2 on Grounded for #GAAD!,9612,2021-05-20 17:14:40,2021-05-20T19:06:02.662830
26,HusKerrs,Call of Duty: Warzone,"$25,000 MayDay Trios Tournament !giveaway !slayout | Follow @HusKerrs on all !Socials !GFuel",9341,2021-05-20 17:52:54,2021-05-20T19:06:02.662830
27,StableRonaldo_,Fortnite,DREAMHACK FINALS VIEWING PARTY WITH SPECIAL SPECIAL SPECIAL contestants ,9111,2021-05-20 16:24:51,2021-05-20T19:06:02.662830
28,cloakzy,Call of Duty: Warzone,Another day another meatloaf. 5.4KD+ !loadouts,9093,2021-05-20 14:30:43,2021-05-20T19:06:02.662830
29,AsunaWEEB,VALORANT,100T Asuna TOP 5 RADIANT RANKED | [!newvid] [!socials] [!leaderboard],9093,2021-05-20 16:33:05,2021-05-20T19:06:02.662830
30,TeePee,Call of Duty: Warzone,$25K London Royal Ravens WZ: Operation MayDay Tourney RIGHT NOW | Code TEEP in COD Store #CODpartner | !tourney | !patch |,8896,2021-05-20 13:54:04,2021-05-20T19:06:02.662830
31,Aydan,Call of Duty: Warzone,"$25,000 MayDay Trios Tournament w/ Rated & BadIntel | !yt !gfuel",8798,2021-05-20 17:57:46,2021-05-20T19:06:02.662830
32,Northernlion,Super Mario Party,it's my mario party and I'll cry if I want to | !abyss !prime !docket,7439,2021-05-20 18:00:14,2021-05-20T19:06:02.662830
33,Thebausffs,League of Legends,1234569789,7350,2021-05-20 15:52:10,2021-05-20T19:06:02.662830
34,AbdulHD,Grand Theft Auto V,"Abdul - NoPixel ""Court Day Vs The Police 9PM GMT"" !SneakEnergy #8KAndy #ToxicFree #GoodVibes #ChillStream #COYB [#1 UAE] !Socials !Discord",7190,2021-05-20 08:59:50,2021-05-20T19:06:02.662830
35,LinusTech,Science & Technology,I'm Bored. Build a Gaming PC with me!!,7012,2021-05-20 17:54:19,2021-05-20T19:06:02.662830
36,antoineah2020,Talk Shows & Podcasts,LE LIVE DU 20/05/2021 LE CHEMIN N'EST PAS FINI !!! RESTONS UNIS JUSQU'AU BOUT !!!  YOUTUBE: PLUS DE CHAINES YOUTUBE!!! ,6942,2021-05-20 18:00:47,2021-05-20T19:06:02.662830
37,ESL_SC2,StarCraft II,LIVE: Dreamhack SC2 Masters Summer EU Group Stage,6833,2021-05-20 09:51:36,2021-05-20T19:06:02.662830
38,Jinnytty,Just Chatting,"Installing ""Dancing"" Pole 😳 ",6539,2021-05-20 17:00:09,2021-05-20T19:06:02.662830
39,CallMeKevin,Totally Reliable Delivery Service,Irish Lads delivering packages in the worst way possible | HEARTBEAT MONITOR,6470,2021-05-20 16:02:12,2021-05-20T19:06:02.662830
40,Elajjaz,Ghost of Tsushima,Ghost of Tsushima (PS5) - First Playthrough! | !Displate @Elajjaz Twitter/Instagram,6459,2021-05-20 13:59:41,2021-05-20T19:06:02.662830
41,SquishyMuffinz,Rocket League,ROAD TO 1 MILLI | Chillin | follow me @SquishyMuffinz,6334,2021-05-20 16:35:14,2021-05-20T19:06:02.662830
42,fuslie,Apex Legends,morning!! APEX LEGENDS WITH RYAN AND EDISON,6321,2021-05-20 16:47:38,2021-05-20T19:06:02.662830
43,dakotaz,Dead by Daylight,DEAD BY DAKOTAZ the FLORIDA MAN,6159,2021-05-20 14:40:55,2021-05-20T19:06:02.662830
44,twitchgaming,Talk Shows & Podcasts,"The Weekly w/ SanchoWest and Ovilee May | Ft. Garry Kasparov, Darker4Serenity,  DeeNugLife and  Phantom Abyss Devs",6019,2021-05-20 17:45:05,2021-05-20T19:06:02.662830
45,dasMEHDI,Grand Theft Auto V,Ofc. Brian Knight - NoPixel | !pcgiveaway !gfuel !merch !epic | TWITTER: @dasMEHDI,5936,2021-05-20 14:03:54,2021-05-20T19:06:02.662830
46,ZoolifePenguins,Science & Technology,Nature Expert Q&A on Penguins ,5856,2021-05-20 15:00:09,2021-05-20T19:06:02.662830
47,Distortion2,Resident Evil Village,NG Village of Shadows Practice (Max Difficulty) | distSmirk new emote :),5833,2021-05-20 16:01:49,2021-05-20T19:06:02.662830
48,Anna_Chess,Chess,G Fuel gamer tries to play chess variants!! <3 #sponsored !gfuel !today,5747,2021-05-20 16:10:08,2021-05-20T19:06:02.662830
49,TheViper,Age of Empires II,yes ,5683,2021-05-20 16:08:03,2021-05-20T19:06:02.662830
50,nyanners,Just Chatting,i love it when water goes really fast ,5599,2021-05-20 18:40:41,2021-05-20T19:06:02.662830
51,Pestily,Escape from Tarkov,Second Giveaway Open | 5 PC Giveaway | !patchnews,5470,2021-05-20 17:55:35,2021-05-20T19:06:02.662830
52,sweetdreams,Apex Legends,NRG Sweet ~ Warming up for Twitch Rivals !rivals,5377,2021-05-20 17:46:00,2021-05-20T19:06:02.662830
53,BTMC,Travel & Outdoors,Exploring Downtown Lynchburg,5357,2021-05-20 16:44:40,2021-05-20T19:06:02.662830
54,uhSnow,Grand Theft Auto V,Trooper Snow | NoPixel | discord.gg/Snow,5313,2021-05-20 12:59:57,2021-05-20T19:06:02.662830
55,AussieAntics,Fortnite,Replay Mode Viewing Party/Commentary for EU DreamHack Finals | Sub Only Chat to Stop Spoilers ,5291,2021-05-20 17:15:14,2021-05-20T19:06:02.662830
56,Nikatine,Just Chatting,Top stories and then WildRP !social,5264,2021-05-20 15:49:16,2021-05-20T19:06:02.662830
57,GTAWiseGuy,Grand Theft Auto V,Eddie - Titanium | NoPixel @gtawiseguy | !incent !karma #ad,5215,2021-05-20 15:34:58,2021-05-20T19:06:02.662830
58,RTGame,Totally Reliable Delivery Service,Irish Mail Delivery,5072,2021-05-20 18:04:21,2021-05-20T19:06:02.662830
59,methodz,Call of Duty: Black Ops Cold War,Scrims vs OpTic,5047,2021-05-20 17:29:54,2021-05-20T19:06:02.662830
60,Incon,SMITE,Thursday Has SPL Now! !Star !Gfuel !Surfshark,5027,2021-05-20 12:05:09,2021-05-20T19:06:02.662830
61,peterparkTV,VALORANT,Valo with Friends | !squad,4973,2021-05-20 14:37:38,2021-05-20T19:06:02.662830
62,Call of Duty,Call of Duty: Warzone,Warzone: Operation MayDay w/ London Royal Ravens,4842,2021-05-20 17:57:14,2021-05-20T19:06:02.662830
63,JustaMinx,Just Chatting,GAMES WITH ANNA WOOO ,4775,2021-05-20 18:37:45,2021-05-20T19:06:02.662830
64,ops1x,Fortnite,EU DH FINALS VP RIGHT NOW,4567,2021-05-20 14:24:14,2021-05-20T19:06:02.662830
65,Zentreya,Just Chatting,its a birthday strem  🎈 | !merch,4500,2021-05-20 16:10:14,2021-05-20T19:06:02.662830
66,GenGesports,Just Chatting,!donate | ALL IN Charity Poker Tournament supporting the AAPI Community Fund | !charity,4208,2021-05-20 17:55:04,2021-05-20T19:06:02.662830
67,HBomb94,Minecraft,LEVEL 50 HERE WE COME | VAULT HUNTERS SMP,4159,2021-05-20 15:13:22,2021-05-20T19:06:02.662830
68,painezor,World of Warships,"[EN/CC] Unique Twitch Drop: Welthund Commander, Patch Day Agincourt, Vampire II, other stuff.",4106,2021-05-20 17:57:37,2021-05-20T19:06:02.662830
69,Ramee,Grand Theft Auto V,Gallery Update!! | Ramee | !Twitter | NoPixel | Chang Gang,3942,2021-05-20 18:49:23,2021-05-20T19:06:02.662830
70,DynamicReactions,Star Wars Jedi: Fallen Order,Happy Global Accessibility Awareness Day! | !transtag !disabledtag !GAAD,3865,2021-05-20 16:42:04,2021-05-20T19:06:02.662830
71,mL7support,Overwatch,REACTING TO OW2 Developer PVP Livestream at 12 PM PST !video !subgoal !giveaway,3837,2021-05-20 14:22:37,2021-05-20T19:06:02.662830
72,AnthonyZ,Grand Theft Auto V,!GIVEAWAY | Tony Corleone | NoPixel | STREAMS MON-SAT 9:30AM CT,3816,2021-05-20 16:52:34,2021-05-20T19:06:02.662830
73,Method,World of Warcraft,⚔️METHOD MAYHEM : 3v3 EU - DAY 1 ⚔️ Reload Esports vs TY 1 | $2000+ PRIZEPOOL | !crowdfund !subscribe !casters !merch,3797,2021-05-20 14:46:50,2021-05-20T19:06:02.662830
74,Simply,Just Chatting,tomfoolery -> teaching babbs more mario,3773,2021-05-20 17:51:52,2021-05-20T19:06:02.662830
75,itsRyanHiga,Apex Legends,noob apex w/ Edison!! ... and third wheel 100T Fuslie,3689,2021-05-20 16:43:34,2021-05-20T19:06:02.662830
76,Nick28T,FIFA 21,whatever dude... | Bundesliga TOTS packed: 19,3681,2021-05-20 17:56:56,2021-05-20T19:06:02.662830
77,TapL,Minecraft,MORNING SPEEDRUNNING,3608,2021-05-20 15:42:53,2021-05-20T19:06:02.662830
78,m0xyy,Overwatch,DOUBTERS? NOPE [NOT SCUFFED],3600,2021-05-20 16:33:38,2021-05-20T19:06:02.662830
79,Burn,Grand Theft Auto V,Mentle Block -- NoPixel RP 3.0 -- Tesco Oxford Special Bruv,3538,2021-05-20 13:33:26,2021-05-20T19:06:02.662830
80,Emongg,Overwatch,WATCHING OW2 STREAM AT 3 PM EST GOOD MORNING Thursday - Live every day at 12pm ET :) - !shock !ibuypower !minecraft,3463,2021-05-20 15:59:51,2021-05-20T19:06:02.662830
81,DansGaming,Days Gone,ZOMBIE HORDES! - Hard II - Days Gone (PC) !emotes !epic,3366,2021-05-20 16:59:36,2021-05-20T19:06:02.662830
82,jorbs,Slay the Spire,61/100 heart kills in 19th/30 days | gremlin nob's reign of terror must not be allowed to continue,3321,2021-05-20 15:40:44,2021-05-20T19:06:02.662830
83,a_babybay,VALORANT,#1 JETT NA | !VID | !TIKTOK | !DISCORD | SMEAGACADEMY | FaZe babybay,3300,2021-05-20 17:59:45,2021-05-20T19:06:02.662830
84,Giantwaffle,Minecraft,OmniFactory Day 4,3227,2021-05-20 15:00:19,2021-05-20T19:06:02.662830
85,Sacriel,Days Gone,Headshot Simulator - Key Provided by Devs || Follow @Sacriel 4 memes,3150,2021-05-20 13:29:25,2021-05-20T19:06:02.662830
86,Dendi,Dota 2,no death challenge !discord !розыгрыш !giveaway,3135,2021-05-20 17:56:24,2021-05-20T19:06:02.662830
87,nelkboys,Just Chatting,GAMBLING IN MEXICO + JULIA ROSE DATE,3129,2021-05-20 18:26:54,2021-05-20T19:06:02.662830
88,itsHafu,VALORANT,HAFU -- BIG NOOB Sponsored by Simple Mobile !dialafan !simplemobile #ad ,3088,2021-05-20 14:38:51,2021-05-20T19:06:02.662830
89,Hirona,Grand Theft Auto V,Trooper Copper | GTARP  NoPixel,3059,2021-05-20 16:49:13,2021-05-20T19:06:02.662830
90,hobbittrash,Grand Theft Auto V,NoPixel 3.0 | LEADER Tracy Martell,3006,2021-05-20 18:02:13,2021-05-20T19:06:02.662830
91,adeptthebest,Grand Theft Auto V,Mari Posa's first vault attempt?  !NORDVPN,2936,2021-05-20 11:58:29,2021-05-20T19:06:02.662830
92,Ayrun,Dead by Daylight,dead by daylight,2911,2021-05-20 17:01:01,2021-05-20T19:06:02.662830
93,ClassyBeef,Slots,🔥 INSANE HIGHROLL! 🔥 !520K WIN for WORLD RECORD! | $50.000 !Tournament | !Stake for best Casino,2883,2021-05-20 05:28:39,2021-05-20T19:06:02.662830
94,skill4ltu,World of Tanks,Good vibes Marking new tank. KPZ 07. new keyboard. new mouse . i need some time to get used to them. Starting % 67. goal 95 today. !chair,2734,2021-05-20 14:59:38,2021-05-20T19:06:02.662830
95,SypherPK,Call of Duty: Warzone,GAMING ALL DAY (BIG ANNOUNCEMENT 3PM CT!) | @SypherPK 👹,2699,2021-05-20 15:15:39,2021-05-20T19:06:02.662830
96,fl0m,Counter-Strike: Global Offensive,G2 VS HEROIC FOR FLASHPOINT UPPER BRACKET THIS IS GONNA BE A DOPE MATCH | !mythiccup !merch !aimlab @fl0mtv,2648,2021-05-20 15:10:55,2021-05-20T19:06:02.662830
97,Shotz,Grand Theft Auto V,"John ""Molotov"" Mineo | Getting Fired?!? | NoPixel | !VBI !PObox !Gfuel !Merch",2648,2021-05-20 14:20:55,2021-05-20T19:06:02.662830
98,MuTeX,Call of Duty: Warzone,"$25,000 MayDay Influencer/Celeb Tournament! ",2641,2021-05-20 17:48:28,2021-05-20T19:06:02.662830
99,Yamikazexz,League of Legends,Korea Day 5. Gold 1 54 lp start,2624,2021-05-20 13:10:58,2021-05-20T19:06:02.662830
