,user_name,game_name,title,viewer_count,started_at,api_call_time
0,pokimane,Rust,BIGGEST DROPS  âœ”ï¸ MOST KILLS âœ”ï¸ VILLAIN ARC âœ”ï¸ ATE BREAKFAST âœ”ï¸ KISSED YOUR MOM âœ”ï¸ KISSED MY MOM âœ”ï¸ ,50165,2021-07-17 19:23:34,2021-07-18T00:06:08.774244
1,LCS,League of Legends,Dignitas QNTMPAY vs. Golden Guardians | Week 7 Day 2 | LCS Summer Split (2021),49596,2021-07-17 19:30:43,2021-07-18T00:06:08.774244
2,limit_maximum,World of Warcraft,RWF:  lady who snapped the hat,47947,2021-07-17 14:34:49,2021-07-18T00:06:08.774244
3,Mizkif,Just Chatting,"RATING CHATS TINDERS WITH ALINITY, USE #MizkifIsFat ON TWITTER !POBOX",42188,2021-07-17 21:56:36,2021-07-18T00:06:08.774244
4,Sykkuno,Rust,relaxing chill day,41895,2021-07-17 22:22:36,2021-07-18T00:06:08.774244
5,shroud,Call of Duty: Warzone,IDK IF THIS WORKZ |  Follow @shroud on socials,34347,2021-07-17 13:55:28,2021-07-18T00:06:08.774244
6,btssmash,Super Smash Bros. Melee,LIVE: Smash Summit 11 - Day 3,30333,2021-07-17 16:41:45,2021-07-18T00:06:08.774244
7,HasanAbi,Just Chatting,DEEPDIVE INTO FAMILY YOUTUBERS  !chadvice,28230,2021-07-17 19:19:38,2021-07-18T00:06:08.774244
8,ROSHTEIN,Slots,â­ OPENING 150 BONUSES | $1.4 MILLION on !GATES | $2.5 MILLION WIN ON !RECORD ðŸ’  USE !STAKE FOR ELIGIBLE MONEY RAFFLES!,27481,2021-07-17 18:39:01,2021-07-18T00:06:08.774244
9,awesamdude,Just Chatting,COOKING STREAM WITH BOOMERNA,23992,2021-07-17 23:11:01,2021-07-18T00:06:08.774244
10,Myth,Rust,Dropsâœ… - GET THE BEST AK SKIN DROP IN THE GAME - !socials,22750,2021-07-17 17:59:50,2021-07-18T00:06:08.774244
11,Fextralife,Warframe,!dropsðŸ”¥TENNOLIVEðŸ”¥!WARFRAME MOBILE+ Cross-platform CROSS PLAY with TYR SPONSORED BY DIGITAL EXTREMES!,21064,2021-07-17 12:16:30,2021-07-18T00:06:08.774244
12,Complexity,World of Warcraft,Race to World First: Sanctum of Domination - Complexity-Limit - Day 5,19805,2021-07-16 11:45:09,2021-07-18T00:06:08.774244
13,LVNDMARK,Escape from Tarkov,[LVL 52] !24H STREAM #3 | NEW !MERCH | !GFUEL | @lvndmark_tv on socials,17377,2021-07-17 08:58:43,2021-07-18T00:06:08.774244
14,Doublelift,League of Legends,Doublelift - watching the region that will win worlds COPIUM #LCSWatchParty,17020,2021-07-17 20:20:14,2021-07-18T00:06:08.774244
15,RatedEpicz,Grand Theft Auto V,Randy Bullet | Chang Gang | GTA V RP | NoPixel | !youtube !newvid,16451,2021-07-17 20:56:44,2021-07-18T00:06:08.774244
16,summit1g,Final Fantasy XIV Online,dunno if ill like it but ill try it level 20 lancer. Merch dropped summit1g.gg  [ @summit1g ],15718,2021-07-17 20:09:24,2021-07-18T00:06:08.774244
17,ludwig,Super Smash Bros. Melee,THE BIGGEST SMASH TOURNAMENT EVER !bracket,15251,2021-07-17 21:33:21,2021-07-18T00:06:08.774244
18,WorldofWarships,World of Warships,[EN] Verizon Warrior Series Training!,14764,2021-07-17 22:05:04,2021-07-18T00:06:08.774244
19,cyr,Rust,DROPS DROPS DROPS DROPS DROPS DROPS ALL MY VIEWERS ARE FAKE BUT DROPS!!!! WANT $1000? NEED TO IMPRESS YOUR MOM? ENTER MY !CONTEST NOOBS LMAO,14556,2021-07-17 16:26:57,2021-07-18T00:06:08.774244
20,richwcampbell,Final Fantasy XIV Online,Heavensward Story all night long,14476,2021-07-17 23:26:14,2021-07-18T00:06:08.774244
21,sodapoppin,Hasfax,"Sh*t Show Saturday stuff, just playing random garbage.  | LIMITED CHAMPION MERCH: https://sodapoppin.shop",14013,2021-07-17 22:53:19,2021-07-18T00:06:08.774244
22,EsfandTV,Final Fantasy XIV Online,CHAMPION OF CLASSIC WOW ENTERS THE REALM OF FF14 (GONE SEXUAL???),12936,2021-07-17 21:47:01,2021-07-18T00:06:08.774244
23,TSM_ImperialHal,Apex Legends,24 hour Sub marathon :) | TSMFTX !subathon,12857,2021-07-17 00:17:29,2021-07-18T00:06:08.774244
24,MOONMOON,Grand Theft Auto V,Sr. Officer Lenny Hawk | rimworld if I get bored,12383,2021-07-17 22:43:49,2021-07-18T00:06:08.774244
25,Amouranth,ASMR,ðŸ’¦ASMR + LICKING EARS SUBATHONðŸ’¦!s --> all my social mediaðŸ’¦!instagram: @amouranthðŸ’¦,10562,2021-07-17 14:00:26,2021-07-18T00:06:08.774244
26,Ramee,Grand Theft Auto V,Ramee | !Twitter | Chang Gang | NoPixel,10556,2021-07-17 17:24:15,2021-07-18T00:06:08.774244
27,Pestily,Escape from Tarkov,PC GIVEAWAY #10 OPEN | 50 DAY SUBATHON | !SUBATHON,9906,2021-07-17 10:21:31,2021-07-18T00:06:08.774244
28,NBA2KLeague,NBA 2K21,NBA2KL The Turn Tournament Powered by AT&T - Semi-Finals/Finals ,9655,2021-07-17 21:45:34,2021-07-18T00:06:08.774244
29,AriaSaki,Rust,[OTV SERVER] DROPSSSSSSS !!! CAKE HAMMER !!! DAY 2,9180,2021-07-17 09:59:44,2021-07-18T00:06:08.774244
30,Echo_Esports,World of Warcraft,Echo Esports | [9/10M] Race to World First Day 4 | !giveaway | !ktkill,8729,2021-07-17 17:27:13,2021-07-18T00:06:08.774244
31,HusKerrs,Call of Duty: Warzone,"Use code ""HUSKERRS"" in the CoD Store !slayout | Follow @HusKerrs on all socials",7750,2021-07-17 21:07:52,2021-07-18T00:06:08.774244
32,PENTA,Grand Theft Auto V,WAR B0b Smith | NoPixel,7381,2021-07-17 21:43:19,2021-07-18T00:06:08.774244
33,Zerkaa,Grand Theft Auto V,TOMMY TATE | NoPixel WL | !nprules - !newemotes,7248,2021-07-17 21:37:57,2021-07-18T00:06:08.774244
34,IWillDominate,League of Legends,"LCS Week 7 Day 2 Watch Party Joined by Odoamne | JIIZUKE PROVIEW LATER TODAY #LCSWatchParty
#LCSWatchParty",6326,2021-07-17 16:48:38,2021-07-18T00:06:08.774244
35,AussieAntics,Fortnite,Viewing Party for Pro Solo Tournament (Formula Cup) | Predictions Pog,6162,2021-07-17 21:49:22,2021-07-18T00:06:08.774244
36,masondota2,Dota 2,tryhard poggers no cap,6136,2021-07-17 22:02:36,2021-07-18T00:06:08.774244
37,EvScape,Old School RuneScape,The OSRS Battle Royale 3: Veterans | Powered By Ironside | !ironside | !filmora | !cafune | !merch,6126,2021-07-17 20:45:07,2021-07-18T00:06:08.774244
38,Yassuo,Slots,18+ 50K START 100K GOAL SIMPLE BUT STUPID !rollbit !profit #ad,6086,2021-07-17 18:27:51,2021-07-18T00:06:08.774244
39,Pieface23,FIFA 21,(UK) Pie after Dark! Icon Pick and Champs.,5733,2021-07-17 21:43:39,2021-07-18T00:06:08.774244
40,dasMEHDI,Grand Theft Auto V,Nino Chavez - Guns and Boosts - NoPixel | !gfuel !merch !epic | TWITTER: @dasMEHDI,5665,2021-07-17 14:01:38,2021-07-18T00:06:08.774244
41,Apricot,Destiny 2,Zen got me Destiny 2 LET'S GOOOOOO,5522,2021-07-17 19:33:25,2021-07-18T00:06:08.774244
42,supertf,Overwatch,the arrival of top tier pure raw unfiltered power is here,5513,2021-07-17 20:15:25,2021-07-18T00:06:08.774244
43,its_iron,Call of Duty: Warzone,BR University | !30 | !Merch !GFUEL !Evolve !Metaview !Kovaak,5470,2021-07-17 03:49:58,2021-07-18T00:06:08.774244
44,Zoomaa,Call of Duty: Black Ops Cold War,THE FLANK / #ZOOMAFIA !discord,5274,2021-07-17 23:06:53,2021-07-18T00:06:08.774244
45,ironmouse,Just Chatting,REVERSE HAREM APPLICATIONS WITH PROJEKT MELODY  !merch,5040,2021-07-17 23:47:03,2021-07-18T00:06:08.774244
46,sneakylol,League of Legends,Sneaky | L C S 2 #LCSWatchParty,4988,2021-07-17 21:02:39,2021-07-18T00:06:08.774244
47,FENGRUSH,Warframe,Poggers,4807,2021-07-17 18:47:16,2021-07-18T00:06:08.774244
48,AvoidingThePuddle,Street Fighter III: 3rd Strike,Decennial Anniversary 3S - Shirts and Mugs http://teespring.com/stores/ATP,4770,2021-07-17 20:35:01,2021-07-18T00:06:08.774244
49,Tectone,Chess,LAST MINUTE PREPERATIONS CHESS TOURNEY 8PM EST,4606,2021-07-17 19:20:06,2021-07-18T00:06:08.774244
50,ChilledChaos,Just Chatting,YUGIOH UNBOXINGS!! | WE WANT GOD CARDS! Kings Court! (Pogostuck Rage with Friends After)!,4496,2021-07-17 21:56:09,2021-07-18T00:06:08.774244
51,PavelskiBH,Brawlhalla,VIEWER GAMES CB!! :O !discord !youtube,4341,2021-07-17 16:03:09,2021-07-18T00:06:08.774244
52,itsHafu,Hearthstone,HAFU - big noob plays bgs,4210,2021-07-17 15:04:51,2021-07-18T00:06:08.774244
53,AyeZee,Slots,"18+ | âš¡ OPENING 31 BONUSES FROM $430,000 MOD LIGHTNING HUNT - $10,000 GIVEAWAY  | !rollbit for most player rewarding casino ðŸ”¥",4182,2021-07-17 20:12:30,2021-07-18T00:06:08.774244
54,Mathil1,Path of Exile,Mathil - Still battle royalin' - chasing higher rhoa dinners,4139,2021-07-17 20:08:47,2021-07-18T00:06:08.774244
55,xChocoBars,Just Chatting,it's masterchef time,4097,2021-07-17 22:18:39,2021-07-18T00:06:08.774244
56,YourPelagea,ASMR,WATCH this ASMR stream to fall asleep ðŸ’– LIVE!,4094,2021-07-17 22:10:53,2021-07-18T00:06:08.774244
57,MuTeX,Call of Duty: Warzone,20-20 Max Sensitivity Freak. 3x World Record Holder.,4069,2021-07-17 23:42:23,2021-07-18T00:06:08.774244
58,ethos,VALORANT,gridshot master plays ranked,4031,2021-07-17 20:36:18,2021-07-18T00:06:08.774244
59,daltoosh,Apex Legends,"Yo its saturday, thats cool right ",3870,2021-07-17 22:00:31,2021-07-18T00:06:08.774244
60,GamesDoneQuick,Paper Mario,That's Never Happened Before - Paper Mario Glitch Exhibition,3739,2021-07-17 22:51:54,2021-07-18T00:06:08.774244
61,nwslofficial2,Sports,SAT at 7 PM ET: NC vs. HOU,3719,2021-07-17 22:50:51,2021-07-18T00:06:08.774244
62,Chess,Chess,RUSTAGE vs TECTONE | Tournament Arc 2 | !format !bracket !players,3694,2021-07-17 23:29:48,2021-07-18T00:06:08.774244
63,GMBenjaminFinegold,Chess,World Cup Recap - Day 6 - 7-17-2021,3576,2021-07-17 21:37:38,2021-07-18T00:06:08.774244
64,R6EsportsNA,Tom Clancy's Rainbow Six Siege,HONOR ESPORTS vs ORGLESS | NA Challenger League - Stage 2 - Playday 7,3557,2021-07-17 19:36:35,2021-07-18T00:06:08.774244
65,SmiteGame,SMITE,Saturday Night Feeder w/ !ZED,3557,2021-07-17 22:27:03,2021-07-18T00:06:08.774244
66,Method,World of Warcraft,REBROADCAST ðŸ”´RACE TO WORLD FIRST Day 04 with | NEVER miss a moment method.gg/progress | !rwfgg !charity !casters,3404,2021-07-17 23:51:48,2021-07-18T00:06:08.774244
67,ESL_CSGO,Counter-Strike: Global Offensive,OVERPASS OVERLOAD! - IEM Cologne HIGHLIGHTS Day 5,3401,2021-07-17 21:01:38,2021-07-18T00:06:08.774244
68,Jukeyz,Call of Duty: Warzone,2v2 finals with Len | !socials !redbull,3383,2021-07-17 18:11:19,2021-07-18T00:06:08.774244
69,ops1x,Fortnite,FORMULA SOLO CUP VIEWPARTY POGGG ( 1 year stream day 31/365),3378,2021-07-17 15:51:28,2021-07-18T00:06:08.774244
70,itsonlyJill,Medieval Dynasty,[ENG] Saturday Hype | Medieval Dynasty ðŸ’€ !hints !socials !donate !gifts,3316,2021-07-17 20:34:53,2021-07-18T00:06:08.774244
71,Bawkbasoup,Resident Evil 2,WORLD PREMIER || Resident Evil 1-3 Randomizer Marathon || !social !merch !marathon !sos,3293,2021-07-17 19:34:24,2021-07-18T00:06:08.774244
72,TobiasFate,League of Legends,Tobias Fate - the ultimate brain activity with insane outplays and massive muscles its incredible,3279,2021-07-17 14:19:14,2021-07-18T00:06:08.774244
73,SunBaconRelaxer,Hearthstone,"14k start today, Head down, Points up!",3250,2021-07-17 21:25:47,2021-07-18T00:06:08.774244
74,aircool,Just Chatting,It's Lit | !newvid !socials !merch,3242,2021-07-17 23:46:32,2021-07-18T00:06:08.774244
75,scoped,Fortnite,Formula Solo Cup | Everyone Unbanned & New !Sub Alert | !call !ghosting,3134,2021-07-17 20:28:04,2021-07-18T00:06:08.774244
76,CodeMiko,Just Chatting,!youtube UNBAN FORMS today!,2982,2021-07-17 20:05:12,2021-07-18T00:06:08.774244
77,Brozime,Warframe,Tennocon All Day! | Warframe Drops Active | #Sponsored 7/17/21,2910,2021-07-17 15:52:41,2021-07-18T00:06:08.774244
78,Maya,Just Chatting,Intel Master of Game event <:-) !Masterofgame #Ad,2790,2021-07-17 21:00:00,2021-07-18T00:06:08.774244
79,Ninja,Final Fantasy XI Online,FFXI exping? ,2786,2021-07-17 14:26:59,2021-07-18T00:06:08.774244
80,dnd,Dungeons & Dragons,D&D Live 2021,2700,2021-07-17 18:33:51,2021-07-18T00:06:08.774244
81,Murda,Just Chatting,KING OF DA HOOD TRACK! ,2691,2021-07-17 20:05:55,2021-07-18T00:06:08.774244
82,tarzaned,League of Legends,$10K TOURNAMENT 3PM EST | SUBS GET 11.14 TIER LIST | !patreon | discord.gg/tarzaned |,2611,2021-07-17 17:24:32,2021-07-18T00:06:08.774244
83,JOEYKAOTYK,Just Chatting,Looking for Plan D in SJ !topclip !youtube !ABOUT !DISCORD,2569,2021-07-17 21:56:21,2021-07-18T00:06:08.774244
84,HeroesHearth,Heroes of the Storm,[HeroesCCL presented by Wisdom] STORM Esports v 30k | Playoffs Day 1 | !ccl !merch !prizepool !PSD,2556,2021-07-17 19:45:16,2021-07-18T00:06:08.774244
85,tarik,VALORANT,We don't play for fun @tarik // !TIK !NEW,2547,2021-07-17 23:02:38,2021-07-18T00:06:08.774244
86,ConnorEatsPants,The Legend of Zelda: Skyward Sword HD,Stupid Dumb Idiot Man plays Zelda,2544,2021-07-17 21:05:22,2021-07-18T00:06:08.774244
87,elena_fn,ASMR,ASMR EARLICKING 4K| !sub !youtube !prime,2501,2021-07-17 15:42:12,2021-07-18T00:06:08.774244
88,iiTzTimmy,Call of Duty: Warzone,Warzone with family // !nordvpn // Follow my socials @iiTzTimmy,2480,2021-07-17 21:41:43,2021-07-18T00:06:08.774244
89,Payo,World of Warcraft,CLASSIC ROGUE PVP TBC  |  ONE SHOT MACRO,2479,2021-07-17 16:59:17,2021-07-18T00:06:08.774244
90,Odablock,Old School RuneScape,YAOOOOOO GRAZY RISKS GRAZY OFFERS 2-4b+ - || @Odablock on socials !newvid !nopixel,2461,2021-07-17 20:58:39,2021-07-18T00:06:08.774244
91,Strippin,No Man's Sky,First timer,2438,2021-07-17 18:42:41,2021-07-18T00:06:08.774244
92,Spaceboy,Grand Theft Auto V,"mel - nopixel 3.0 | execution - monday july 19th, 6 PM EST | !song | !GFUEL",2375,2021-07-17 21:13:12,2021-07-18T00:06:08.774244
93,Giantwaffle,Foxhole,Logistically Delivering Bullets to the Enemy,2344,2021-07-17 15:03:47,2021-07-18T00:06:08.774244
94,PotasticP,Just Chatting,some hearty cooking to warm  your soul ^U^,2317,2021-07-17 21:58:41,2021-07-18T00:06:08.774244
95,BobRoss,Art,Bob Ross - Weekend Marathon! Beginning Fridays at 12PM EDT.,2255,2021-07-16 15:49:38,2021-07-18T00:06:08.774244
96,JERICHO,Counter-Strike: Global Offensive,Silver cast drinking game with fl0m // !jawns !phone,2192,2021-07-17 20:00:14,2021-07-18T00:06:08.774244
97,Tommey,Call of Duty: Warzone,2v2 wagers - 100T @Tommey,2132,2021-07-17 17:44:01,2021-07-18T00:06:08.774244
98,TheChief1114,Grand Theft Auto V,FINGLE DAN SUBATHON,2092,2021-07-17 20:15:55,2021-07-18T00:06:08.774244
99,PeteZahHutt,Minecraft,VAULT HUNTERS SMP DAY 34 // !injury,2092,2021-07-17 21:58:37,2021-07-18T00:06:08.774244
