,user_name,game_name,title,viewer_count,started_at,api_call_time
0,xQcOW,Grand Theft Auto V,[NoPixel PUBLIC] RP (HITTING THE GOLD VAULT) LMFAOOOOOOOOOOOOOOOOOOOOOOOOOOOOOOOOOOOOOOOOOOOOOOOOOOOOOOO,91274,2021-06-13 23:00:22,2021-06-14T03:06:06.947044
1,playapex,Apex Legends,Apex Legends Global Series Championship NA Finals,49961,2021-06-13 20:58:39,2021-06-14T03:06:06.947044
2,Sykkuno,Grand Theft Auto V,chill day,40078,2021-06-14 00:36:20,2021-06-14T03:06:06.947044
3,HasanAbi,Dark Souls III,JOURNEY TO DEFEATING THE NAMELESS KING CONTINUES,33056,2021-06-13 18:48:24,2021-06-14T03:06:06.947044
4,summit1g,Grand Theft Auto V,Main NoPixel. Merch dropped summit1g.gg  [ @summit1g ],26806,2021-06-13 23:58:07,2021-06-14T03:06:06.947044
5,RiceGum,Just Chatting,i really gotta box some1,22703,2021-06-14 00:40:51,2021-06-14T03:06:06.947044
6,MOONMOON,Grand Theft Auto V,Chief of Police 350 L. Hawk | nopixel WL | new mayor new dashcam new me,20909,2021-06-13 22:28:04,2021-06-14T03:06:06.947044
7,Foolish__Gamers,Minecraft,I am the KING of SAND! - Dream SMP,20633,2021-06-14 01:13:44,2021-06-14T03:06:06.947044
8,Aydan,Call of Duty: Warzone,"2v2 $2,000 MetaThreads Tournament w/ zSmit | !giveaway !yt",20182,2021-06-13 20:08:17,2021-06-14T03:06:06.947044
9,ShahZaM,VALORANT,SEN ShahZaM - home stream,19215,2021-06-13 22:27:18,2021-06-14T03:06:06.947044
10,RatedEpicz,Grand Theft Auto V,Randy Bullet | Chang Gang | NoPixel | !youtube !newvid,17031,2021-06-13 22:09:03,2021-06-14T03:06:06.947044
11,Swagg,Call of Duty: Warzone,IM BACK | FaZe Nuke Squad House | CODE: SWAGG | !sub !blm,16851,2021-06-14 01:42:15,2021-06-14T03:06:06.947044
12,daltoosh,Apex Legends,ALGS CHAMPS #1 WATCH PARTY,16133,2021-06-13 20:40:38,2021-06-14T03:06:06.947044
13,PENTA,Grand Theft Auto V,MIKE BLOCK | NOPIXEL | CHASE CLOUTER AT 11K,12198,2021-06-13 22:29:50,2021-06-14T03:06:06.947044
14,LVNDMARK,Escape from Tarkov,tarky | !GFUEL | @lvndmark_tv on socials,11271,2021-06-13 17:59:02,2021-06-14T03:06:06.947044
15,moistcr1tikal,Ninja Gaiden Sigma,How can one man be so masculine,10759,2021-06-14 01:17:37,2021-06-14T03:06:06.947044
16,ChilledChaos,Among Us,Among Us x Town of Salem Shenanigans,10643,2021-06-13 22:42:58,2021-06-14T03:06:06.947044
17,ATT,League of Legends,Connecting with Cloud9 Presented by AT&T - C9 LCS Edition #ATTC9Fam,7913,2021-06-14 01:21:00,2021-06-14T03:06:06.947044
18,TWDUniverse,Just Chatting,IT'S THE FINAL COUNTDOWN | Showrunner Ian Goldberg joins TWDU for the Fear Season Finale,7865,2021-06-14 00:22:15,2021-06-14T03:06:06.947044
19,cyr,Grand Theft Auto V,"UCHI JONES - NOPIXEL 3.0 , SBS SUNDAY, WORKING ON THE WEEKEND LIKE USUAL. ON THE UP AND UP- LET'S GOO! !TIKTOK LMAOOOOOOOOOOO BRUH !YT",7677,2021-06-13 22:35:47,2021-06-14T03:06:06.947044
20,nl_Kripp,Hearthstone,BG NIGHT | NEW !GIVEAWAY FROM !XTRFY | Eye Surgery Showdown! https://youtu.be/FqS-UpNFWqA,7016,2021-06-14 02:02:09,2021-06-14T03:06:06.947044
21,BruceDropEmOff,Just Chatting,dont be late get in here NOW!  I !sub !prime !yt ig/twitter: @raycondones,6840,2021-06-14 02:47:28,2021-06-14T03:06:06.947044
22,NiceWigg,Apex Legends,ALGS CHAMPS WATCH PARTY - #1 Caster in the game - !socials ,6391,2021-06-13 20:51:40,2021-06-14T03:06:06.947044
23,NickEh30,Fortnite,SPREADING POSITIVITY ONE ELIM AT A TIME!,6380,2021-06-13 23:35:37,2021-06-14T03:06:06.947044
24,Jinnytty,Just Chatting,Hot Vegas Day 7 lets gooo,5823,2021-06-13 20:01:21,2021-06-14T03:06:06.947044
25,tuonto,Genshin Impact,BACK AND BETTER // !youtube !hyperx,5780,2021-06-14 01:50:12,2021-06-14T03:06:06.947044
26,Zombie_Barricades,Grand Theft Auto V,FrenzyRP //  EAST SIDE VAGO TERM WAR,5722,2021-06-13 21:40:31,2021-06-14T03:06:06.947044
27,uaiguria,Talk To Me,sopinha das dez,5715,2021-06-14 00:50:32,2021-06-14T03:06:06.947044
28,GiantBomb,Special Events,Cool Giant Bomb Wrap Up Show,5539,2021-06-14 01:34:19,2021-06-14T03:06:06.947044
29,Greekgodx,Slots,GAMBA WITH CORINNA KOPF !rollbit #AD | @Greekgodx on Twitter,5436,2021-06-13 21:03:32,2021-06-14T03:06:06.947044
30,Euriece,Apex Legends,【ENG/日本語】ALGS NA CHAMPIONSHIP FINALS | !artesian !kovaaks !completed !algs !bracket,5344,2021-06-14 02:48:33,2021-06-14T03:06:06.947044
31,CobaltStreak,The Binding of Isaac: Repentance,🏆All Character Random Streak[16]+ 2nd Save Unlocks![0 Deaths]🏆,5204,2021-06-13 21:45:57,2021-06-14T03:06:06.947044
32,snuffy,VRChat,vr  | ( ᵔ︠ ᴗ ︡ᵔ) !merch !links !gfuel,5159,2021-06-14 01:25:56,2021-06-14T03:06:06.947044
33,Destroy,Call of Duty: Warzone,2v2 Meta Threads Tournament w/ ZLaner + vibes!,4975,2021-06-13 19:04:56,2021-06-14T03:06:06.947044
34,limit_maximum,World of Warcraft,G-Loot Raid Masters: Castle Nathria Speedrun | Ratchet and clank at night,4903,2021-06-13 23:42:24,2021-06-14T03:06:06.947044
35,DiazBiffle,Call of Duty: Warzone,Dad is back | !scuf | !youtube | @DiazBiffle,4392,2021-06-14 02:00:57,2021-06-14T03:06:06.947044
36,Apricot,Sea of Thieves,SET SAIL MATIES ,4373,2021-06-13 22:02:47,2021-06-14T03:06:06.947044
37,GCXEvent,Fortnite,GCX'21 Charity Marathon | ActionJaxon | Powered by Logitech G | !charity !donate,4361,2021-06-13 15:15:17,2021-06-14T03:06:06.947044
38,AriaSaki,Just Chatting,mavis' older sister,4317,2021-06-14 02:16:11,2021-06-14T03:06:06.947044
39,pokelawls,Chivalry 2,YOU HAVE 2 SEE THIS,4272,2021-06-13 22:26:06,2021-06-14T03:06:06.947044
40,sneakylol,Guilty Gear: Strive,Sneaky | games,4153,2021-06-13 20:12:05,2021-06-14T03:06:06.947044
41,Payo,World of Warcraft,MAG!! GRUUL DEAD POGGERS - TBC ROGUE PVP  - Bonus !video,4139,2021-06-13 16:32:07,2021-06-14T03:06:06.947044
42,Calebhart42,Final Fantasy VII,FINAL FANTASY 7 SPEEDRUN FOR SUB 7 | FF ORIGIN DEMO BROKEN LOL | @calebhart42 IG/Twitter,3771,2021-06-14 01:05:50,2021-06-14T03:06:06.947044
43,BobRoss,Art,Bob Ross - Weekend Marathon! Beginning Friday at 3PM EDT.,3740,2021-06-13 18:45:35,2021-06-14T03:06:06.947044
44,Nightblue3,Pokémon Platinum,ded stream Pokemon CHALLENGE NUZLOCKE ALL RANDOM ,3707,2021-06-13 19:03:13,2021-06-14T03:06:06.947044
45,DuelLinksMeta,Yu-Gi-Oh! Duel Links,Multi Worlds Finalist: FREE To Play Decks + Legal Cheating With Hourglass!,3693,2021-06-13 22:03:26,2021-06-14T03:06:06.947044
46,LEC,League of Legends,(REBROADCAST) Week 1 Day 3 | 2021 LEC Summer,3647,2021-06-14 01:57:06,2021-06-14T03:06:06.947044
47,scoped,Fortnite,High Kill Duo Arena with Co1azo | !socials,3577,2021-06-13 22:17:30,2021-06-14T03:06:06.947044
48,ClassyBeef,Slots,🔥 JUICY HIGHROLL 🔥 !Tournament | !Stake for best Casino |,3423,2021-06-13 05:10:40,2021-06-14T03:06:06.947044
49,Hungrybox,Super Smash Bros. Ultimate,PLAYING IN #WRLD 33 TOURNEY! E3 Predictions! !youtube !box,3387,2021-06-13 22:59:04,2021-06-14T03:06:06.947044
50,BigEx,Grand Theft Auto V,KP THE MENACE APPLYING PRESSURE,3345,2021-06-14 01:02:58,2021-06-14T03:06:06.947044
51,PalmBee,World of Warcraft,HEMO STEP ROGUE PVP PUMP,3232,2021-06-13 22:47:15,2021-06-14T03:06:06.947044
52,TapL,Minecraft,TRYHARD SPEEDRUNS ONLY,3202,2021-06-14 01:05:42,2021-06-14T03:06:06.947044
53,GunnarDotA2,Dota 2,More pubs (Maybe winning) !yt !newvid,3123,2021-06-13 23:17:32,2021-06-14T03:06:06.947044
54,Ssaab,Grand Theft Auto V,Detective Baas - Corruption - Nopixel | !Nord !tiktok - New daily uploads!,3122,2021-06-13 20:42:01,2021-06-14T03:06:06.947044
55,Murda,Just Chatting,HOOD TRACK!!!,3025,2021-06-13 20:59:54,2021-06-14T03:06:06.947044
56,Arsenal,Rocket League,Late Night Grinding Skrt / !youtube / !instagram / !twitter / !tiktok,2990,2021-06-14 01:32:49,2021-06-14T03:06:06.947044
57,AvoidingThePuddle,Path of Exile,POE (PS5) - Shirts and Mugs http://teespring.com/stores/ATP,2913,2021-06-14 02:24:29,2021-06-14T03:06:06.947044
58,Artosis,StarCraft,"GSL Tonight, BANS/UNBANS, and Ladder! ~ !bloodbath",2872,2021-06-14 00:21:52,2021-06-14T03:06:06.947044
59,THERUSSIANBADGER,Halo: Reach,mamster ciehf wit da soda | use code BADGER for 10% off gamer supps,2861,2021-06-14 01:41:22,2021-06-14T03:06:06.947044
60,Criken,Necromunda: Hired Gun,Cyberpunk but like 10x filthier - Necromunda Day 1,2820,2021-06-14 00:44:07,2021-06-14T03:06:06.947044
61,iateyourpie,Mario Party 3,!YoC | Mario Party 3 Super Hard !Gauntlet Day 4,2811,2021-06-13 22:54:48,2021-06-14T03:06:06.947044
62,Ash_on_LoL,Grand Theft Auto V,cute city (ꈍᴗꈍ) AYAYA !ground,2811,2021-06-14 02:33:22,2021-06-14T03:06:06.947044
63,Broxah,League of Legends,positive vibes positive vibes positive vibes positive vibes positive vibes positive vibes positive vibes positive vibes positive vibes,2809,2021-06-14 01:14:33,2021-06-14T03:06:06.947044
64,OhTofu,Dead by Daylight,Favorite thing from e3? | #deadbydaylightpartner,2749,2021-06-14 01:38:08,2021-06-14T03:06:06.947044
65,scuwry,Apex Legends,WE WON CHAMPIONSHIPS | !twitter,2733,2021-06-14 02:53:39,2021-06-14T03:06:06.947044
66,BurkeBlack,HUMANKIND,Get my Avatar! and Beta!💀 !Epic for FREE Games! 💀 Creator Code: BurkeBlack 💀 #EpicPartner 💀 !NordVPN #AD 💀 !Xfinity,2706,2021-06-14 02:01:50,2021-06-14T03:06:06.947044
67,MurderCrumpet,VRChat,"Dreamy, Steamy, and Extremely Crumpet! !socials ",2653,2021-06-13 22:00:01,2021-06-14T03:06:06.947044
68,KarasMai,League of Legends,NA Challenger JG - Best Kayn NA - Rank 1 Grind !discord !youtube ,2614,2021-06-14 01:01:23,2021-06-14T03:06:06.947044
69,Anton,Escape from Tarkov,TARKOV E3 EVENT poOGEERS,2603,2021-06-13 21:05:58,2021-06-14T03:06:06.947044
70,Sjow,Hearthstone,EU Climb,2584,2021-06-14 00:15:36,2021-06-14T03:06:06.947044
71,The_Happy_Hob,The Legend of Zelda: Majora's Mask,"No Hit RACE !! w/MajinPhil (2st Run,NoReset) !newbet [0/10][22.103] [Chapter 1911: 2Head Hob] !displate !pc",2513,2021-06-13 21:16:00,2021-06-14T03:06:06.947044
72,Jonthebroski,Grand Theft Auto V,Mayor Denzel Williams | NoPixel WL | Not a dictator,2503,2021-06-13 15:25:40,2021-06-14T03:06:06.947044
73,BotezLive,Just Chatting,STORY TIME WITH MY BEST FRIEND I POWERED BY !CASHAPP I USE CODE TWITCHTV FOR $10 OFF,2484,2021-06-14 02:18:40,2021-06-14T03:06:06.947044
74,Sanchovies,Minecraft,new to mincrat i will kill billy the dragon,2482,2021-06-14 00:07:55,2021-06-14T03:06:06.947044
75,punkdagod,Guilty Gear: Strive,!Youtube !Sub !IWO Hitbox Training then Strive and chill. @Punkdagod on all social media,2465,2021-06-13 20:38:46,2021-06-14T03:06:06.947044
76,DooleyNotedGaming,Among Us,Among Us Returns!,2439,2021-06-14 00:24:13,2021-06-14T03:06:06.947044
77,BazzaGazza,Grand Theft Auto V,NOPIXEL MAIN - JUDGEMENT DAY. WE WILL FIND DUNDEE.  - BARRY BBMC - !META,2367,2021-06-13 23:55:29,2021-06-14T03:06:06.947044
78,Surefour,Overwatch,Sup my gamers,2330,2021-06-14 01:35:23,2021-06-14T03:06:06.947044
79,ESL_CSGO,Counter-Strike: Global Offensive,RERUN: Evil Geniuses vs. Team Spirit [Overpass] Map 1 - IEM Summer 2021 - Group B,2321,2021-06-13 17:49:16,2021-06-14T03:06:06.947044
80,fineokay,SMITE,just chillin you know me,2267,2021-06-13 22:36:46,2021-06-14T03:06:06.947044
81,PointCrow,Hollow Knight,FIRST TIME PATH OF PAIN AND TRUE ENDING,2218,2021-06-13 21:00:30,2021-06-14T03:06:06.947044
82,Matimi0,Special Events,Battlefield 2042 Hype! E3 Coverage  - !charm,2196,2021-06-14 01:05:18,2021-06-14T03:06:06.947044
83,space,Overwatch,"IM ME, I DO ME, AND I CHILL. ",2150,2021-06-14 00:23:38,2021-06-14T03:06:06.947044
84,DotoDoya,Guilty Gear: Strive,CHIPP,2100,2021-06-14 01:05:39,2021-06-14T03:06:06.947044
85,Zizaran,Path of Exile,Gauntlet Day 2! | !cast !casters !gauntlet !bounties | Merch: shop.zizaran.com,2085,2021-06-13 18:35:11,2021-06-14T03:06:06.947044
86,PeteZahHutt,Minecraft,DAY 11 OF VAULT HUNTERS SMP // !injury,2064,2021-06-13 21:43:29,2021-06-14T03:06:06.947044
87,BigBossBoze,Just Chatting,TRUE CRIME | MYSPACE LOVE TRIANGLE TRIAL (FLORIDA VS. RACHEL WADE) + 6 CASE UPDATES,2044,2021-06-14 01:34:07,2021-06-14T03:06:06.947044
88,AsmodaiTV,Hearthstone,100% GAINS THIS STREAM !youtube !merch,2039,2021-06-14 01:04:02,2021-06-14T03:06:06.947044
89,SmiteGame,SMITE,Sunday FUNday with the OHANA -- !davion505 #RESPAWNRecruits,1965,2021-06-14 02:01:14,2021-06-14T03:06:06.947044
90,CalebDMTG,Magic: The Gathering,MH2 draft (maybe some sealed later) ,1911,2021-06-13 23:00:51,2021-06-14T03:06:06.947044
91,imrosen,Chess,CARE Charity Stream VIEWER CHALLENGES on lichess.org  | !compare !charity #sponsored,1887,2021-06-14 00:16:26,2021-06-14T03:06:06.947044
92,Chloe_Matchers,Slots,💎$50K GIVEAWAY ($400K START)💎Passive Betting Strategy for $200+/day 🔥TYPE !stake IN CHAT TO TRY IT YOURSELF!🔥,1883,2021-06-13 23:54:31,2021-06-14T03:06:06.947044
93,JAz_FIFA,FIFA 21,11-0 (pro) Weekend League until I finish or I don't want to play anymore :) | @JAz_FIFA,1840,2021-06-14 01:43:58,2021-06-14T03:06:06.947044
94,BTMC,osu!,AFTER A LONG AND HARD BATTLE AGAINST OUR OPPONENT WE won by default.,1832,2021-06-13 14:38:55,2021-06-14T03:06:06.947044
95,Co1azo,Fortnite,Practicing For Regular Season Arena w/ Scoped | !gfuel !scuf | TSM FTX Co1azo,1814,2021-06-13 20:17:18,2021-06-14T03:06:06.947044
96,PurgeGamers,Dota 2,"Evening pubs, free from the major!",1745,2021-06-13 22:51:52,2021-06-14T03:06:06.947044
97,fobm4ster,Genshin Impact,"[AR58] Ducky Purses are the new Fashion !pobox !gf !nord !raid !youtube !newvid
",1698,2021-06-13 22:30:31,2021-06-14T03:06:06.947044
98,Shotz,Grand Theft Auto V,Mr J | Chang Gang | NoPixel WL | !VBI !PObox !Gfuel !Merch,1664,2021-06-13 18:17:02,2021-06-14T03:06:06.947044
99,zachmazer,Apex Legends,C9 IGL LETS GO SHOW UR SUPPORT I LOVE YOU GUYS - 1ST PLACE OVERALL 2ND PLACE FINISH  | !socials !yt !nord,1660,2021-06-14 02:46:08,2021-06-14T03:06:06.947044
