,user_name,game_name,title,viewer_count,started_at,api_call_time
0,AdinRoss,Just Chatting,ADIN X ZIAS X SPEED X BLOU X PRIME,113751,2021-09-02 00:27:51,2021-09-02T02:06:02.886774
1,xQcOW,VALORANT,GAMING INOVATOR + VIDEO GAME VISIONARY ACCOMPLISHES WHAT WE THOUGHT TO BE HUMANLY IMPOSSIBLE AND CLAIMS MULTIPLE WORLD RECORDS (GONE WRONG),63883,2021-09-01 22:54:28,2021-09-02T02:06:02.886774
2,NICKMERCS,Apex Legends,Fraggin' | Code: MFAM | @NICKMERCS,46367,2021-09-01 18:09:27,2021-09-02T02:06:02.886774
3,Sykkuno,Mario Kart 8 Deluxe,hello !,28833,2021-09-01 22:33:06,2021-09-02T02:06:02.886774
4,Trainwreckstv,Slots,18+ need W #ad | !twitter | !youtube | !podcast,27485,2021-08-31 17:26:19,2021-09-02T02:06:02.886774
5,summit1g,Sea of Thieves,Sot chillin. Merch dropped summit1g.gg  [ @summit1g ],25313,2021-09-01 21:03:25,2021-09-02T02:06:02.886774
6,loltyler1,League of Legends,ZOOM !! WOAHS ! he go and faster than thats but GOOO !! climb climb big T going HUGE !!!!! ok,25100,2021-09-01 22:41:05,2021-09-02T02:06:02.886774
7,Mizkif,Mario Kart 8 Deluxe,PLAYING MARIO KART! FT. MY BEST FRIENDS VALKYRAE & SYKKUNO | !MERCH !PO,24474,2021-09-01 20:33:04,2021-09-02T02:06:02.886774
8,RatedEpicz,Grand Theft Auto V,Randy Bullet | Chang Gang | GTA V RP | NoPixel | !youtube !newvid | !GFuel,21672,2021-09-01 19:18:16,2021-09-02T02:06:02.886774
9,ROSHTEIN,Slots,18+ | 125 BONUS OPENING + GIGA JAR 💠 DISCORD.GG/ROSHTEIN & JOIN THE COMMUNITY!,18773,2021-09-01 20:08:42,2021-09-02T02:06:02.886774
10,sodapoppin,Just Chatting,pain (GTA RP this week) | sodapoppin.shop (Discount code: POOR),17880,2021-09-01 20:47:34,2021-09-02T02:06:02.886774
11,MOONMOON,FTL: Faster Than Light,"ROGUELIKE ROULETTE 3 (chat votes on next game, !roulette)",15026,2021-09-01 22:12:24,2021-09-02T02:06:02.886774
12,Fextralife,The Elder Scrolls Online,🔥PS5 !GIVEAWAY🔥 ESO LFG Dungeons & Adventures with Yuria,13465,2021-09-02 00:19:16,2021-09-02T02:06:02.886774
13,ShahZaM,VALORANT,SEN ShahZaM - RADIANT RANKED,13035,2021-09-02 00:27:41,2021-09-02T02:06:02.886774
14,PaymoneyWubby,Just Chatting,HUMP DAY HUMP LIFE  !video,12498,2021-09-02 00:39:16,2021-09-02T02:06:02.886774
15,scump,Call of Duty: Warzone,"Verdansk is not safe. . . | Use Code ""SCUMP"" in the CoD Store!",11980,2021-09-01 20:34:06,2021-09-02T02:06:02.886774
16,PENTA,Grand Theft Auto V,GAMBA | NoPixel | dnd not later ever,11926,2021-09-01 23:16:26,2021-09-02T02:06:02.886774
17,MonsterEnergy,Apex Legends,Community Nights with Apex Legends feat. Renee,11424,2021-09-02 01:12:04,2021-09-02T02:06:02.886774
18,Quin69,Bloons TD 6,"BLOONARIUS EVENT ENDS TODAY, SO WE ARE BEATING IT TODAY. (BLIND, ETHICAL STRATS, Omega hard 0.001% BLOONS BOSS)",10062,2021-09-01 14:03:11,2021-09-02T02:06:02.886774
19,TwitchSports,Sports,CelebriTee Showdown presented by American Family Insurance - 204 - Andy Richter V Scot Armstrong,9703,2021-09-01 23:39:31,2021-09-02T02:06:02.886774
20,richwcampbell,Final Fantasy XIV Online,UCOB TODAY,8642,2021-09-01 15:30:31,2021-09-02T02:06:02.886774
21,QTCinderella,Just Chatting,Cake Decorating with Maya | !clips !youtube !instagram,8012,2021-09-02 01:14:01,2021-09-02T02:06:02.886774
22,masondota2,Dota 2,clout player,7964,2021-09-01 16:53:58,2021-09-02T02:06:02.886774
23,AnthonyZ,Grand Theft Auto V,!Instagram | IM BACK!!!  Tony Corleone NoPixel  WL STREAMS MON-FRI 9:30AM CT!,7767,2021-09-01 14:30:50,2021-09-02T02:06:02.886774
24,k3soju,Teamfight Tactics,C9 k3soju | god of tft don't talk | !VELKOZ3 !VAYNE3 !LUCIAN3 ON !YT,7502,2021-09-01 23:34:36,2021-09-02T02:06:02.886774
25,moistcr1tikal,Just Chatting,No plan yet,7097,2021-09-02 01:37:26,2021-09-02T02:06:02.886774
26,LVNDMARK,Hunt: Showdown,Tonys Pizza !MERCH | !Headphones | !GFUEL | @LVNDMARK_tv on socials,6851,2021-09-01 19:15:14,2021-09-02T02:06:02.886774
27,HusKerrs,Call of Duty: Warzone,$2500 Mini Royale Trios Tournament | Follow @HusKerrs on all socials!,6403,2021-09-01 17:59:36,2021-09-02T02:06:02.886774
28,pokelawls,Super Animal Royale,FIRST STREAM BACK WITH DUAL PC SET UP POGGERS | !pobox | !gfuel,5431,2021-09-01 22:05:27,2021-09-02T02:06:02.886774
29,WARDELL,Escape from Tarkov,ExtractDell | @wardell416 | !socials !discord,5228,2021-09-01 20:06:07,2021-09-02T02:06:02.886774
30,buckefps,Fortnite,Watching YT Videos W/ Chat,5177,2021-09-01 18:42:48,2021-09-02T02:06:02.886774
31,brycent,VALORANT,BECOME THE IMPOSSIBLE! 🚀 !discord,4921,2021-09-02 01:01:41,2021-09-02T02:06:02.886774
32,ESL_CSGO,Counter-Strike: Global Offensive,LIVE: paiN Gaming vs Party Astronauts - ESEA Premier - NA Season 38,4900,2021-09-01 23:40:33,2021-09-02T02:06:02.886774
33,SunBaconRelaxer,Hearthstone,The new patch is making me a 3Head I need more Head Chat Help,4808,2021-09-01 20:11:33,2021-09-02T02:06:02.886774
34,TobiasFate,League of Legends,"Tobias Fate - GANGPLANK REWORK DIAMOND+
(HALF STREAM TODAY - NEED REST!) ",4580,2021-09-01 11:51:38,2021-09-02T02:06:02.886774
35,Harry,Grand Theft Auto V,Harry Brown | NoPixel - !nord !youtube ,4569,2021-09-01 16:35:54,2021-09-02T02:06:02.886774
36,Ssaab,Grand Theft Auto V,Chief Of Police Sam Baas - Nopixel | !manscaped !tonor !tiktok ,4510,2021-09-01 18:02:33,2021-09-02T02:06:02.886774
37,dapr,VALORANT,darp,4465,2021-09-02 01:02:15,2021-09-02T02:06:02.886774
38,Dezignful,Apex Legends,Eseries w/ G2 6pm CST,4396,2021-09-01 21:39:59,2021-09-02T02:06:02.886774
39,BLOU,Just Chatting,"DDG X ADIN X B LOU + TWISTER W/ HIMYNAMESTEWE & WOAHVICKY ""IM LITTY BIH"" 70 -0",4210,2021-09-02 00:39:39,2021-09-02T02:06:02.886774
40,limit_maximum,World of Warcraft,"THEY REMOVED AOE CAP
",4158,2021-09-01 17:26:36,2021-09-02T02:06:02.886774
41,supertf,Overwatch,big giant man dominating those little puny competitors before me,3989,2021-09-02 01:06:36,2021-09-02T02:06:02.886774
42,chessbrah,Chess,3200 CELEBRATION !arenainfo !clubarena ,3678,2021-09-01 21:42:15,2021-09-02T02:06:02.886774
43,JoeWo,Call of Duty: Warzone,NRG JoeWo // Humpday Heaters // !scuf !socials !yt,3583,2021-09-01 19:18:16,2021-09-02T02:06:02.886774
44,Vienna,Genshin Impact,Cloud9's Vtuber | Trying out Genshin for the first time! | #GenshinImpactPartner | Genshin 2.1 is here! #ad,3459,2021-09-01 22:48:19,2021-09-02T02:06:02.886774
45,DuelLinksMeta,Yu-Gi-Oh! Duel Links,New Character Trey! New Box Chronomaly! Top Tier or Trash!? !sneak,3455,2021-09-01 22:00:16,2021-09-02T02:06:02.886774
46,Scarra,KeyWe,[2d] for the king with hampwn + keywe with lilypichu | Day 1 Scarratember !scarratember,3275,2021-09-01 21:40:31,2021-09-02T02:06:02.886774
47,spoonkid,Rust,Alone,3274,2021-09-01 18:43:37,2021-09-02T02:06:02.886774
48,AsianGuyStream,Genshin Impact,ARCHON QUEST (BEWARE OF SPOILERS),3204,2021-09-01 22:59:58,2021-09-02T02:06:02.886774
49,EsportsArena,Apex Legends,Series E: Apex Legends Season III | !seriese !season !giveaway,3185,2021-09-01 22:19:16,2021-09-02T02:06:02.886774
50,Weak3n,SMITE,Lets check out patch notes |!GFuel !HappyHemp !Mavix | !Giveaway $4000 XIDAX PC Giveaway,3161,2021-09-01 23:18:24,2021-09-02T02:06:02.886774
51,EsfandTV,World of Warcraft,GETTING DST PLEASE!!! 2200+ TBC RET PALADIN ARENAS,3069,2021-09-01 19:32:47,2021-09-02T02:06:02.886774
52,fobm4ster,Genshin Impact,"[AR59] SPOILER DOING QUEST C6R5 Today, I have big BAALs #ad !nord !yoimiya !pobox !youtube",2940,2021-09-01 22:26:46,2021-09-02T02:06:02.886774
53,boxbox,VALORANT,PauseChamp Top Frag Bob PauseChamp,2906,2021-09-01 20:04:42,2021-09-02T02:06:02.886774
54,AussieAntics,Fortnite,DROPS ENABLED | 1v1s With Viewers | !PLAY | Boomer -> Mech Demon (Day 1),2860,2021-09-01 23:42:23,2021-09-02T02:06:02.886774
55,The_Happy_Hob,Tenchu: Stealth Assassins,No Hit Run (LEARNING it still mate. !newbet [4/10] [102.23] [Chapter 1982: Looking for that shot] !displate !pc,2819,2021-09-01 20:08:06,2021-09-02T02:06:02.886774
56,hJune,Apex Legends,"NEW ANIMATED EMOTES - hjuneWAVE, hjuneJAM, hjuneHOP, hjuneHYPE, hjuneNOTED",2727,2021-09-01 22:50:24,2021-09-02T02:06:02.886774
57,Whippy,Grand Theft Auto V,DUNDEE UP GOOD nopixel !Lenovo !Nordvpn !G2A !meta,2713,2021-09-02 00:59:25,2021-09-02T02:06:02.886774
58,BarbarousKing,Super Mario World,Workin in Lunar Magic,2623,2021-09-01 23:02:06,2021-09-02T02:06:02.886774
59,DizzyKitten,Apex Legends,Ranked with Lexi and Shin!,2614,2021-09-01 22:08:59,2021-09-02T02:06:02.886774
60,TheNicoleT,"Pools, Hot Tubs, and Beaches",HOTTUB PARTY TIME!  - Tier 2/3 subs get SNAP !ytasmr !socials,2533,2021-09-02 00:22:51,2021-09-02T02:06:02.886774
61,S_Palms,Grand Theft Auto V,Kimmy Youngirl | NoPixel WL ,2475,2021-09-01 19:35:22,2021-09-02T02:06:02.886774
62,Mathil1,Path of Exile,"Mathil - Wand Inquis, phys->ele scaling, hybrid life/es, other stuff I dno, dat Flame Wall MTX tho",2462,2021-09-01 19:30:36,2021-09-02T02:06:02.886774
63,Kruzadar,Phasmophobia,⚠️hangin w/ the homies later,2411,2021-09-01 23:02:23,2021-09-02T02:06:02.886774
64,ChelbM,Grand Theft Auto V,Alan Kyles | NBC | No Pixel WL | !nbc !socials,2304,2021-09-01 21:57:11,2021-09-02T02:06:02.886774
65,Sommerset,Fortnite,Not Ending until 200k Arena pts! | DUO ARENA W/ JIVI | NEW YT VID! | !vid !socials,2297,2021-09-01 17:11:24,2021-09-02T02:06:02.886774
66,Artosis,StarCraft,"GSL Tonight, Ladder today. Will I advance?",2283,2021-09-02 00:25:19,2021-09-02T02:06:02.886774
67,Zoomaa,Call of Duty: Warzone,"VERDANSK w/ Scump, Methodz, and Holly / #ZooMafia !discord !reddit !astro",2179,2021-09-01 20:04:01,2021-09-02T02:06:02.886774
68,Hungrybox,Super Smash Bros. Ultimate,"350+ ENTRANTS! THE JUICE BOX 49 Feat. Ven, ChunkyKong, ShinyMark, Kiyarash, Sharp, rm8, and more!  ■ !youtube !box",2177,2021-09-01 21:03:38,2021-09-02T02:06:02.886774
69,Calebhart42,Final Fantasy VII,6:58 TONIGHT OR I..... | @calebhart42 IG/Twitter,2169,2021-09-02 00:48:25,2021-09-02T02:06:02.886774
70,TPAIN,Music,WE ESCAPED THE DRESSING ROOM! Welcome back. !postsong !discord !TheSquad !PizzlePack !rig !book !nbr !ilikedat,2140,2021-09-02 00:07:57,2021-09-02T02:06:02.886774
71,Jynxzi,Tom Clancy's Rainbow Six Siege,CHAMPION RANKED,2128,2021-09-01 20:13:20,2021-09-02T02:06:02.886774
72,mang0,Super Smash Bros. Melee,SECONDARY WEEK CONTINUES ,2089,2021-09-01 23:19:04,2021-09-02T02:06:02.886774
73,Tommey,Call of Duty: Warzone,"$2,500 Badassbulls NFT - 100T @Tommey - !merch",2067,2021-09-01 18:42:27,2021-09-02T02:06:02.886774
74,Ramez05,Final Fantasy XIV Online,Finishing Stormblood MSQ Today! | NEW Players CLICK HERE !Server !Guild !Freetrial  !NordVPN #AD,2027,2021-09-02 00:27:04,2021-09-02T02:06:02.886774
75,TeamSp00ky,Street Fighter V,NLBC online Week 77 SFV - each sub adds $1 to prize pool! | !bracket !matcherino !nordvpn !metaview !spooky,2004,2021-09-01 23:05:31,2021-09-02T02:06:02.886774
76,Anton,Escape from Tarkov,Tarkov Adventures ,1990,2021-09-01 21:14:57,2021-09-02T02:06:02.886774
77,antonychenn,Genshin Impact,I like Baals !converse #ad ,1942,2021-09-02 00:14:16,2021-09-02T02:06:02.886774
78,Yuggie_TV,Just Chatting,Las Vegas Day 3 - My Birthday!! | !merch !ig !youtube,1924,2021-09-01 20:47:50,2021-09-02T02:06:02.886774
79,FORMAL,VALORANT,Wassup,1920,2021-09-02 01:09:39,2021-09-02T02:06:02.886774
80,Surefour,Apex Legends,I just want be shoot mans in vidya,1902,2021-09-02 01:40:32,2021-09-02T02:06:02.886774
81,Spicalol,League of Legends,TSMFTX Spica - playing mid D4 start  !blitz,1899,2021-09-01 22:47:19,2021-09-02T02:06:02.886774
82,Zerina,Dungeons & Dragons,[5E] Arctis Session 18: The Polcanic Problem,1897,2021-09-02 01:10:43,2021-09-02T02:06:02.886774
83,gamergirl,League of Legends,chalenger kat 😉 try harding!! ! ,1864,2021-09-01 23:54:13,2021-09-02T02:06:02.886774
84,shanks_ttv,VALORANT,single shanky </3,1856,2021-09-02 01:19:32,2021-09-02T02:06:02.886774
85,kClient,Grand Theft Auto V,Peanut | NBC | NoPixel | !Twitter | !Discord & !nbc,1819,2021-09-01 22:03:29,2021-09-02T02:06:02.886774
86,cyr,Sea of Thieves,SEPTEMBER WE GO HARD. I WANNA GO HARD IN HADES TODAY SOOOOOOOOOO BAD. PLZ. ,1805,2021-09-01 22:06:43,2021-09-02T02:06:02.886774
87,CaptainSparklez,Minecraft,let's run some vaults,1731,2021-09-02 00:21:58,2021-09-02T02:06:02.886774
88,JOEYKAOTYK,Just Chatting,SF | National 91 Day w/ !fanfan | NEW !YT VID - !project10 !topclip !social,1680,2021-09-01 20:14:44,2021-09-02T02:06:02.886774
89,Nika,SMITE,SMITE SMITE SMITE WOO TRYING NEW HEADSET AGAIN ,1664,2021-09-01 23:07:33,2021-09-02T02:06:02.886774
90,LoLWorldChampionship,League of Legends,🔴 Season 6 - EDG vs ITZ 🔴 Week 2 Group C | 37 Days (24/7) of League of Legends Worlds | !Schedule !Spoilers | Rebroadcasting Seasons 1-10,1641,2021-08-31 17:28:26,2021-09-02T02:06:02.886774
91,PotasticP,Just Chatting,im finally back home ^W^ lets catch up!,1634,2021-09-01 23:54:43,2021-09-02T02:06:02.886774
92,Konvy,Just Chatting,W DAILY STREAMER !sub !twitter !ig,1613,2021-09-01 19:35:28,2021-09-02T02:06:02.886774
93,theRealShooKon3,Just Chatting,WE ON THE HOUSE BOAT!,1608,2021-09-02 00:15:04,2021-09-02T02:06:02.886774
94,CrReaM,Just Chatting,Another Title You Wont Read - !VPN !Apparel,1605,2021-09-02 01:23:51,2021-09-02T02:06:02.886774
95,GsxrClyde,Destiny 2,!day1 Iron Banner + Pinnacles // 1343 Power // !gamersupps !artesian,1602,2021-09-01 19:51:34,2021-09-02T02:06:02.886774
96,LuckyChamu,Call of Duty: Warzone,cheating with LWAGG lol | !new !yt,1555,2021-09-02 00:23:25,2021-09-02T02:06:02.886774
97,ghazzytv,Path of Exile,[STASH RESET] LOW Budget Dom Blow Progression | !Build !Nexus ,1548,2021-09-01 17:57:35,2021-09-02T02:06:02.886774
98,XenosysVex,Final Fantasy XIV Online,Chillin React PF I Raid I Thicc Dad I Passion Auburn,1522,2021-09-02 01:18:03,2021-09-02T02:06:02.886774
99,Bum1six3,Dragon Ball FighterZ,"COM 67 for DBFZ on the PS4 Tourney is live now with 90 entrants with players like Lotus, Alukard, Scamby, Hikari and more in the bracket!!!
",1508,2021-09-01 20:00:49,2021-09-02T02:06:02.886774
