,user_name,game_name,title,viewer_count,started_at,api_call_time
0,Sykkuno,Grand Theft Auto V,chillin on gta,43843,2021-07-20 23:10:59,2021-07-21T01:06:07.261356
1,loltyler1,League of Legends,PRECISION AND SWAG to TOP OF MIDDLE ! sometime also circle circus cow . OKAY !!!!,36966,2021-07-20 21:12:48,2021-07-21T01:06:07.261356
2,ludwig,Rust,✅[DROPS ON] ELUSIVE CARS BED GET IT WHILE ITS HOT,32931,2021-07-20 20:46:19,2021-07-21T01:06:07.261356
3,Swagg,Call of Duty: Warzone,"$75,000 Twitch Rivals Tourney | 21+ Liquid Vibes | FaZe Nuke Squad | Powered by: Corona Hard Seltzer | CODE: SWAGG | !sub !blm",32627,2021-07-20 20:22:37,2021-07-21T01:06:07.261356
4,HasanAbi,Just Chatting,#1 REACT ANDY DRAMA ANDY NEWS ANDY,29918,2021-07-20 18:05:16,2021-07-21T01:06:07.261356
5,ROSHTEIN,Slots,⭐ COZY SPINS | $1.4 MILLION on !GATES | $2.5 MILLION WIN ON !RECORD 💠 USE !STAKE CASH RAFFLES,25132,2021-07-20 16:01:52,2021-07-21T01:06:07.261356
6,buddha,Grand Theft Auto V,Lang Buddha - NoPixel | !tiktok !website,23910,2021-07-20 19:30:50,2021-07-21T01:06:07.261356
7,zackrawrr,New World,new world--big dick--drops active,23891,2021-07-20 23:36:36,2021-07-21T01:06:07.261356
8,Mizkif,Mario Kart 8,LOTS TO TALK ABOUT !POBOX,21991,2021-07-20 20:38:14,2021-07-21T01:06:07.261356
9,Tfue,Call of Duty: Warzone,"$75,000 Rivals Tourney on NEW SETUP (9.69 KD)",18997,2021-07-20 20:57:57,2021-07-21T01:06:07.261356
10,Bugha,Fortnite,"MY FORTNITE SKIN IS LIVE - Use Code ""Bugha"" in the item shop | !CodeBugha #epicpartner",17970,2021-07-20 16:09:34,2021-07-21T01:06:07.261356
11,limit_maximum,World of Warcraft,RWF: i'm gonna hose you down,17756,2021-07-20 15:46:36,2021-07-21T01:06:07.261356
12,RatedEpicz,Grand Theft Auto V,Randy Bullet | Chang Gang | GTA V RP | NoPixel | !youtube !newvid,16941,2021-07-20 20:44:01,2021-07-21T01:06:07.261356
13,cloakzy,Call of Duty: Warzone,Warzone tourney (1 min delay),16216,2021-07-20 22:00:47,2021-07-21T01:06:07.261356
14,Fextralife,New World,🔴!DROPS ENABLED🔴 !GIVEAWAY !extension NEW WORLD with YURIA! #BFNW #EUCovenant NAV SERVER,15987,2021-07-21 00:06:30,2021-07-21T01:06:07.261356
15,Tectone,Genshin Impact,HUGE GIVEAWAY 4 FOLLOWERS FOR INUZUMA TODAY :D PLS GOD AYAKA BE FUN WON'T STOP STREAMING UNTIL IM ON RGB ISLANDS ,15852,2021-07-20 19:26:36,2021-07-21T01:06:07.261356
16,LVNDMARK,Escape from Tarkov,[LVL 54] Fifth !24H Stream in a row | NEW !MERCH | !GFUEL | @lvndmark_tv on socials,15807,2021-07-20 10:19:55,2021-07-21T01:06:07.261356
17,Russel,Just Chatting,"IRL STREAM WITH SODA, ALINITY, CYR, AND POKE | !Youtube | !vods | !socials https://russel.tv/ |",15514,2021-07-20 20:00:41,2021-07-21T01:06:07.261356
18,Aydan,Call of Duty: Warzone,"$75,000 Twitch Rivals Trio Customs w/ Rated & Skullface | !tourney !loadouts !yt",15402,2021-07-20 20:56:06,2021-07-21T01:06:07.261356
19,Amouranth,ASMR,👅LICKING EARS SUBATHON💦 !s --> all my social media💦!instagram: @amouranth💦,15189,2021-07-20 22:59:06,2021-07-21T01:06:07.261356
20,MOONMOON,RimWorld,🤨 NEW RIMWORLD EXPANSION??? You will not believe what I did...,14621,2021-07-20 22:22:12,2021-07-21T01:06:07.261356
21,Myth,Rust,Drops ✅ - GET THE XQC SAR AND THE MYTH AK DROP HERE - !socials,14609,2021-07-20 17:55:01,2021-07-21T01:06:07.261356
22,Complexity,World of Warcraft,Race to World First: Sanctum of Domination Complexity-Limit - Day 8,14217,2021-07-20 11:52:06,2021-07-21T01:06:07.261356
23,summit1g,Final Fantasy XIV Online,dunno if ill like it but ill try it level 50 Dragoon. Merch dropped summit1g.gg  [ @summit1g ],13092,2021-07-20 22:02:56,2021-07-21T01:06:07.261356
24,Enviosity,Genshin Impact,2.0 DROPPING TODAY POGGERS | !gfuel | Day 297,12809,2021-07-20 13:25:03,2021-07-21T01:06:07.261356
25,TwitchRivals,Call of Duty: Warzone,Twitch Rivals CoD: Warzone Showdown (NA),12003,2021-07-20 20:45:02,2021-07-21T01:06:07.261356
26,Method,World of Warcraft,REBROADCAST 🔴RACE TO WORLD FIRST Day 07 | NEVER miss a moment method.gg/progress | !wagoapp !rwfgg !charity !casters,11386,2021-07-19 23:52:19,2021-07-21T01:06:07.261356
27,Ramee,Grand Theft Auto V,Ramee | !Twitter | Chang Gang | NoPixel,10409,2021-07-20 19:05:08,2021-07-21T01:06:07.261356
28,Maximilian_DOOD,Guilty Gear: Strive,GG STRIVE - 1st DLC Reveal Trailer LIVE (7-20) !nzxt ,9949,2021-07-21 00:51:07,2021-07-21T01:06:07.261356
29,khleothomas,Mario Kart 8 Deluxe,Racing and Snacking with Nintendo x EdibleArrangements #ad,9586,2021-07-21 00:58:30,2021-07-21T01:06:07.261356
30,futs0013,,,9580,2021-07-20 22:15:27,2021-07-21T01:06:07.261356
31,richwcampbell,Final Fantasy XIV Online,Time to beat Heavensward | New World Later?,9574,2021-07-20 21:11:27,2021-07-21T01:06:07.261356
32,DiazBiffle,Call of Duty: Warzone,"$75,000 Twitch Rivals Custom Lobbies Tournament (DELAY)| !scuf | !youtube | @DiazBiffle",9360,2021-07-20 21:11:33,2021-07-21T01:06:07.261356
33,Pestily,Escape from Tarkov,[LVL 12] 1-20 SPEED RUN TODAY | PC GIVEAWAY #11 LIVE | best player in the world | DAY 20 CONTINUOUSLY LIVE,9325,2021-07-19 17:25:37,2021-07-21T01:06:07.261356
34,lilypichu,Muck,a lil sick,8957,2021-07-20 23:19:13,2021-07-21T01:06:07.261356
35,ironmouse,Just Chatting,CULTURED TAGS WITH MY NYANNERS !merch,8930,2021-07-21 00:21:44,2021-07-21T01:06:07.261356
36,TSM_ImperialHal,Apex Legends,Hottest rank team??? | TSMFTX,8280,2021-07-21 00:13:30,2021-07-21T01:06:07.261356
37,EsfandTV,New World,"[DROPS] SUDDENE SERVER FOR CHADS --GOOD AT GAMES, CHARISMATIC, HANDSOME, AND SMART.... I'M NONE OF THOSE THINGS BUT WATCH THIS STREAM",8222,2021-07-20 20:23:22,2021-07-21T01:06:07.261356
38,Zerkaa,Grand Theft Auto V,TOMMY TATE | NoPixel WL | !nprules,7643,2021-07-20 21:05:29,2021-07-21T01:06:07.261356
39,TeePee,Call of Duty: Warzone,$75K Twitch Rivals Showdown Tourney RIGHT NOW (60 second delay) | Code TEEP in COD Store #CodPartner | !tourney,7497,2021-07-20 15:36:26,2021-07-21T01:06:07.261356
40,NoraExplorer,Rust,🐴 OTV & xQc Semi Rifle💰 [ Drops Enabled ],7440,2021-07-20 19:25:59,2021-07-21T01:06:07.261356
41,Im_Dontai,Friday the 13th: The Game,Lounge 6 - Friday The 13th,7348,2021-07-20 22:01:57,2021-07-21T01:06:07.261356
42,HusKerrs,Call of Duty: Warzone,"$75,000 Twitch Rivals Customs w/ JoeWo & MuTeX !slayout | Follow @HusKerrs on all socials",7327,2021-07-20 18:41:45,2021-07-21T01:06:07.261356
43,Zizaran,Path of Exile,💥PoE - Patch Notes NOW 💥| !Youtube | Merch: shop.zizaran.com,7191,2021-07-20 22:27:51,2021-07-21T01:06:07.261356
44,tuonto,Genshin Impact,inazuma,7126,2021-07-21 00:58:19,2021-07-21T01:06:07.261356
45,ChilledChaos,Ghost Hunters Corp,I AINT AFRAID OF NO GHOST! (Ghost Hunter Corps w/ Friends),7106,2021-07-20 16:19:14,2021-07-21T01:06:07.261356
46,ShahZaM,VALORANT,SEN ShahZaM - RADIANT RANKED,6742,2021-07-21 00:31:44,2021-07-21T01:06:07.261356
47,UMGGaming,Gears 5,Vanquish vs Fire N Ice | Gears Pro League | Split 3 Phase 2 Day 2,6238,2021-07-20 20:45:03,2021-07-21T01:06:07.261356
48,JustaMinx,Overwatch,OVERWATCH WITH JACK AND GEE / ATTEMPTING 24 HOUR,5653,2021-07-20 19:52:30,2021-07-21T01:06:07.261356
49,daltoosh,Apex Legends,Apex then maybe some variety,5483,2021-07-20 20:41:17,2021-07-21T01:06:07.261356
50,scump,Call of Duty: Black Ops Cold War,"The Extra Push | Use Code ""SCUMP"" in the CoD Store!",5319,2021-07-21 00:04:08,2021-07-21T01:06:07.261356
51,Jinnytty,Just Chatting,Welcome back to Texas Austin !,5250,2021-07-20 23:19:46,2021-07-21T01:06:07.261356
52,its_iron,Call of Duty: Warzone,Twitch Rivals with Bread and Yeet | !Merch !GFUEL !Evolve !Metaview !Kovaak,5184,2021-07-20 20:48:53,2021-07-21T01:06:07.261356
53,Choice,Black Desert Online,ᴺᴬ 720 GS Zerk/Striker | Welcome Back Droppers | !VPN !Raid !PENDeb #ad,5059,2021-07-20 20:35:52,2021-07-21T01:06:07.261356
54,masondota2,Dota 2,TRYHARD DAY. NOT KIDDING. NEVER GIVE UP. LETS GO!!!,4862,2021-07-20 21:47:17,2021-07-21T01:06:07.261356
55,FanumTV,Grand Theft Auto V,CEO WANUM - Quick Stream,4830,2021-07-21 00:34:51,2021-07-21T01:06:07.261356
56,Sequisha,New World, 🛠️Craft-Lord🗜️Cartoons🐲 #BFNW Sponsored,4715,2021-07-20 14:00:56,2021-07-21T01:06:07.261356
57,RaizQT,Path of Exile,🔴 PATCH NOTES TIME then lost arking ,4472,2021-07-20 22:31:51,2021-07-21T01:06:07.261356
58,Spaceboy,Grand Theft Auto V,The Execution of Melbert Rickenbacker,4396,2021-07-20 19:34:47,2021-07-21T01:06:07.261356
59,iiTzTimmy,VALORANT,instalocking jett in !vct // !nordvpn // Follow my socials @iiTzTimmy,4389,2021-07-20 18:10:50,2021-07-21T01:06:07.261356
60,GuhRL,Apex Legends,"All Female JukaScrims! Come get your free loading screen, drops enabled  🙂  !drops !youtube !tiktok",4272,2021-07-20 11:24:05,2021-07-21T01:06:07.261356
61,Mrgregles,Music,Monkey wears human suit and plays drums | !dream,4242,2021-07-20 17:23:09,2021-07-21T01:06:07.261356
62,TobiasFate,League of Legends,Tobias Fate - NO REST. UNLIMITED BILGEWATER GAMING. INCREDIBLE. IT'S HIGH ELO. IT'S INSANE. ,4232,2021-07-20 15:07:13,2021-07-21T01:06:07.261356
63,nerdstreet,VALORANT,Virtuoso vs Ghost Gaming | NSG $2500 Valorant Summer Champs Open 12,4152,2021-07-20 20:39:44,2021-07-21T01:06:07.261356
64,Scarra,Final Fantasy XIV Online,ff14 today?,4148,2021-07-20 22:00:15,2021-07-21T01:06:07.261356
65,scoped,Fortnite,Bugha Game Mode w/ FaZe Sway & Okis | 3rd in Cash Cup,4098,2021-07-20 22:54:24,2021-07-21T01:06:07.261356
66,ToreSays,Talk Shows & Podcasts,July 20 2021,3691,2021-07-20 23:33:54,2021-07-21T01:06:07.261356
67,Ray__C,Grand Theft Auto V,NEW HEIST HACK - The Bois are Back!! Raymond Romanov NoPixel Main - !advanced !newv,3623,2021-07-20 21:54:58,2021-07-21T01:06:07.261356
68,Ssaab,Grand Theft Auto V,Sgt Detective Baas - Eid Mubarak - Nopixel | !karma !NordVPN !tiktok,3544,2021-07-20 18:41:06,2021-07-21T01:06:07.261356
69,AvoidingThePuddle,Shenmue,Shenmue - Shirts and Mugs http://teespring.com/stores/ATP,3535,2021-07-20 21:22:25,2021-07-21T01:06:07.261356
70,JoshOG,New World,New World Marauders Faction Leader!! !NewWorld ~~ !Giveaway 2x 2080 GIVEAWAY for July!!,3503,2021-07-20 15:09:20,2021-07-21T01:06:07.261356
71,Sacriel,New World,COVENANT LEADER of New World — !NW !dropsinfo !extension for keys + drop,3493,2021-07-20 14:59:42,2021-07-21T01:06:07.261356
72,MuTeX,Call of Duty: Warzone,"$75,000 Twitch Rivals Customs Tournament!",3486,2021-07-20 20:12:26,2021-07-21T01:06:07.261356
73,Pieface23,F1 2021,(UK) Xbox Online Lobbies!,3413,2021-07-20 21:08:55,2021-07-21T01:06:07.261356
74,SunBaconRelaxer,Hearthstone,"12.7K Start. Head down, Points up!",3366,2021-07-20 20:46:47,2021-07-21T01:06:07.261356
75,CDNThe3rd,New World,[👀DROPS: Golden Rage Armor Skin] | New World Beta PvP | Socials: @CDNThe3rd,3363,2021-07-20 16:08:11,2021-07-21T01:06:07.261356
76,GamesDoneQuick,Star Wars: Knights of the Old Republic,Time Capsule - 2003: Volume III - Star Wars: KOTOR featuring sanjan_,3274,2021-07-20 22:50:40,2021-07-21T01:06:07.261356
77,Welyn,Rust,[DROPS] EPIC GAMER MOMENTS !NEWVID !PUMPKIN !GFUEL,3185,2021-07-20 19:40:32,2021-07-21T01:06:07.261356
78,BurkeBlack,New World,PvP Flagged! !DROPS NA EAST YAMA Syndicate !NWDiscord💀 !NewWorld #BFNW 💀 Creator Code: BurkeBlack 💀  !NordVPN #AD 💀 !Xfinity,3182,2021-07-20 14:17:38,2021-07-21T01:06:07.261356
79,Sajam,Guilty Gear: Strive,Sajam: New Character Reveal! ,3181,2021-07-21 00:44:04,2021-07-21T01:06:07.261356
80,tyongeee,Just Chatting,"[ENG/KOR] Road Trip stream! !merch !gg l Amarillo, TX",3170,2021-07-20 21:22:51,2021-07-21T01:06:07.261356
81,DarkViperAU,Grand Theft Auto V,Dooms Day Heist - Finally,3122,2021-07-21 00:06:40,2021-07-21T01:06:07.261356
82,RubberNinja,Final Fantasy XIV Online,EGGWALKER SUBATHON | EATING 138K+ EGGS | EVERY 1000 SUBS 999 EGGS ARE ADDED | MALBORO - CRYSTAL,2902,2021-07-20 16:58:08,2021-07-21T01:06:07.261356
83,figura80,,,2901,2021-07-20 23:58:08,2021-07-21T01:06:07.261356
84,KYR_SP33DY,Ghost Hunters Corp,Howdy! - Ghost Hunter Corps And Fall Guys Later!,2900,2021-07-20 21:33:04,2021-07-21T01:06:07.261356
85,GunnarDotA2,Dota 2,back to back winning days?,2892,2021-07-20 20:21:16,2021-07-21T01:06:07.261356
86,NBA,Sports,NBA Finals Live Influencer Scoreboard with Devin Williams & Marcelas Howard | Suns @ Bucks Game 6,2865,2021-07-21 01:00:02,2021-07-21T01:06:07.261356
87,Destiny,RimWorld,"Rimworld DLC, ""Losing is fun"" + ""Commitment mode""",2811,2021-07-20 19:04:05,2021-07-21T01:06:07.261356
88,Tommey,Call of Duty: Warzone,"$75,000 Twitch Rivals - 100T @Tommey - !giveaway",2703,2021-07-20 20:17:17,2021-07-21T01:06:07.261356
89,tarik,VALORANT,Soup @tarik // !tik !new,2657,2021-07-21 00:20:14,2021-07-21T01:06:07.261356
90,BarbarousKing,Dark Souls,Item / Enemy / Boss Randomizer - Let's go check 700 items and fight Manus,2640,2021-07-20 23:01:03,2021-07-21T01:06:07.261356
91,Yassuo,VALORANT,GOLD TO RADIANT GRIND :) Diamond peak ,2625,2021-07-20 20:58:00,2021-07-21T01:06:07.261356
92,jdefjeu,,,2549,2021-07-20 21:44:01,2021-07-21T01:06:07.261356
93,TeeGrizzley,Call of Duty: Warzone,WARZONE W/ CHAT | Warzone | !sub | !newyt | !glizzy,2489,2021-07-20 22:12:01,2021-07-21T01:06:07.261356
94,erobb221,God of War,literal manchild plays games,2452,2021-07-20 21:09:26,2021-07-21T01:06:07.261356
95,JoeWo,Call of Duty: Warzone,"NRG JoeWo // $75,000 Twitch Rivals w/ Husk & Mutex // !socials !yt !scuf",2412,2021-07-20 21:06:29,2021-07-21T01:06:07.261356
96,julien,Resident Evil Village,bep bep,2351,2021-07-20 22:03:29,2021-07-21T01:06:07.261356
97,Albralelie,Apex Legends,TSMFTX - Rank w/zach and naughty || !socials !d iscord !froge,2350,2021-07-20 23:00:43,2021-07-21T01:06:07.261356
98,ops1x,Fortnite,Bugha cup w reet nd donnie ( 1 year stream day 34/365),2293,2021-07-21 00:02:15,2021-07-21T01:06:07.261356
99,ANGRYPUG,Dead by Daylight,"20,394 escapes and counting #1 WORLD",2277,2021-07-21 00:01:04,2021-07-21T01:06:07.261356
