,user_name,game_name,title,viewer_count,started_at,api_call_time
0,RanbooLive,Minecraft,THIS SERVER IS FINITE. VERY ORIGINAL IDEA YEP MHM ,95494,2021-06-22 23:29:48,2021-06-23T00:06:02.283721
1,xQcOW,Just Chatting,LOST MAN FADES OUT IN THE MIST. (GONE WRONG) (FAILED),67315,2021-06-22 18:53:38,2021-06-23T00:06:02.283721
2,Rainbow6,Tom Clancy's Rainbow Six Siege,Soniqs vs. XSET | R6 NAL 2021 - Stage 2 - Playday 3,44263,2021-06-22 19:15:31,2021-06-23T00:06:02.283721
3,TimTheTatman,Call of Duty: Warzone,Call Of Duty: WSOW Practice with Frozone and Sirciz! #CoD_Partner,39721,2021-06-22 15:09:44,2021-06-23T00:06:02.283721
4,Asmongold,World of Warcraft,I DONATE 1000 DOLLARS EVERY ITEM I GET--MASSIVE CHARITY STREAM--HUGE GIVEAWAYS !charity !compare #ad GET IN HERE RIGHT NOW! ,39501,2021-06-22 15:13:22,2021-06-23T00:06:02.283721
5,Sykkuno,Grand Theft Auto V,chill day,33592,2021-06-22 18:54:39,2021-06-23T00:06:02.283721
6,summit1g,Grand Theft Auto V,NoPixel Main. Merch dropped summit1g.gg  [ @summit1g ],30784,2021-06-22 20:07:58,2021-06-23T00:06:02.283721
7,MOONMOON,Grand Theft Auto V,"on the run, yung dab",27578,2021-06-22 22:57:09,2021-06-23T00:06:02.283721
8,ROSHTEIN,Slots,"⭐ OPENING 81 BONUSES + 700 STREET FIGHTER & SUPER ON TOMBSTONE 💠 USE !GAMDOM use code ""ROSH"" to be eligible for free money raffle",26678,2021-06-22 13:23:24,2021-06-23T00:06:02.283721
9,HasanAbi,Just Chatting,WATCHING DA BABY INTERROGATION,24457,2021-06-22 17:59:48,2021-06-23T00:06:02.283721
10,loltyler1,League of Legends,TURBO TONS ! LIKE WEIGHED AND SIZE BIG ALSO DOING COOL ! TYLER1 ! ,24081,2021-06-22 22:27:42,2021-06-23T00:06:02.283721
11,buddha,Grand Theft Auto V,Lang Buddha - NoPixel | !website !tiktok,23774,2021-06-22 16:38:51,2021-06-23T00:06:02.283721
12,Swagg,Call of Duty: Warzone,World Series of Warzone Practice | CODE: SWAGG | !sub !blm,23036,2021-06-22 20:41:39,2021-06-23T00:06:02.283721
13,Mizkif,Just Chatting,BELLE BORSH H3H3 VIDEO,21017,2021-06-22 19:46:43,2021-06-23T00:06:02.283721
14,RatedEpicz,Grand Theft Auto V,Randy Bullet | Chang Gang | NoPixel | !youtube !newvid,20064,2021-06-22 19:53:22,2021-06-23T00:06:02.283721
15,RiceGum,Just Chatting,Mexico With Gang / Gambling alot $$$,18437,2021-06-22 22:38:42,2021-06-23T00:06:02.283721
16,TWIX,Overcooked! 2,Team Left TWIX or Team Right TWIX. Pick a Side.,17477,2021-06-22 22:45:12,2021-06-23T00:06:02.283721
17,sodapoppin,World of Warcraft,"🅱Tuber Kara, Gruul, Maggy | Art tag: #sodART | www.sodapoppin.shop (Discount code: POOR)",14626,2021-06-22 18:46:35,2021-06-23T00:06:02.283721
18,Amouranth,ASMR,UNBANNED!🍑ASMR💦use headphones💦!s !social💦!instagram: @amouranth💦,14291,2021-06-22 16:22:57,2021-06-23T00:06:02.283721
19,shroud,World of Warcraft,Raid DAY!  | Follow @shroud on socials,13530,2021-06-22 20:55:24,2021-06-23T00:06:02.283721
20,Aydan,Call of Duty: Warzone,Custom Practice Games w/ Rated & HusKerrs | !loadouts !twitter,13236,2021-06-22 20:40:40,2021-06-23T00:06:02.283721
21,LVNDMARK,Escape from Tarkov,NEW STIM IS WILD | !GFUEL | !Youtube | !MERCH | @lvndmark_tv on socials,11111,2021-06-22 19:12:44,2021-06-23T00:06:02.283721
22,Emongg,Overwatch,DROPS ENABLED GOING TO WIN MORE GAMES BY WINNING - !shock !ibuypower !minecraft,10676,2021-06-22 15:23:36,2021-06-23T00:06:02.283721
23,Clix,Fortnite,Solo All Star Practice Event ,10295,2021-06-22 23:51:22,2021-06-23T00:06:02.283721
24,sweetdreams,Apex Legends,NRG Sweet ~ ranked !tiktok !youtube,9903,2021-06-22 17:03:53,2021-06-23T00:06:02.283721
25,ShahZaM,VALORANT,SEN ShahZaM - NEW UPDATE HYPE,8931,2021-06-22 23:28:49,2021-06-23T00:06:02.283721
26,sinatraa,VALORANT,sinatraa - ranked !newvid,8856,2021-06-22 22:51:10,2021-06-23T00:06:02.283721
27,Ramee,Grand Theft Auto V,Ramee | !Twitter | Chang Gang | NoPixel,8321,2021-06-22 18:57:47,2021-06-23T00:06:02.283721
28,UMGGaming,Gears 5,Rebel vs Hive | Gears Pro League | Split 3 Phase 1 Day 7,7969,2021-06-22 20:45:01,2021-06-23T00:06:02.283721
29,ironmouse,Just Chatting,MY CHAMPION TRAINING ARC WITH KOEFFICIENT,7266,2021-06-22 23:02:04,2021-06-23T00:06:02.283721
30,StableRonaldo_,Fortnite,Getting To champs Dont care if its all night !newvid !talentshow !discmod,7242,2021-06-22 23:00:16,2021-06-23T00:06:02.283721
31,DiazBiffle,Call of Duty: Warzone,WSOW Practice | !scuf | !youtube | @DiazBiffle,6987,2021-06-22 23:37:28,2021-06-23T00:06:02.283721
32,HusKerrs,Call of Duty: Warzone,Code HUSKERRS in the CoD Store! !slayout | Follow @HusKerrs on all !Socials !GFuel,6789,2021-06-22 17:37:21,2021-06-23T00:06:02.283721
33,AbdulHD,Grand Theft Auto V,"Abdul - 24 Hour strum ""Racing Degen"" NoPixel !SneakEnergy !Mayor 9kAndy !Socials #GoodVibes #ToxicFree [#1UAE]",6671,2021-06-22 21:00:22,2021-06-23T00:06:02.283721
34,Indiefoxx,Music,💗PLAYING GUITAR! I'M UNBANNED NEW META? 💗 💗!s !socials 💗💗 IG:indiefoxx.tv,6660,2021-06-22 16:32:39,2021-06-23T00:06:02.283721
35,SmallAnt,Super Mario Odyssey,500 MOON DARKER SIDE SPEEDRUN,6482,2021-06-22 20:03:28,2021-06-23T00:06:02.283721
36,Hirona,Grand Theft Auto V,Trooper Copper | GTARP NoPixel,6384,2021-06-22 22:22:44,2021-06-23T00:06:02.283721
37,CohhCarnage,Battlefield 4,"Battlefield 4 (Getting ready for 2042)! - !Birthday (Charity Stream, June 25th) - !NewHouseMonth - #EpicPartner Creator Code: COHH",5956,2021-06-22 22:26:35,2021-06-23T00:06:02.283721
38,TwitchSports,Sports,"CelebriTee Showdown presented by American Family Insurance - 101 - Tanner Beard v Ryan Rottman
",5502,2021-06-22 23:41:02,2021-06-23T00:06:02.283721
39,Sneegsnag,VALORANT,NEW SEASON :) | SNEEG BLUEPOMBERRY AVAILABLE !coffee,5501,2021-06-22 20:02:34,2021-06-23T00:06:02.283721
40,KOT4Q,Just Chatting,NBA DRAFT LOTTERY !lottery,5443,2021-06-22 23:51:21,2021-06-23T00:06:02.283721
41,its_iron,Call of Duty: Warzone,WSOW Practice games | !Merch !GFUEL !Evolve !Metaview !Kovaak,5375,2021-06-22 18:25:34,2021-06-23T00:06:02.283721
42,ChilledChaos,Sea of Thieves,"PIRATES LIFE FOR ME! (Sea of Thieves w/ Chilled, Cheesy, Platy & Tay!",5346,2021-06-22 22:14:40,2021-06-23T00:06:02.283721
43,buckefps,Fortnite,NEW ARENA POINT CHAMPION | !arena,5137,2021-06-22 09:21:56,2021-06-23T00:06:02.283721
44,daltoosh,Apex Legends,APEX APEX APEX,5046,2021-06-22 19:35:02,2021-06-23T00:06:02.283721
45,Myth,VALORANT,"NEW ACT WITH MYTH, SYD & POKI GAMING ACTION - !socials",4962,2021-06-22 18:58:09,2021-06-23T00:06:02.283721
46,Mongraal,,Subathon - 1 sub = +2 minutes (sleeping),4956,2021-06-22 16:53:15,2021-06-23T00:06:02.283721
47,Pestily,Escape from Tarkov,Super Powered Stims now available | !baldstily | !MEME,4952,2021-06-22 18:31:20,2021-06-23T00:06:02.283721
48,Z_Laner,Call of Duty: Warzone,"$300,000 World Series Of Warzone Draft! | 5.8KD",4636,2021-06-22 22:49:31,2021-06-23T00:06:02.283721
49,QuarterJade,VALORANT,NEW EPISODE!!!,4606,2021-06-22 21:40:59,2021-06-23T00:06:02.283721
50,Destiny,Just Chatting,"Listening to some Kevin Samuels ""You're Average At Best"" video",4534,2021-06-22 18:25:21,2021-06-23T00:06:02.283721
51,The_Happy_Hob,The Legend of Zelda: Majora's Mask,"[1/10] No Hit Race Vs MajinPhil (6rd Run,NoReset) !newbet [31.94] [Chapter 1919: The Sub 5 dreams] !displate !pc",4504,2021-06-22 17:01:36,2021-06-23T00:06:02.283721
52,TeePee,Call of Duty: Warzone,"EnVy TeeP gaming with OpTic FormaL | Code TEEP in COD Store #CODpartner | !cali | !merch | !guns | 2,160+ Wins, 5.15 KD |",4473,2021-06-22 13:47:14,2021-06-23T00:06:02.283721
53,tarik,VALORANT,NEW ACT @tarik // !4k,3950,2021-06-22 22:40:39,2021-06-23T00:06:02.283721
54,BananaSlamJamma,Dota 2,pub mode: zen vibes,3821,2021-06-22 20:02:57,2021-06-23T00:06:02.283721
55,melina,Just Chatting,SUB AND I WILL STARE MORE   | insta: melina.goransson,3757,2021-06-22 20:34:10,2021-06-23T00:06:02.283721
56,SunBaconRelaxer,Hearthstone,12549 Top10 Start | Goal 13000,3707,2021-06-22 17:04:02,2021-06-23T00:06:02.283721
57,moistcr1tikal,Mario Kart 8,Huge mario kart tournament,3646,2021-06-22 23:58:55,2021-06-23T00:06:02.283721
58,Snip3down,Apex Legends,!Pink Beard Reveal + Subathon (48 hr max) !subathon,3509,2021-06-22 23:09:41,2021-06-23T00:06:02.283721
59,SmiteGame,SMITE,SLAYTIME IN THE DAYTIME W/ !ZED,3465,2021-06-22 20:59:37,2021-06-23T00:06:02.283721
60,akaNemsko,Chess,prep | 12th of July - FIDE WOMEN'S WORLD CUP in Russia | !wealthsimple !brave !nord,3441,2021-06-22 19:26:32,2021-06-23T00:06:02.283721
61,RayNarvaezJr,Olympic Games Tokyo 2020: The Official Video Game,!store | Gold Medal Gamer 🥇 [Series X],3435,2021-06-22 20:01:59,2021-06-23T00:06:02.283721
62,DuelLinksMeta,Yu-Gi-Oh! Duel Links,Black Luster Gaia! Anti-Dragon Deck! Banlist Tonight!?,3421,2021-06-22 22:01:27,2021-06-23T00:06:02.283721
63,Masayoshi,VALORANT,OMEGA LUL 😂 ,3374,2021-06-22 22:23:24,2021-06-23T00:06:02.283721
64,Scarra,Eternal Return: Black Survival,watch for 2 hours for an erbs emote,3325,2021-06-22 18:53:41,2021-06-23T00:06:02.283721
65,TBJZL,Just Chatting,LATE ONES,3276,2021-06-22 22:53:23,2021-06-23T00:06:02.283721
66,queensgg,Dungeons & Dragons: Dark Alliance,Queens Fix: Dark Alliance w/ @xmiramira @cray @sparkles_qt @KaylaDelancey @Bloody @EricaNagashima @MaidofMight & @helloiamkate!,3230,2021-06-22 21:50:28,2021-06-23T00:06:02.283721
67,julien,Dead by Daylight,dink dollars ,3207,2021-06-22 22:47:49,2021-06-23T00:06:02.283721
68,hJune,VALORANT,girls get it done in valo | twitter: @h7une,3158,2021-06-22 19:46:06,2021-06-23T00:06:02.283721
69,Kiyoon,Eternal Return: Black Survival,(DROPS ENABLED) TSM FTX Kiyoon | watch 2hr for erbs emote !squad | !warwick3 on !yt !notes,3038,2021-06-22 20:08:09,2021-06-23T00:06:02.283721
70,Sanchovies,League of Legends,playing some irealia or camiele or whatever idk,3010,2021-06-22 19:54:51,2021-06-23T00:06:02.283721
71,ChiringuitoDeJugones_l,Just Chatting,chiringuito de jugones,2987,2021-06-22 21:55:32,2021-06-23T00:06:02.283721
72,KhaosAdam,Grand Theft Auto V,Adam Ababwa | NoPixel | MDM | GNE GNE GNE,2928,2021-06-22 21:25:35,2021-06-23T00:06:02.283721
73,SicK_cs,VALORANT,NEW ACT PLACEMENTS | !iceland !yt !discord !faq,2900,2021-06-22 23:29:28,2021-06-23T00:06:02.283721
74,Chimp,Slots,$2700 start with a small small goal of $10000 !gamble,2891,2021-06-22 23:34:26,2021-06-23T00:06:02.283721
75,hexy,Dead by Daylight,OMG WE STREAMING AGAIN LOL HIIIIIIIIIIIIIIIIIIIIII - #SAFEMOON HODL 🚀 - @hexytv,2872,2021-06-22 20:12:07,2021-06-23T00:06:02.283721
76,Evo,Tekken 7,FGC Arcade EVO Edition - NA Region : PS Tournaments,2862,2021-06-22 22:28:21,2021-06-23T00:06:02.283721
77,LunaOni,Grand Theft Auto V,"Mayumi Himura | NoPixel WL | Chaotic Goth Gremlin! Racing maybe PC PRAYGE
!nordvpn Discord.gg/LunaOni @LunaOni_",2839,2021-06-22 18:05:38,2021-06-23T00:06:02.283721
78,ClassyBeef,Slots,🔥 18+ | OPENING 25 ($100-$200) BONUSES!! 🔥 !Tournament | !Stake for best Casino |,2694,2021-06-21 02:17:10,2021-06-23T00:06:02.283721
79,MuTeX,Call of Duty: Warzone,WSOW SERIES PRACTICE LOBBY! 3x World Record Holder | 15-15 Sens | Tuesday Vibes ❤️,2650,2021-06-22 22:32:48,2021-06-23T00:06:02.283721
80,NiceWigg,Apex Legends,BeSt CoNtRolLeR pLaYeR oN PC - LONGBOW GAMER BACK - !socials ,2588,2021-06-22 18:50:13,2021-06-23T00:06:02.283721
81,mang0,Mario Kart 8,LUDWIG MK 8 INVITATIONAL FEATURING mang0 AND CLINT STEVENS ,2582,2021-06-22 22:09:10,2021-06-23T00:06:02.283721
82,Hungrybox,Super Smash Bros. Ultimate,!summit OTK CHAMP PLAYING IN 150+ ENTRANT EARTHQUAKE 88 TOURNEY RUN! ■ SUBATHON STARTS 6/28 ■ !youtube !box !bracket,2532,2021-06-22 21:04:58,2021-06-23T00:06:02.283721
83,ops1x,Fortnite,tiktok while i eat,2508,2021-06-21 07:12:09,2021-06-23T00:06:02.283721
84,Dave5005,Overwatch,Shadow realm,2462,2021-06-22 21:23:18,2021-06-23T00:06:02.283721
85,xChocoBars,Dungeons & Dragons: Dark Alliance,gaming with celiney beanie,2459,2021-06-22 19:03:03,2021-06-23T00:06:02.283721
86,kkatamina,PHOGS!,CATDOG w/ Wendy!,2423,2021-06-22 19:59:26,2021-06-23T00:06:02.283721
87,spoonkid,Rust,solo rust !monke,2307,2021-06-22 21:56:13,2021-06-23T00:06:02.283721
88,Datto,Destiny 2,hello fellow cringelords,2284,2021-06-22 17:39:33,2021-06-23T00:06:02.283721
89,Zoomaa,Call of Duty: Warzone,WSOW PRACTICE w/ Clayster and Asim !discord !wsow,2247,2021-06-22 19:13:24,2021-06-23T00:06:02.283721
90,ShnaggyHose,Grand Theft Auto V,LAST STREAM TIL I GO TO LA !sub !donate,2233,2021-06-22 20:39:09,2021-06-23T00:06:02.283721
91,Destroy,Call of Duty: Warzone,WSOW Practice w/ Z and Belk + vibes,2190,2021-06-22 22:49:48,2021-06-23T00:06:02.283721
92,Kizziekay310,Guilty Gear: Strive,We Are back Kizzingtons! We got some fun stuff today and then some more ky,2164,2021-06-22 19:32:50,2021-06-23T00:06:02.283721
93,AngryJoeShow,Dungeons & Dragons: Dark Alliance,AJ & Crew - We try the infamous D&D Dark Alliance!,2149,2021-06-22 22:32:24,2021-06-23T00:06:02.283721
94,Skizzleman,Just Chatting,Just Chatting With Skizz,2116,2021-06-22 21:57:10,2021-06-23T00:06:02.283721
95,ESL_CSGO,Counter-Strike: Global Offensive,LIVE: Extra Salt vs RBG [Overpass] Map 1 - ESEA Premier - Playoffs - NA,2103,2021-06-22 23:07:32,2021-06-23T00:06:02.283721
96,Anton,Escape from Tarkov,WHEN WIPE? WHAT WIPE? WHERE WIPE? WHEN LAMBO? ,2099,2021-06-22 18:49:23,2021-06-23T00:06:02.283721
97,Criken,XCOM 2,"Commander, I don't feel so good... - XCOM Viewer Permadeath w/ Strippin [Day 4] !ghost",2003,2021-06-22 21:54:20,2021-06-23T00:06:02.283721
98,BarbarousKing,God of War,"Give Me God of War - The Hardest Difficulty, the Difficulty that is the most difficult",1995,2021-06-22 23:00:42,2021-06-23T00:06:02.283721
99,Faide,Apex Legends,ranked // !socials !playlist !youtube !newvid,1993,2021-06-22 23:33:25,2021-06-23T00:06:02.283721
