,user_name,game_name,title,viewer_count,started_at,api_call_time
0,AdinRoss,Just Chatting,I AM A CHAMPION,63008,2021-06-28 01:22:25,2021-06-28T03:06:02.751553
1,MOONMOON,Grand Theft Auto V,"conversations, with yung dab | big, important announcement at end of stream, whenever that may be",26856,2021-06-27 22:36:33,2021-06-28T03:06:02.751553
2,summit1g,Metro Exodus,Metro Hardest Diff. NoPixel Main. Merch dropped summit1g.gg  [ @summit1g ],21506,2021-06-27 22:23:37,2021-06-28T03:06:02.751553
3,RatedEpicz,VALORANT,Valorant w/Blau | !youtube !newvid !tiktok,18089,2021-06-27 20:01:15,2021-06-28T03:06:02.751553
4,ShahZaM,VALORANT,SEN ShahZaM - RADIANT RANKED,16707,2021-06-27 21:50:03,2021-06-28T03:06:02.751553
5,LVNDMARK,Escape from Tarkov,NO CONTAINERS !WIPE !71 | !GFUEL | !MERCH | @lvndmark_tv on socials,15342,2021-06-27 19:31:59,2021-06-28T03:06:02.751553
6,Swagg,Call of Duty: Warzone,FaZe Nuke Squad | CODE: SWAGG | !sub !blm,14302,2021-06-28 02:18:43,2021-06-28T03:06:02.751553
7,PaymoneyWubby,Just Chatting,OH BOY A LOT TO GO OVER TODAY ,13830,2021-06-28 00:30:35,2021-06-28T03:06:02.751553
8,Amouranth,"Pools, Hot Tubs, and Beaches",HOT TUB BIKINI TRY ON🍑$1000 GIVEAWAY OR I GIFT SUBS💦!s !social💦!instagram: @amouranth💦,12797,2021-06-27 16:17:26,2021-06-28T03:06:02.751553
9,moistcr1tikal,Halo 5: Guardians,"People begged me not to, but I'm going to do it anyway",12064,2021-06-28 01:16:16,2021-06-28T03:06:02.751553
10,PENTA,Grand Theft Auto V,TOWN HALL MEETING | NoPixel ,10932,2021-06-27 22:35:54,2021-06-28T03:06:02.751553
11,AdmiralBahroo,Terraria,I'll be killing Moonlord in 5 minutes.... | !timer,10853,2021-06-27 15:00:12,2021-06-28T03:06:02.751553
12,LuluLuvely,Apex Legends,NRG Lulu - Return of the Queen - follow me on !twitter @ lululuvely,10453,2021-06-27 19:12:53,2021-06-28T03:06:02.751553
13,Punz,VALORANT,derank simulation | !gfuel !merch | @Punztw on Twitter and Insta,9365,2021-06-28 01:59:01,2021-06-28T03:06:02.751553
14,ChilledChaos,Among Us,AMONG US x TOWN OF SALEM! SUBMERGED! (Among Us w/ Friends) !submerged,8919,2021-06-27 22:23:54,2021-06-28T03:06:02.751553
15,vinnie,VALORANT,SUBATHON W SAUL AND CODY,8773,2021-06-28 00:51:49,2021-06-28T03:06:02.751553
16,DiazBiffle,Call of Duty: Warzone,Bot Squad | !scuf | !youtube | @DiazBiffle,8697,2021-06-28 02:01:32,2021-06-28T03:06:02.751553
17,pokelawls,Just Chatting,YOOOOOOOOOOO - poke.gg/vods for vods | !gfuel discount code POKE,7703,2021-06-27 23:18:30,2021-06-28T03:06:02.751553
18,dasMEHDI,Grand Theft Auto V,Nino Chavez - NoPixel | !gfuel !merch !epic | TWITTER: @dasMEHDI,7684,2021-06-27 13:56:09,2021-06-28T03:06:02.751553
19,Michaelmcchill,Minecraft,RAISING THE BAR FOR CRISIS TEXT LINE - !donate !giveaway !crisistextline,7249,2021-06-27 16:00:24,2021-06-28T03:06:02.751553
20,Silky,Grand Theft Auto V,SLG-A-THON! Sanctioned RP | !sub !prime !yt !ig,6986,2021-06-27 14:47:22,2021-06-28T03:06:02.751553
21,AbdulHD,Grand Theft Auto V,"Abdul ""Wanted"" - TownHall Meeting - !NoPixel !SneakEnergy #8KAndy #GoodVibes #ToxicFree !socials !discord [#1 UAE]",6592,2021-06-27 20:35:41,2021-06-28T03:06:02.751553
22,nl_Kripp,Hearthstone,BGs | We Went To Rattlesnake Point?! https://youtu.be/yquxgxS8Cjk,6346,2021-06-28 02:01:38,2021-06-28T03:06:02.751553
23,Distortion2,Sekiro: Shadows Die Twice,HUGE Speedrun Marathon | RE & Souls | !incentive !displate,6172,2021-06-27 13:32:56,2021-06-28T03:06:02.751553
24,sneakylol,Guilty Gear: Strive,Sneaky | ky gaming,6094,2021-06-27 20:19:19,2021-06-28T03:06:02.751553
25,JoeWo,Call of Duty: Warzone,NRG JoeWo // Movement King // !socials !scuf !yt,5814,2021-06-27 21:29:35,2021-06-28T03:06:02.751553
26,Ash_on_LoL,Grand Theft Auto V,Ash Ketchupヽ(^□^)ノ!ground,5708,2021-06-28 02:06:58,2021-06-28T03:06:02.751553
27,sinatraa,VALORANT,sinatraa - ranked gaming !newvid,5219,2021-06-28 02:11:54,2021-06-28T03:06:02.751553
28,its_iron,Call of Duty: Warzone,Duo's with #1 console player | !30 | !Merch !GFUEL !Evolve !Metaview !Kovaak,5058,2021-06-28 01:18:09,2021-06-28T03:06:02.751553
29,jakenbakeLIVE,Just Chatting,IRL SF ROADTRIP DRIVING HOME W/ REALLY ANNOYING PEOPLE - Follow @jakenbakeLIVE on !Socials !YouTube,5039,2021-06-27 19:02:24,2021-06-28T03:06:02.751553
30,Masayoshi,VALORANT,raze main w/ Team Yvonnie,4944,2021-06-28 02:17:38,2021-06-28T03:06:02.751553
31,Rogue,Apex Legends,NRG Rogue · DESTROYING CHEATERS IN RANKED · Twitter: @TTrebb,4927,2021-06-28 02:17:10,2021-06-28T03:06:02.751553
32,tarik,VALORANT,GAMING @tarik // !4k,4639,2021-06-27 23:36:51,2021-06-28T03:06:02.751553
33,tarzaned,League of Legends,TRYHARDING | SUBS GET 11.13 TIER LIST | !patreon | discord.gg/tarzaned | !raid,4215,2021-06-28 00:29:15,2021-06-28T03:06:02.751553
34,BLOU,Just Chatting,"ALMOST GOT INTO FIGHT !!! @ SKI MASK CONCERT +ADIN VS FAZE RUG   ""IM LITTY BIH """,4156,2021-06-28 02:45:45,2021-06-28T03:06:02.751553
35,KYR_SP33DY,Among Us, New Among Us Map! - LAST DAY FOR MERCH! !Merch,3844,2021-06-27 22:15:41,2021-06-28T03:06:02.751553
36,CobaltStreak,The Binding of Isaac: Repentance,🍀Random Character Streak til we PB or die. [33]🍀,3685,2021-06-27 21:41:52,2021-06-28T03:06:02.751553
37,ANGRYPUG,Dead by Daylight,"20,126 escapes and counting #1 WORLD",3588,2021-06-27 23:54:21,2021-06-28T03:06:02.751553
38,TPAIN,Just Chatting,Pip is home and he came back with A PUPPY!! !TheSquad !PizzlePack !rig !book !nbr !ilikedat,3364,2021-06-28 00:10:42,2021-06-28T03:06:02.751553
39,Scarra,World of Warcraft,VTUBER PROP HUNTER COLLAB TOMORROW 3:30pm pst | wow prep later tonight,3321,2021-06-27 22:47:12,2021-06-28T03:06:02.751553
40,Destroy,Call of Duty: Warzone,Warzone Slaying + vibing w/ chat! // Sunday Chill Stream :),3317,2021-06-27 23:07:19,2021-06-28T03:06:02.751553
41,Tectone,Ring Fit Adventure,Fat man tries to not be fat,3278,2021-06-27 22:57:04,2021-06-28T03:06:02.751553
42,Mongraal,,140h+ Stream I Chilling then Sleeping I Use Code Mongraal #AD !streamuptime,3199,2021-06-28 01:24:02,2021-06-28T03:06:02.751553
43,Pieface23,FIFA 21,(UK) Sunday Funday! SBC Sending and RTG Champs!,3188,2021-06-27 21:54:45,2021-06-28T03:06:02.751553
44,DuelLinksMeta,Yu-Gi-Oh! Duel Links,Trunade is BANNED! $200 Tourney! NEW Banlist!,3173,2021-06-27 19:29:03,2021-06-28T03:06:02.751553
45,Jonthebroski,Grand Theft Auto V,Mayor Denzel Williams | NoPixel | Brand New Mic | Rare Sunday short stream ,3153,2021-06-27 18:53:28,2021-06-28T03:06:02.751553
46,Calebhart42,Final Fantasy VII,FINAL FANTASY 7 100% SPEEDRUN | @calebhart42 IG/Twitter,3119,2021-06-28 00:48:42,2021-06-28T03:06:02.751553
47,AriaSaki,Just Chatting,"UNLICENSED DOCTOR SAKI , TAKE EVERYTHING WITH A CUP OF SALT. NO, MAKE THAT A BUCKET. ",3106,2021-06-27 22:55:10,2021-06-28T03:06:02.751553
48,nycfurby,Guilty Gear: Strive,GG Strive Overdrive Tourney - Powered by American Red Cross + GFuel !matcherino !bracket,3105,2021-06-27 23:33:26,2021-06-28T03:06:02.751553
49,Murda,Just Chatting,HOOD TRACK!!!!,3013,2021-06-27 21:21:32,2021-06-28T03:06:02.751553
50,ClassyBeef,Slots,🔥 18+ | INSANE LATE NIGHT HIGH ROLL  🔥 |  !CHAOS FOR 670K WIN!! 🔥 !Tournament | !Stake for best Casino |,2980,2021-06-26 07:29:50,2021-06-28T03:06:02.751553
51,DansGaming,Until We Die,Mutant Dan plays Until We Die (PC),2958,2021-06-27 23:31:09,2021-06-28T03:06:02.751553
52,Payo,World of Warcraft,Gruul's lair then Mag - Classic Rogue | New !video,2954,2021-06-28 00:55:06,2021-06-28T03:06:02.751553
53,Five0AnthO,Grand Theft Auto V,"Trooper Sh*t
|#ad !honey !fission | !LEO !merch !tts !rank ",2865,2021-06-28 00:18:35,2021-06-28T03:06:02.751553
54,Blaustoise,VALORANT,VAL W/ THE HOMIES | supported by !glassy !nordvpn !glorious !gfuel,2849,2021-06-27 22:17:30,2021-06-28T03:06:02.751553
55,Co1azo,Fortnite,Pro Arena w/ Trashy | !gfuel !scuf | TSM FTX Co1azo,2805,2021-06-28 00:29:45,2021-06-28T03:06:02.751553
56,harbleu,Overwatch,LG harbleu | END OF SEASON RANKED AAAAAAAAAAA,2796,2021-06-28 02:09:31,2021-06-28T03:06:02.751553
57,MurderCrumpet,VRChat,Two Big Surprises on a Special Subday Show! !socials,2787,2021-06-27 21:51:39,2021-06-28T03:06:02.751553
58,hJune,VALORANT,practice for twitch rivals | twitter: @h7une,2780,2021-06-28 02:13:22,2021-06-28T03:06:02.751553
59,Xposed,Slots,HIGH ROLLER SLOTS $100+ SPINS + GIVEAWAYS !socials !roobet,2773,2021-06-28 02:49:18,2021-06-28T03:06:02.751553
60,Destiny,The Last Spell,memin',2745,2021-06-27 18:30:45,2021-06-28T03:06:02.751553
61,BobRoss,Art,Bob Ross - Weekend Marathon! Beginning Fridays at 12PM EDT.,2641,2021-06-27 15:47:22,2021-06-28T03:06:02.751553
62,Bajheera,World of Warcraft,Rank 1 Push w/ Vanguards & Theronpaul - Warrior / Ret / Hpal 3v3 Arena,2628,2021-06-28 00:06:10,2021-06-28T03:06:02.751553
63,Artosis,StarCraft,"GSL tonight, Ladder NOW. ~ !KotH ~ !unfair ~ !chat",2614,2021-06-28 00:23:26,2021-06-28T03:06:02.751553
64,supertf,Overwatch,(DROPS ENABLED) please dont make fun of my haircut,2522,2021-06-28 02:57:09,2021-06-28T03:06:02.751553
65,BananaSlamJamma,Dota 2,late pub chill strim !liquidplus,2517,2021-06-28 01:28:59,2021-06-28T03:06:02.751553
66,MixelPlx,Sea of Thieves,"DROPS and PvP, Vibes TOO!! // !discord !yt",2506,2021-06-27 21:19:43,2021-06-28T03:06:02.751553
67,ElisabeteTV,ASMR,🔴 LIVE ASMR ❤️ RELAX WITH ME ❤️ !sm !prime ,2492,2021-06-27 23:40:43,2021-06-28T03:06:02.751553
68,EternaLEnVyy,Dota 2,Carry Tryhard DotA,2488,2021-06-27 17:58:10,2021-06-28T03:06:02.751553
69,Natsumiii,World of Warcraft,im a noob pls dont flame me,2454,2021-06-27 21:32:23,2021-06-28T03:06:02.751553
70,Criken,XCOM 2,IT'S NOT OVER TILL ITS OVER - XCOM Viewer Permadeath w/ Strippin [Day 5] !ghost,2359,2021-06-27 22:48:31,2021-06-28T03:06:02.751553
71,MacieJay,Tom Clancy's Rainbow Six Siege,TSM Macie Jay | :),2333,2021-06-27 18:47:56,2021-06-28T03:06:02.751553
72,sashagrey,Sekiro: Shadows Die Twice,SEKIRO |!tts !discord,2320,2021-06-27 23:32:51,2021-06-28T03:06:02.751553
73,lance210,Call of Duty: Black Ops Cold War,COD Zombies Soon W/ CODEE,2317,2021-06-28 02:02:33,2021-06-28T03:06:02.751553
74,CoconutB,Rust,I AM BACK. !GFuel !CBD !Po ,2276,2021-06-27 19:06:11,2021-06-28T03:06:02.751553
75,DooleyNotedGaming,Among Us,More Streams! Among Us Time!,2190,2021-06-27 23:57:34,2021-06-28T03:06:02.751553
76,Spaceboy,Grand Theft Auto V,I'M BACK | Melbert - NoPixel 3.0 PUBLIC | !GFUEL !YT !IG,2188,2021-06-27 19:18:19,2021-06-28T03:06:02.751553
77,BazzaGazza,Grand Theft Auto V,NOPIXEL MAIN - ROAD CAPTAIN AND MASTER CRIMINAL - BARRY BBMC - !META,2185,2021-06-28 00:10:55,2021-06-28T03:06:02.751553
78,Sanchovies,League of Legends,Proper Sophisticated Bloke,2176,2021-06-28 00:34:40,2021-06-28T03:06:02.751553
79,yvonnie,VALORANT,valo w/ twitch rivals team!!,2176,2021-06-28 01:38:00,2021-06-28T03:06:02.751553
80,Kurumx,Teamfight Tactics,Liquid Kurumx | RANK 8 1491 LP START | TURBO TRYHARD GAMES FOR !SNAPSHOT GOING FOR RANK 5 !youtube !twitter,2173,2021-06-28 00:56:48,2021-06-28T03:06:02.751553
81,vGumiho,It Takes Two,marriage therapy simulator with Jack Manifold,2165,2021-06-27 14:51:32,2021-06-28T03:06:02.751553
82,AussieAntics,Fortnite,Path to Pro - Day 6 | Duo Arena w/ !Jawsh | First Time Hardcore Minecraft Later?,2146,2021-06-27 22:52:33,2021-06-28T03:06:02.751553
83,Gladd,Sea of Thieves,A Pirate's Life for Memes - We Meet Davy Jones | !30 !Socials,2133,2021-06-27 21:15:26,2021-06-28T03:06:02.751553
84,fobm4ster,Genshin Impact,"[AR58] Scuffed Event Help !eventhelp !GTales #ad !youtube
",2125,2021-06-27 22:27:04,2021-06-28T03:06:02.751553
85,GrinningGoat,Hearthstone,Warlock Arena Coop,2092,2021-06-27 22:55:29,2021-06-28T03:06:02.751553
86,Linkus7,HITMAN 3,Speedrun Race of the Century Vs. Atrioc,2067,2021-06-27 20:29:12,2021-06-28T03:06:02.751553
87,zwebackhd,FIFA 21,20 GAMES OF FRANCE BOYS WEEKEND LEAGUE! @ZWEBACKHD #SponsoredbyH&S,2035,2021-06-28 00:48:02,2021-06-28T03:06:02.751553
88,chocoTaco,American Truck Simulator,TSM chocoTaco || building an empire,2006,2021-06-28 00:28:53,2021-06-28T03:06:02.751553
89,SmiteGame,SMITE,Sunday Funday with the OHANA -- !davion505,1986,2021-06-28 02:04:51,2021-06-28T03:06:02.751553
90,OuterHeaven,Metal Gear Solid 3: Snake Eater,"3 DAY MGS Marathon! MG1/MG2/MGS1/MGS2/MGS3/MGS4 non-stop story runs with loads of extras, easter eggs, calls, details etc. ",1956,2021-06-27 21:15:00,2021-06-28T03:06:02.751553
91,Sneegsnag,VALORANT,KAPOW | SNEEG BLUEPOMBERRY AVAILABLE !coffee,1941,2021-06-27 22:49:08,2021-06-28T03:06:02.751553
92,ops1x,Fortnite,out w my girl brb (day 10/365),1911,2021-06-26 17:05:55,2021-06-28T03:06:02.751553
93,ShubbleYT,Among Us,~new among us map with town of us!~,1900,2021-06-27 23:07:08,2021-06-28T03:06:02.751553
94,Strippin,XCOM 2,XCOM Modded Co-op!,1882,2021-06-27 22:42:16,2021-06-28T03:06:02.751553
95,Kruzadar,Call of Duty: Warzone,🚨mommy milking kills !merch,1875,2021-06-27 23:51:39,2021-06-28T03:06:02.751553
96,AsmodaiTV,Hearthstone,Embrace the meme or be Supreme ? !youtube !merch,1866,2021-06-28 01:11:55,2021-06-28T03:06:02.751553
97,KarasMai,League of Legends,NA 1000 LP Challenger l Best Kayn World l !youtube l !discord ,1854,2021-06-28 02:01:33,2021-06-28T03:06:02.751553
98,Hungrybox,Super Smash Bros. Ultimate,!mediashare STREAM ENDS WHEN I LAUGH  ■ !vote !donate !subathon !summit ■ !youtube !box,1853,2021-06-27 21:34:32,2021-06-28T03:06:02.751553
99,Weak3n,SMITE,LAST DAY OF PTS. LETS FINALIZE SOME BUILDS! | @Weak3n on Socials | !GFUEL,1804,2021-06-27 23:23:53,2021-06-28T03:06:02.751553
