,user_name,game_name,title,viewer_count,started_at,api_call_time
0,RatedEpicz,Grand Theft Auto V,207 Trooper A.J. Hunter | NoPixel | !youtube !newvid,28859,2021-06-21 23:38:22,2021-06-22T05:06:02.435603
1,loltyler1,League of Legends,HUGE MINDSET IS WIN . THAT WAY WINNER STAYED UP AND never down below . GOTS IT !,26475,2021-06-21 21:40:21,2021-06-22T05:06:02.435603
2,shroud,Dungeons & Dragons: Dark Alliance,Dark Alliance is out!!! #sponsored  | Follow @shroud on socials,21067,2021-06-21 21:45:29,2021-06-22T05:06:02.435603
3,ludwig,Pokémon Platinum,BEATING THE LUDLOCKE TODAY MARIO KART TOMORROW | !bans !fairy,18206,2021-06-22 00:19:54,2021-06-22T05:06:02.435603
4,yourragegaming,Just Chatting,i fought a dragon yesterday and i defeated it ,17537,2021-06-22 03:12:19,2021-06-22T05:06:02.435603
5,Amouranth,Just Chatting,UNBANNED!🍑BAN APPEALS from the earlicking meta💦!s !social💦!instagram: @amouranth💦,16839,2021-06-22 01:56:47,2021-06-22T05:06:02.435603
6,Fextralife,Dungeons & Dragons: Dark Alliance,!review !giveaway DARK ALLIANCE LAUNCH WITH YURIA !darkalliance,15394,2021-06-22 00:06:14,2021-06-22T05:06:02.435603
7,TSM_ImperialHal,Apex Legends,Only RP gains today !youtube,13840,2021-06-22 00:04:01,2021-06-22T05:06:02.435603
8,iiTzTimmy,Apex Legends,100 ARENA WINS SOLO IN A ROW IN ONE STREAM ROUND 2! !delay !schedule !nordvpn // Follow my socials @iiTzTimmy,12964,2021-06-21 21:35:30,2021-06-22T05:06:02.435603
9,Indiefoxx,ASMR,💗 I'M UNBANNED NEW META? 💗 💗!s !socials 💗💗 IG:indiefoxx.tv,12517,2021-06-22 01:50:15,2021-06-22T05:06:02.435603
10,hannahxxrose,Just Chatting,The Unban Request Stream... (i'm scared) ,12118,2021-06-22 03:57:54,2021-06-22T05:06:02.435603
11,sinatraa,VALORANT,sinatraa - ranked !newvid,10542,2021-06-22 01:19:58,2021-06-22T05:06:02.435603
12,ShahZaM,VALORANT,SEN ShahZaM - RADIANT RANKED,10456,2021-06-22 02:10:42,2021-06-22T05:06:02.435603
13,Xposed,Slots,💰⭐ HIGH ROLLER SLOTS + LIVE GAMES ⭐💰 !roobet !deal !website,9880,2021-06-22 02:43:08,2021-06-22T05:06:02.435603
14,BruceDropEmOff,NBA 2K20,IF YOU AINT HERE YOU NOT COOL I !sub !prime !yt ig/twitter: @raycondones,9526,2021-06-22 01:49:57,2021-06-22T05:06:02.435603
15,aceu,Dying Light,NRG aceu // can;t sleep so stream // !socials,9413,2021-06-21 22:22:25,2021-06-22T05:06:02.435603
16,nl_Kripp,Hearthstone,BG NIGHT | We Went To Rattlesnake Point?! https://youtu.be/yquxgxS8Cjk,9098,2021-06-22 02:01:43,2021-06-22T05:06:02.435603
17,Maximilian_DOOD,Guilty Gear: Strive,Mouth Is Jacked Up - GG Strive Continues !ads !nzxt ,8723,2021-06-22 04:09:20,2021-06-22T05:06:02.435603
18,Ray__C,Grand Theft Auto V,RAIDING Bank Trucks for Green Cards + Oxy Runs! Filling in the Bois on the USB Info!! NoPixel Main - !newvid,8676,2021-06-22 03:31:45,2021-06-22T05:06:02.435603
19,moistcr1tikal,Guilty Gear: Strive,I was the first gamer,8574,2021-06-22 01:29:42,2021-06-22T05:06:02.435603
20,willneff,Watch Parties,The show goes on: its time for film school : FIGHT CLUB ,7648,2021-06-22 02:29:47,2021-06-22T05:06:02.435603
21,ImKaiCenat,Just Chatting,SHORTEST STREAMER ALIVE,6974,2021-06-22 02:40:25,2021-06-22T05:06:02.435603
22,nyanners,PowerWash Simulator,it is too hot and i am being fried like an egg,6904,2021-06-21 23:26:23,2021-06-22T05:06:02.435603
23,ajrafael,Music,aj rafael's music monday,6666,2021-06-22 02:29:50,2021-06-22T05:06:02.435603
24,zackrawrr,World of Warcraft,prep for tomorrow maybe a deathless attempt,6659,2021-06-22 03:42:04,2021-06-22T05:06:02.435603
25,LilyZ,Music,super chill tunes ft. CUTEST octopi on twitch! ♥,6196,2021-06-22 03:45:53,2021-06-22T05:06:02.435603
26,UberHaxorNova,Grand Theft Auto V,Siz for a tad then Barry | NoPixel | Creator Code: Nova | check !paststreams,5963,2021-06-21 23:30:27,2021-06-22T05:06:02.435603
27,supertf,Overwatch,hopefully not getting pounded by a power outage today,5651,2021-06-22 02:48:03,2021-06-22T05:06:02.435603
28,ironmouse,Just Chatting,SURPRISE STREAM... SHH DON'T TELL ANYONE... ,5501,2021-06-22 01:16:38,2021-06-22T05:06:02.435603
29,yvonnie,VALORANT,yellooooo,5213,2021-06-22 04:10:44,2021-06-22T05:06:02.435603
30,KristoferYee,Grand Theft Auto V,Jay Que | No Pixel 3.0 WL | @KristoferYee on socials,5105,2021-06-21 19:24:04,2021-06-22T05:06:02.435603
31,daltoosh,Apex Legends,Sup goobers ,4974,2021-06-21 20:31:03,2021-06-22T05:06:02.435603
32,WARDELL,VALORANT,COMING FOR THAT #1 SPOT | TSM FTX WARDELL | !pride !discord !socials [@WARDELL416],4969,2021-06-22 03:30:12,2021-06-22T05:06:02.435603
33,Aydan,GeoGuessr,#1 NA Top Earned Guessing Master | !loadouts !yt,4892,2021-06-21 23:46:03,2021-06-22T05:06:02.435603
34,SwaggerSouls,Grand Theft Auto V,FIRST DAY ON NOPIXEL,4812,2021-06-22 02:46:00,2021-06-22T05:06:02.435603
35,dunkstream,Guilty Gear: Strive,Guilty Gear Stride,4708,2021-06-22 03:49:20,2021-06-22T05:06:02.435603
36,Repullze,Call of Duty: Warzone,1440p GIVES YOU AIMBOT !newpc | !FUNIMATION !AD | !bb !kf (STROBE WARNING),4662,2021-06-22 02:32:11,2021-06-22T05:06:02.435603
37,Kruzadar,PowerWash Simulator,🚨 Chillin With the Homies !Merch🚨,4306,2021-06-21 23:01:32,2021-06-22T05:06:02.435603
38,Maya,Just Chatting,lightning storm cam,4185,2021-06-22 03:43:01,2021-06-22T05:06:02.435603
39,Silky,Just Chatting,SLG-A-THON! Silky is HERE | !sub !prime !yt !ig,4136,2021-06-21 14:46:13,2021-06-22T05:06:02.435603
40,roflgator,VRChat,RANKED GAME NIGHT THEN RANKED OW WITH MOXY AND JELLY THEN MINECRAFT,3934,2021-06-22 03:01:16,2021-06-22T05:06:02.435603
41,CaptainSparklez,Minecraft,late vault hunting weeeeeee,3907,2021-06-22 04:29:36,2021-06-22T05:06:02.435603
42,Timmac,Grand Theft Auto V,Sergeant Mack | 308 | NoPixel,3846,2021-06-22 00:59:38,2021-06-22T05:06:02.435603
43,FaZeBlaze,Call of Duty: Warzone,Warzone Dubs!! @FaZeBlaze,3844,2021-06-22 01:51:44,2021-06-22T05:06:02.435603
44,tarik,VALORANT,Title @tarik // !4k,3754,2021-06-22 03:33:10,2021-06-22T05:06:02.435603
45,LuckyChamu,Call of Duty: Warzone,Swagg Repullze and I kissing | !SLEEP | MERCH shipping soon (!MERCH) !playlist !yt,3726,2021-06-22 02:32:10,2021-06-22T05:06:02.435603
46,Autumn,Grand Theft Auto V,Officer May Maple | NoPixel Public | check out !brainhp in chat #ad,3320,2021-06-21 21:59:15,2021-06-22T05:06:02.435603
47,Rogue,Apex Legends,NRG Rogue · PRED GRINDER · !emotes · Twitter: @TTrebb,3241,2021-06-22 03:13:47,2021-06-22T05:06:02.435603
48,MattRP,Grand Theft Auto V,"Trooper Ripley | ""The Return of 202!"" | K-9 Unit | discord.gg/MattRP | NoPixel GTA RP",3238,2021-06-22 00:10:12,2021-06-22T05:06:02.435603
49,DuelLinksMeta,Yu-Gi-Oh! Duel Links,NEW Box LEAKED Review! Inzektors! Vampires! Gimmick Puppets!,3221,2021-06-21 22:01:20,2021-06-22T05:06:02.435603
50,Rescue,Terraria,Literally not even an ounce of content here,3135,2021-06-22 03:07:02,2021-06-22T05:06:02.435603
51,x2Twins,Fortnite,THANOS ARRIVES,3096,2021-06-22 04:58:00,2021-06-22T05:06:02.435603
52,julien,Dead by Daylight,we back bby,3065,2021-06-21 22:15:31,2021-06-22T05:06:02.435603
53,Calebhart42,Final Fantasy VII,FINAL FANTASY CHAOS EDITION | FF7 SPEEDRUNS| @calebhart42 IG/Twitter,3035,2021-06-22 00:50:33,2021-06-22T05:06:02.435603
54,Five0AnthO,Grand Theft Auto V,"Trooper Sh*t WL 
|#ad !honey !fission | !LEO !merch !tts !rank ",3020,2021-06-22 00:57:24,2021-06-22T05:06:02.435603
55,BigEx,Roblox,roblox,3007,2021-06-22 02:10:48,2021-06-22T05:06:02.435603
56,Atrioc,Just Chatting,THE RETURN OF MARKETING MONDAY,2988,2021-06-22 03:10:33,2021-06-22T05:06:02.435603
57,BazzaGazza,Grand Theft Auto V,NOPIXEL MAIN - ROAD CAPTAIN - BARRY BBMC - !META,2926,2021-06-22 00:19:36,2021-06-22T05:06:02.435603
58,Annoying,Just Chatting,DAILY STREAMER BACK IN ACTION ! | SANCTIONED RP LATER,2892,2021-06-22 00:45:13,2021-06-22T05:06:02.435603
59,EternaLEnVyy,Dota 2,Carry Tryhard DotA,2882,2021-06-22 01:27:41,2021-06-22T05:06:02.435603
60,OhTofu,Dead by Daylight,W HOLDERS UNITE | #deadbydaylightpartner,2776,2021-06-22 02:12:19,2021-06-22T05:06:02.435603
61,jccaylen,Fortnite,goated fortnite player!! ,2741,2021-06-22 03:24:58,2021-06-22T05:06:02.435603
62,spoonkid,Rust,solo rust !monke,2633,2021-06-21 21:12:33,2021-06-22T05:06:02.435603
63,p90princess,Call of Duty: Warzone,💗 good evening :)  💗✨ !smile ,2617,2021-06-22 02:30:24,2021-06-22T05:06:02.435603
64,KarasMai,League of Legends,NA Challenger JG - Best Kayn NA - Rank 1 Grind !discord !youtube ,2606,2021-06-22 00:59:50,2021-06-22T05:06:02.435603
65,Pikabooirl,World of Warcraft,GG Pikaboo - TBC GAMING !youtube !pikareview !charity,2570,2021-06-21 21:21:07,2021-06-22T05:06:02.435603
66,Quantum,League of Legends,Oldge GM Midlaner grinding soloq - Nick at Night - Happy Pride Month <3 - !discord,2568,2021-06-22 02:04:49,2021-06-22T05:06:02.435603
67,Co1azo,Fortnite,Sleeping until points reset (in approx 4hrs)!!! | !gfuel !scuf | TSM FTX Co1azo,2503,2021-06-21 22:03:40,2021-06-22T05:06:02.435603
68,AdrianaChechik_,Just Chatting,Poetry,2400,2021-06-22 00:34:24,2021-06-22T05:06:02.435603
69,DonutOperator,Just Chatting,LIVE LEO RECAP || @DONUTOPERATOR,2394,2021-06-22 03:52:39,2021-06-22T05:06:02.435603
70,TheBoiSantana,Call of Duty: Warzone,PETITE GAMER BOY DROPS HIS HEADSET WITH HIS HOMIES AROUND OH NO | !newvid !faze !kf !scuf !elgato !gfuel,2390,2021-06-22 04:41:45,2021-06-22T05:06:02.435603
71,Artosis,StarCraft,"""Can I cheese you and get a free win, Artosis?"" - TO THIS I SAY NO. ~ artoAgony ~ !TTS",2358,2021-06-22 00:25:36,2021-06-22T05:06:02.435603
72,kennybeats,Just Chatting,MONDAY NIGHT 💭,2333,2021-06-22 04:03:29,2021-06-22T05:06:02.435603
73,sunsetgaiaASMR,ASMR,Hey there! :3 !instagram,2323,2021-06-22 01:36:32,2021-06-22T05:06:02.435603
74,AsmodaiTV,Hearthstone,Embrace the meme or be Supreme ? !youtube !merch,2321,2021-06-22 01:08:32,2021-06-22T05:06:02.435603
75,KYR_SP33DY,GeoGuessr,Hanging Out then Gaming! >:),2284,2021-06-22 00:05:11,2021-06-22T05:06:02.435603
76,ClassyBeef,Slots,🔥 18+ | $500K RAW BONUS HUNT!!🔥 !Tournament | !Stake for best Casino |,2275,2021-06-21 02:17:10,2021-06-22T05:06:02.435603
77,Zombie_Barricades,Grand Theft Auto V,ROLEPLAY // DADDDDDYS HOMEEEE // ALL MY HOMIES HATE FRENZY,2221,2021-06-22 00:18:10,2021-06-22T05:06:02.435603
78,CrReaM,Olympic Games Tokyo 2020: The Official Video Game,What? You Expected A Good Title? - !VPN,2188,2021-06-22 01:20:03,2021-06-22T05:06:02.435603
79,syn4ack,World of Warcraft,LF HEALS KARAZHAN FEARLINA ALLIANCE,2188,2021-06-22 02:05:39,2021-06-22T05:06:02.435603
80,BobbyPoffGaming,Call of Duty: Warzone,Warzone w/ Envy BobbyPoff! | Use code BOBBYPOFF in the COD store,2186,2021-06-21 21:56:48,2021-06-22T05:06:02.435603
81,Criken,Kenshi,CRABLANDS SURVIVAL GUIDE - Kenshi Hive Adventures Series Ep. 7 !hive,2176,2021-06-22 01:07:26,2021-06-22T05:06:02.435603
82,Heelmike,Slots,🎰 BIG MONEY SLOTS 🎰 G2 HEELMIKE !duelbits +18 SLOTS BLACK JACK CRAZY TIME @ MIDNIGHT,2146,2021-06-22 02:05:03,2021-06-22T05:06:02.435603
83,keife_,NBA 2K21,Kahoot For Money !sub !prime,2038,2021-06-22 01:26:09,2021-06-22T05:06:02.435603
84,Silvervale,The Elder Scrolls V: Skyrim,🌸  clever title that makes you want to watch strim 🌸  【VTuber !music !ashes !merch !links !mods,1999,2021-06-22 02:39:47,2021-06-22T05:06:02.435603
85,Flamehopper,Escape from Tarkov,FREEEEE Positive Tarkov Vibes :D,1974,2021-06-22 03:03:19,2021-06-22T05:06:02.435603
86,WorldPokerTour,Poker,Patrik Antonius vs Sam Greenwood - WPT Heads Up Championship - Semifinals,1954,2021-06-21 21:07:17,2021-06-22T05:06:02.435603
87,mang0,Mario Kart 8,THE RETURN OF THE NASTIEST LINES ON TWITCH ,1934,2021-06-22 00:09:14,2021-06-22T05:06:02.435603
88,Bronx,Dead by Daylight,yup,1855,2021-06-22 04:32:31,2021-06-22T05:06:02.435603
89,TheChief1114,Grand Theft Auto V,Fingle Dan - NoPixel,1811,2021-06-22 01:32:43,2021-06-22T05:06:02.435603
90,PangaeaPanga,Super Mario Maker 2,Endless Expert No-Skips for 1000 Clears,1810,2021-06-22 03:28:43,2021-06-22T05:06:02.435603
91,cdewx,World of Warcraft,<OTK> Cdew: ARENA !corsair,1801,2021-06-22 03:03:56,2021-06-22T05:06:02.435603
92,ChatterBox0,Grand Theft Auto V,Chatterbox | NoPixel | 3.0 Whitelisted | GTA Roleplay  ,1733,2021-06-22 01:52:00,2021-06-22T05:06:02.435603
93,YDCB,Epic Seven,collab news is tomorrow right? !giveaway !vods ,1711,2021-06-22 02:40:56,2021-06-22T05:06:02.435603
94,CaptainPuffyAlt,Counter-Strike: Global Offensive,LATE NIGHT CSGO WATCH ME GET SALTY <3,1698,2021-06-22 04:52:01,2021-06-22T05:06:02.435603
95,Bawkbasoup,Dead by Daylight,Resident Evil 9 || Rank 1 Grind || CVX REMAKE DEMO WAS LIT !social !merch !star,1691,2021-06-21 21:27:24,2021-06-22T05:06:02.435603
96,ops1x,Fortnite,Out right now back later (113/8700 hours streamed),1684,2021-06-21 07:12:09,2021-06-22T05:06:02.435603
97,BurkeBlack,Lake,Demos and Betas! 💀 !Epic for FREE Games! 💀 Creator Code: BurkeBlack 💀 #EpicPartner 💀 !NordVPN #AD 💀 !Xfinity,1676,2021-06-22 01:58:12,2021-06-22T05:06:02.435603
98,CDNThe3rd,Dota 2,Night Time Vibrationals [+] | Socials: @CDNThe3rd,1662,2021-06-21 21:47:37,2021-06-22T05:06:02.435603
99,Zoomaa,Call of Duty: Warzone,"FORMER COD PRO TAKES OVER VERDANSK w/ Methodz, Almxnd, and Slackedd !discord",1631,2021-06-21 21:49:20,2021-06-22T05:06:02.435603
