,user_name,game_name,title,viewer_count,started_at,api_call_time
0,xQcOW,Grand Theft Auto V,[Nopixel Public] LOWER VAULT IS HAPPENING -RIGHT NOW- NO SERIOUSLY RIGHT NOW! GET IN! RIGHT NOW (IM SERIOUS),65435,2021-06-23 22:19:21,2021-06-24T05:06:06.774299
1,AdinRoss,Just Chatting,MEXICO - HUNGOVER ROAD TO 150k...,61427,2021-06-24 01:39:13,2021-06-24T05:06:06.774299
2,loltyler1,League of Legends,BOOM ! HE LAND ! ah it eartherquake ?  NO !! HE JUST WALKED ! MASSIVE !,23841,2021-06-23 21:47:08,2021-06-24T05:06:06.774299
3,ludwig,Just Chatting,AMAZON UNBOXING GET IN HERE THIS IS BIG,16537,2021-06-24 03:19:03,2021-06-24T05:06:06.774299
4,Trainwreckstv,Slots,"18+ !stake finally settled in canada - BONUS BONUS BONUS, BUFFALO BUFFALO BUFFALO #ad | !twitter | !youtube | !podcast",16531,2021-06-24 04:09:56,2021-06-24T05:06:06.774299
5,moistcr1tikal,Just Chatting,Youtube night,16018,2021-06-24 01:42:11,2021-06-24T05:06:06.774299
6,ShahZaM,VALORANT,SEN ShahZaM - RADIANT RANKED,13949,2021-06-23 23:12:50,2021-06-24T05:06:06.774299
7,rhondaintl,Music,"Rhondavision Pride: A Deeper Love Day 2 ft. Kamaiyah, Shaun Ross, Chester Lockhart, Tanerélle, San Cha + MORE!! Raising money for REACH LA.",13125,2021-06-24 02:55:20,2021-06-24T05:06:06.774299
8,yourragegaming,Just Chatting,SHORT STREAM COME QUICK OMG YOU GON MISS IT OMG OMG OMG OMG,12905,2021-06-24 03:41:23,2021-06-24T05:06:06.774299
9,Ramee,Grand Theft Auto V,Ramee | !Twitter | Chang Gang | NoPixel,12879,2021-06-23 18:49:03,2021-06-24T05:06:06.774299
10,PENTA,Grand Theft Auto V,MIKE BLOCK YO | NoPixel,12656,2021-06-23 22:33:47,2021-06-24T05:06:06.774299
11,LVNDMARK,Escape from Tarkov,NEW !GPU TRADES | !GFUEL | !Youtube | !MERCH | @lvndmark_tv on socials,10195,2021-06-23 19:19:03,2021-06-24T05:06:06.774299
12,nl_Kripp,Hearthstone,BG NIGHT | We Went To Rattlesnake Point?! https://youtu.be/yquxgxS8Cjk,9891,2021-06-24 02:02:11,2021-06-24T05:06:06.774299
13,Maximilian_DOOD,Just Chatting,KOF15 Trailer/KI News & more GG STRIVE! !ads !nzxt ,9799,2021-06-24 04:44:54,2021-06-24T05:06:06.774299
14,buddha,Slots,+18 !stake #AD,9713,2021-06-23 16:07:25,2021-06-24T05:06:06.774299
15,sweetdreams,Apex Legends,COUPLES DUO QUEUE TO MASTERS IN ONE STREAM. BRONZE TO MASTERS WITH BABYNIKKI,9552,2021-06-23 14:59:20,2021-06-24T05:06:06.774299
16,LosPollosTV,Just Chatting,ALOT TO TALK ABOUT,9473,2021-06-24 02:52:26,2021-06-24T05:06:06.774299
17,sinatraa,VALORANT,sinatraa - ranked !newvid,8853,2021-06-24 02:05:12,2021-06-24T05:06:06.774299
18,BoomerNA,Minecraft,🐸 BOOMERNA BEDWARS CEO MAKES HIS RETURN 🐸 ⚬ !merch !cloak !socials ⚬ !discord ⚬ Twitter @BoomrNA,8833,2021-06-24 03:07:21,2021-06-24T05:06:06.774299
19,Whippy,Grand Theft Auto V,!DUNDEE IS BACK! NoPixel l !NordVPN | !honey | !merch | !meta | twitter.com/whippynotpoopy,8738,2021-06-24 00:59:37,2021-06-24T05:06:06.774299
20,its_iron,Call of Duty: Warzone,Solo Solos for now! | !Merch !GFUEL !Evolve !Metaview !Kovaak,8347,2021-06-23 20:47:31,2021-06-24T05:06:06.774299
21,Xposed,Slots,💰⭐ $100k ~ INSANE BONUS HUNT  ⭐💰 Visit my website www.xposed.tv !roobet,8096,2021-06-24 03:07:03,2021-06-24T05:06:06.774299
22,supertf,Overwatch,(DROPS ENABLED) top tier high quality unrelenting power found here exclusively,7808,2021-06-24 03:01:46,2021-06-24T05:06:06.774299
23,fuslie,VALORANT,duo queue valo with beb!,7364,2021-06-24 02:50:43,2021-06-24T05:06:06.774299
24,EsfandTV,World of Warcraft,GRAND CRUSADER ENTERS THE LAIR AND EMERGES AS CHAMPION OF THE ALLIANCE,7168,2021-06-24 00:57:09,2021-06-24T05:06:06.774299
25,Fortnite,Fortnite,FNCS All-Star Showdown - Blueprint Battle + Bullseye Bonanza - NAE + NAW,5544,2021-06-23 22:45:14,2021-06-24T05:06:06.774299
26,Ray__C,Grand Theft Auto V,BANK Trucks + PROGRESSING TOWARDS SUCCEEDING w/ the CleanBois!! Raymond Romanov NoPixel Main - !newvid,5260,2021-06-23 22:02:39,2021-06-24T05:06:06.774299
27,velvetiscake,Just Chatting,ANTFROST IS HERE! IRL STREAM - TIER LIST TIME + FANTA TASTE TEST + ANTFROST TASTE TEST UWU,5059,2021-06-24 03:06:04,2021-06-24T05:06:06.774299
28,Silky,Grand Theft Auto V,SLG-A-THON! Sanctioned RP | !sub !prime !yt !ig,4977,2021-06-23 14:46:33,2021-06-24T05:06:06.774299
29,Scarra,Teamfight Tactics,new otv vid | tft new patch and then..? ggs?,4780,2021-06-24 01:02:02,2021-06-24T05:06:06.774299
30,BigEx,Grand Theft Auto V,Jason VS Sanctioned,4777,2021-06-24 03:03:42,2021-06-24T05:06:06.774299
31,GamesDoneQuick,Resident Evil Village,Speedruns From the Crypt - Resident Evil Village,4749,2021-06-23 22:50:20,2021-06-24T05:06:06.774299
32,UberHaxorNova,Grand Theft Auto V,Siz. Briddle. | NoPixel | Creator Code: Nova | check !paststreams,4642,2021-06-24 02:30:53,2021-06-24T05:06:06.774299
33,tarik,VALORANT,y0y0y0 @tarik // !4k,4508,2021-06-23 22:59:31,2021-06-24T05:06:06.774299
34,Silvervale,Story of Seasons: Pioneers of Olive Town,🌸  COZY VIBES at the waifu farm 🐮🐤 🌸  【VTuber】!ashes !merch !links !mods,3787,2021-06-24 02:21:51,2021-06-24T05:06:06.774299
35,buckefps,Fortnite,NEW ARENA POINT CHAMPION | !arena,3768,2021-06-23 15:01:57,2021-06-24T05:06:06.774299
36,KristoferYee,Grand Theft Auto V,Jay Que Business Proposal Day | No Pixel 3.0 WL | @KristoferYee on socials | !logo,3626,2021-06-23 20:47:58,2021-06-24T05:06:06.774299
37,roflgator,Just Chatting,FUN GAMES WITH FUN FRIENDS,3613,2021-06-24 03:02:44,2021-06-24T05:06:06.774299
38,starsmitten,VALORANT,chililng till i find purpose in life,3609,2021-06-23 18:42:25,2021-06-24T05:06:06.774299
39,chessbrah,Chess,SPEEDRUN with GM Aman !speedrun !sr !youtube,3594,2021-06-24 02:11:54,2021-06-24T05:06:06.774299
40,Rogue,Apex Legends,NRG Rogue · !emotes · Twitter: @TTrebb,3480,2021-06-24 03:34:34,2021-06-24T05:06:06.774299
41,TapL,Minecraft,SPEEDRUNS + VALORANT WOO,3374,2021-06-24 03:41:23,2021-06-24T05:06:06.774299
42,SwaggerSouls,Grand Theft Auto V,THE ADVENTURES OF ACE HULL (NO PIXEL MAIN),3172,2021-06-24 03:18:47,2021-06-24T05:06:06.774299
43,mrekkosu,osu!,BLACK ROVER DT 1110 PP ,3059,2021-06-24 03:34:23,2021-06-24T05:06:06.774299
44,KarasMai,League of Legends,NEW KAYN BUILD! l Best Kayn World l NA 2 Chall Acc's l !discord !youtube ,2936,2021-06-24 01:11:24,2021-06-24T05:06:06.774299
45,Calebhart42,Final Fantasy X,FINAL FANTASY X SPEEDRUN | @calebhart42 IG/Twitter,2910,2021-06-24 01:05:28,2021-06-24T05:06:06.774299
46,FRAN,Overwatch,drops in sprays and SR,2904,2021-06-23 22:23:34,2021-06-24T05:06:06.774299
47,Sanchovies,League of Legends,top lane shillings,2887,2021-06-23 21:46:42,2021-06-24T05:06:06.774299
48,ItsJSTN,Rocket League,worst na champ | !creatorcode !socials !facecam,2883,2021-06-24 04:00:22,2021-06-24T05:06:06.774299
49,Sirciz,Call of Duty: Warzone,Games w/ the boys,2877,2021-06-24 01:35:58,2021-06-24T05:06:06.774299
50,qikothesensei,Apex Legends,QikoTheSensei TV Insomnia Sensei!!,2841,2021-06-24 03:30:18,2021-06-24T05:06:06.774299
51,OhTofu,Dead by Daylight,Hi I like talking to chat | #deadbydaylightpartner,2796,2021-06-24 02:15:31,2021-06-24T05:06:06.774299
52,DonutOperator,Just Chatting,AIN'T DEAD YET || @DONUTOPERATOR,2753,2021-06-24 02:42:09,2021-06-24T05:06:06.774299
53,BeyondTheSummit2,Dota 2,[EN] TI10 SA Qualifier | BINOMISTAS vs SG e-sports (Bo3) | @MoxxiCasts & @D2Bowie,2722,2021-06-23 14:51:20,2021-06-24T05:06:06.774299
54,fineokay,SMITE,Patch Notes Review w/ SMITE Dev CLUMZY!! then some shenanigans..,2721,2021-06-23 23:52:40,2021-06-24T05:06:06.774299
55,Miss_Valkyri3,Call of Duty: Warzone,Late Night Warzone with Ronzers and the boys♥ SUB GOAL 444/469  !Roulette VIP #TbagTeam,2649,2021-06-24 02:41:47,2021-06-24T05:06:06.774299
56,scoped,Fortnite,Creative Zone Wars | !vlog,2647,2021-06-24 01:30:18,2021-06-24T05:06:06.774299
57,GreenishMonkey,Grand Theft Auto V,Bobby Brown | NoPixel GTA 5 RP | Triple OG,2631,2021-06-24 03:09:31,2021-06-24T05:06:06.774299
58,Tommey,Call of Duty: Warzone,2v2 wagers - 100T @Tommey,2624,2021-06-24 03:38:23,2021-06-24T05:06:06.774299
59,shofu,Pokémon Unite,POKEMON UNITE YESSIR,2595,2021-06-24 03:10:14,2021-06-24T05:06:06.774299
60,AsmodaiTV,Hearthstone,Embrace the meme or be Supreme ? !youtube !merch,2575,2021-06-24 00:58:21,2021-06-24T05:06:06.774299
61,SnaggyMo,Just Chatting,ONLYFANS DEMON NOW | !sub !prime,2491,2021-06-24 03:09:16,2021-06-24T05:06:06.774299
62,sunsetgaiaASMR,ASMR,a !instagram,2447,2021-06-24 02:16:49,2021-06-24T05:06:06.774299
63,s0mcs,VALORANT,NRG s0m | Follow my !instagram and !youtube,2434,2021-06-24 04:06:36,2021-06-24T05:06:06.774299
64,Mongraal,,100h+ Stream I Sleeping I Use Code Mongraal #AD,2433,2021-06-22 16:53:15,2021-06-24T05:06:06.774299
65,TPAIN,Music,Im so behind on work from Fn with you guys so now youre comin to work with me -- !TheSquad !PizzlePack !rig !book !nbr !ilikedat,2424,2021-06-24 01:40:31,2021-06-24T05:06:06.774299
66,QTCinderella,Just Chatting,EZ BAKING IN THE KITCHEN WITH AIMEN | !po !clips !youtube !skinnytallman,2404,2021-06-24 04:26:21,2021-06-24T05:06:06.774299
67,Artosis,StarCraft,"MEGA STREAM - ladder, BANS/UNBANS, Korean Progamer King of the Hill ~ !Bingo ~ !unban19",2397,2021-06-24 00:19:00,2021-06-24T05:06:06.774299
68,CrReaM,Police Simulator: Patrol Officers,Trash Yeti - !VPN,2396,2021-06-24 01:41:12,2021-06-24T05:06:06.774299
69,NiceWigg,Apex Legends,TOP 10 PC PRED GRIND - Longbow Gamer Here - !socials,2279,2021-06-23 21:16:58,2021-06-24T05:06:06.774299
70,cdewx,World of Warcraft,<OTK> Cdew: ARENA !corsair,2274,2021-06-23 23:54:26,2021-06-24T05:06:06.774299
71,sneakylol,World of Warcraft,Sneaky | kara clear (league after),2122,2021-06-24 03:15:52,2021-06-24T05:06:06.774299
72,Jay3,Overwatch,-DROPS- NEW EVENT POGU | !gfuel !corsair !social !merch,2112,2021-06-24 01:08:42,2021-06-24T05:06:06.774299
73,Quantum,League of Legends,Oldge GM Midlaner grinding soloq - Nick at Night - Happy Pride Month <3 - !discord,2081,2021-06-24 02:02:29,2021-06-24T05:06:06.774299
74,Snip3down,Apex Legends,!Star PRO PLAYER TAKES ON STAR TREK #ad,2072,2021-06-24 02:56:44,2021-06-24T05:06:06.774299
75,supcaitlin,Just Chatting,BLIND DATING SHOW INTERVIEWS  !Star !nordvpn #ad,2057,2021-06-24 03:38:56,2021-06-24T05:06:06.774299
76,iceiceice,Dota 2,Dota,2053,2021-06-24 04:34:53,2021-06-24T05:06:06.774299
77,EternaLEnVyy,Dota 2,testing,2001,2021-06-23 20:47:33,2021-06-24T05:06:06.774299
78,Ming,Grand Theft Auto V,Ming Jingtai | Operation Lower Vault -> Land -> Water -> Earth -> Moon  | @MrMing011,1971,2021-06-23 23:26:51,2021-06-24T05:06:06.774299
79,Co1azo,Fortnite,THE CHAMPIONS ARENA w/ Smqcked and RogueShark| !gfuel !scuf | TSM FTX Co1azo,1940,2021-06-24 01:18:08,2021-06-24T05:06:06.774299
80,ClassyBeef,Slots,🔥 +18 | NOW: 500K RAW BONUS HUNT! |  !CHAOS FOR 670K WIN!! 🔥 !Tournament | !Stake for best Casino |,1932,2021-06-23 01:28:02,2021-06-24T05:06:06.774299
81,Xyronic,World of Warcraft,insert title about it being last week of 9.0 lol mage !spec recommendations here // discord.gg/xyronic,1920,2021-06-23 21:31:04,2021-06-24T05:06:06.774299
82,kennybeats,Music,WEDNESDAY NIGHT 💭,1913,2021-06-24 03:59:26,2021-06-24T05:06:06.774299
83,BananaSlamJamma,Dota 2,Battlepass out! Please subscribe so i can buy levels!!!!! !patch !2ndyoutube,1881,2021-06-24 04:16:08,2021-06-24T05:06:06.774299
84,keife_,NBA 2K21,W STREAMER HERE !sub !prime,1873,2021-06-24 02:54:15,2021-06-24T05:06:06.774299
85,CalebDMTG,Magic: The Gathering,HOT modern CUBE ACTION (no stream tomorrow) ,1800,2021-06-24 00:03:10,2021-06-24T05:06:06.774299
86,Criken,Ghostrunner,streamer runs and cuts and runs some more,1791,2021-06-24 00:11:10,2021-06-24T05:06:06.774299
87,Bawkbasoup,Labyrinthine,Got Probed by an Alien AMA ||  Marathon Tomorrow - Mario Golf Friday !social !merch !star,1694,2021-06-23 23:29:05,2021-06-24T05:06:06.774299
88,BobbyPoffGaming,Call of Duty: Warzone,Warzone w/ Envy BobbyPoff - Use code BOBBYPOFF in the COD store,1692,2021-06-24 01:35:01,2021-06-24T05:06:06.774299
89,FaZeBlaze,Call of Duty: Warzone,Warzone Dubs!! @FaZeBlaze,1676,2021-06-24 04:37:05,2021-06-24T05:06:06.774299
90,Ac7ionMan,Fortnite,MOST ARENA POINTS IN THE WORLD-FUTURE OF GAMING-MOST POINTS 865604-RAREST LOCKER-CONTENT GOD-HUGE-HANDSOME- @Ac7ionman,1653,2021-06-24 02:19:39,2021-06-24T05:06:06.774299
91,Shiphtur,VALORANT,valo with abe wendy celine,1650,2021-06-24 00:30:57,2021-06-24T05:06:06.774299
92,elena_fn,ASMR,ASMR RELAX WITH ME 4K | !sub !youtube !prime,1640,2021-06-24 03:39:20,2021-06-24T05:06:06.774299
93,TheDanDangler,Call of Duty: Warzone,"CAPTAIN | $300,000 Tourny! | !announcement !wsow !gfuel !hyperx !socials",1636,2021-06-24 01:41:41,2021-06-24T05:06:06.774299
94,Blaustoise,Grand Theft Auto V,Downbad Mickey | NoPixel WL | Chang Gang | !glassy !nordvpn !glorious !gfuel,1632,2021-06-24 01:08:41,2021-06-24T05:06:06.774299
95,KingGeorge,Tom Clancy's Rainbow Six Siege,"Back from my Honeymoon, NEW SEASON RANKED! | !youtube !socials !charm !slayout | Follower !giveaway",1632,2021-06-24 02:50:07,2021-06-24T05:06:06.774299
96,Eduardo_Hook ,Guilty Gear: Strive,Wholesome streamer mastering his favorite Character in SFV,1599,2021-06-24 02:06:21,2021-06-24T05:06:06.774299
97,Raeyei,Dota 2,[ENG] NEW BATTLEPASS POG | new youtube video !yt | !giveaway !valotourn,1598,2021-06-23 12:47:14,2021-06-24T05:06:06.774299
98,Roxmiral,Grand Theft Auto V,Sherry Paie - Burgers and Paie + paintball - Nopixel 3.0 WL ,1579,2021-06-23 13:18:00,2021-06-24T05:06:06.774299
99,Crayator,Just Chatting,HUGE UNBOXING TODAY | Siblings Or Dating video OUT !YT,1569,2021-06-24 01:50:15,2021-06-24T05:06:06.774299
