,user_name,game_name,title,viewer_count,started_at,api_call_time
0,xQcOW,Apex Legends,"BIG BRAIN GENIUS MAN WATCHES BAD, BORING AND CRINGE VIDEOS UNTIL ALL HAIR FALLS OFF (BALD). GAME PLAYING VIRTUAL MASTERMIND (GONE TERRIBLE)",62531,2021-08-04 23:08:38,2021-08-05T03:06:09.061110
1,loltyler1,League of Legends,GROUND SHAKE ! ON THE WAY ! AND YOU KNOW THAT COME OVER HERE ! HAHAHAH HE ! YES SIR CRAZY !!!!!!!!!,30193,2021-08-04 21:21:59,2021-08-05T03:06:09.061110
2,Sykkuno,Tricky Towers,CRAZEE WACKOO VARIETY DAY,27462,2021-08-04 23:23:09,2021-08-05T03:06:09.061110
3,summit1g,Grand Theft Auto V,BOOSTING RIDES. Merch dropped summit1g.gg  [ @summit1g ],26011,2021-08-04 23:08:36,2021-08-05T03:06:09.061110
4,shroud,VALORANT,!!!  | Follow @shroud on socials,23352,2021-08-04 20:42:09,2021-08-05T03:06:09.061110
5,ROSHTEIN,Slots,⭐ FRUIT PARTY 2 ON !STAKE / CREATE UR ACCOUNT THROUGH THE LINK 💠 USE !STAKE TO BE ELIGIBLE FOR CASH RAFFLES,23270,2021-08-04 16:37:49,2021-08-05T03:06:09.061110
6,nbcolympics,Sports,Live From Tokyo with Storymodebae,20435,2021-08-04 19:00:04,2021-08-05T03:06:09.061110
7,Ramee,Grand Theft Auto V,Ramee | !Twitter | Chang Gang | NoPixel,18448,2021-08-04 18:51:49,2021-08-05T03:06:09.061110
8,TSM_ImperialHal,Apex Legends,Ranked w/ the Rollers | TSM FTX,17329,2021-08-04 23:04:03,2021-08-05T03:06:09.061110
9,Swagg,Call of Duty: Warzone,FaZe Nuke Squad | !Merch | CODE: SWAGG | !sub !blm,16211,2021-08-05 00:09:02,2021-08-05T03:06:09.061110
10,ludwig,Hivemind Gameshow,"HIVEMIND WITH CHARLIE FT. CONNOREATSPANTS, ATRIOC, STANZ, AND EMIRU",15430,2021-08-05 00:46:03,2021-08-05T03:06:09.061110
11,Fextralife,Final Fantasy XIV Online,Becoming a Bard in FFXIV with Yuria,14994,2021-08-05 00:07:38,2021-08-05T03:06:09.061110
12,LVNDMARK,Escape from Tarkov,3200+ PMC Kills | !ARMBAND | !MERCH | !GFUEL | @lvndmark_tv on socials,14086,2021-08-04 19:01:35,2021-08-05T03:06:09.061110
13,PaymoneyWubby,Just Chatting,HUGE MAN HUGE NEWS + CONTEST FOR CHAT + A STRANGER MIGHT CUDDLE ME + SUB WITH PRIME,14060,2021-08-05 00:30:46,2021-08-05T03:06:09.061110
14,BruceDropEmOff,Just Chatting,DONT MISS IT!  I !gamdom !sub !prime !yt ig/twitter: @raycondones,13657,2021-08-05 00:45:30,2021-08-05T03:06:09.061110
15,PENTA,Grand Theft Auto V,GAMBA until perma probs :( | NoPixel ,13524,2021-08-05 00:12:34,2021-08-05T03:06:09.061110
16,ShahZaM,VALORANT,SEN ShahZaM - RADIANT RANKED,10546,2021-08-04 21:27:23,2021-08-05T03:06:09.061110
17,lilypichu,Tricky Towers,tricky,9827,2021-08-04 23:14:25,2021-08-05T03:06:09.061110
18,Aydan,Call of Duty: Black Ops Cold War,2v2 Hardpoint Wagers w/ MuTeX | !yt !loadouts,9128,2021-08-04 22:32:32,2021-08-05T03:06:09.061110
19,CaptainPuffy,Minecraft,[DreamSMP] - going back to the beginning,9092,2021-08-05 01:17:22,2021-08-05T03:06:09.061110
20,Maya,Just Chatting,charity stream for !nwf <:-),8577,2021-08-05 00:50:48,2021-08-05T03:06:09.061110
21,moistcr1tikal,Hivemind Gameshow,"Gameshow with Ludwig ft. Atrioc, Emiru, Stanz, ConnorEatsPants",8056,2021-08-05 00:46:04,2021-08-05T03:06:09.061110
22,LosPollosTV,Just Chatting,LEBRON VS THE WORLD | Serious Ask Los | $100K Dream | !OptimumPartner,7480,2021-08-05 02:29:06,2021-08-05T03:06:09.061110
23,ironmouse,Just Chatting,LETS HANG OUT AND RELAX !merch,6762,2021-08-04 21:59:00,2021-08-05T03:06:09.061110
24,iiTzTimmy,Apex Legends,yup thats me // Follow my socials @iiTzTimmy,5948,2021-08-05 02:16:54,2021-08-05T03:06:09.061110
25,YourPelagea,ASMR,I'll make you fall asleep in bed ASMR! 🛏️ LIVE!,5861,2021-08-04 22:29:12,2021-08-05T03:06:09.061110
26,brycent,Axie Infinity,BECOME THE IMPOSSIBLE! 🚀,5725,2021-08-05 00:59:58,2021-08-05T03:06:09.061110
27,sinatraa,VALORANT,sinatraa - ranked gaming !newvid,5666,2021-08-05 01:41:16,2021-08-05T03:06:09.061110
28,Kyedae,VALORANT,Grinding to Plat (plz don't stream snipe me  ;-;),5586,2021-08-05 02:24:39,2021-08-05T03:06:09.061110
29,daltoosh,Apex Legends,Day 2. Three hours of sleep. Send Prayers and boob,5566,2021-08-04 18:12:12,2021-08-05T03:06:09.061110
30,BLOU,Just Chatting,"ADIN BODY GUARD PRESSED ZIAS ...""IM LITTY BIH"" 45-0",5537,2021-08-05 00:15:06,2021-08-05T03:06:09.061110
31,pokelawls,Apex Legends,practice for tourny soon,5416,2021-08-04 19:38:29,2021-08-05T03:06:09.061110
32,Reetlol,Fortnite,NAW SOLO CASHCUP | CODE XTRA-REET #AD | !org !Masterclass !Shorts !Newvid,5397,2021-08-05 01:00:52,2021-08-05T03:06:09.061110
33,tarik,Counter-Strike: Global Offensive,Scrimming w/ the boys @tarik // !new,5331,2021-08-04 23:53:17,2021-08-05T03:06:09.061110
34,masondota2,Dota 2,best person in the community! <3 no spit zone. LETS GO BABY HIGH OCTANE POGGERS PMA.,5051,2021-08-04 21:28:56,2021-08-05T03:06:09.061110
35,nl_Kripp,Hearthstone,BGs | Maven + Shaper Later?? | Vegas & The Canyon From Above! https://youtu.be/8TcvEXMZlmk,4977,2021-08-05 02:01:15,2021-08-05T03:06:09.061110
36,Zoomaa,Call of Duty: Black Ops Cold War,AM CHAMPS WATCH PARTY / #ZooMafia !discord,4783,2021-08-04 19:02:54,2021-08-05T03:06:09.061110
37,tuonto,Genshin Impact,im holding an art contest! // !twitter !youtube,4702,2021-08-05 01:07:34,2021-08-05T03:06:09.061110
38,its_iron,Call of Duty: Warzone,Anti Hacker Squad | !Merch !GFUEL !Evolve,4568,2021-08-05 00:52:37,2021-08-05T03:06:09.061110
39,ConnorEatsPants,Hivemind Gameshow,Highest Scoring Hivemind Player of All Time Goes for 3,4537,2021-08-05 00:49:15,2021-08-05T03:06:09.061110
40,Atrioc,Hivemind Gameshow,I AM GOING TO RUIN LUDWIG AND CHARLIES GAME SHOW (ft. CONNOR STANZ EMIRU),4386,2021-08-05 00:48:44,2021-08-05T03:06:09.061110
41,SunBaconRelaxer,Hearthstone,"Hey Watchout Im bacon here
",4346,2021-08-04 21:49:28,2021-08-05T03:06:09.061110
42,scoped,Fortnite,1v1's vs Faze Sway !vlog,4339,2021-08-04 19:25:18,2021-08-05T03:06:09.061110
43,The_Happy_Hob,Call of Duty: Warzone,[18/40 Wins] or Skydive + 400ft bungee Live (7 Wins behind) !newbet [74.51] [Chapter 1957: The Grind Pays off] !displate !pc,4331,2021-08-04 19:39:10,2021-08-05T03:06:09.061110
44,EsfandTV,World of Warcraft,TBC RET PALADIN BIG DPS -> MORE FF14 TRIALS & MSQ LATER,4078,2021-08-04 19:03:26,2021-08-05T03:06:09.061110
45,BigEx,Grand Theft Auto V,ex on sanctioned (new char coming),3981,2021-08-05 01:43:32,2021-08-05T03:06:09.061110
46,Whippy,Grand Theft Auto V,"✨chill day✨ dundee ✨nopixel !Lenovo !Nordvpn !G2A
 !meta",3638,2021-08-05 00:59:21,2021-08-05T03:06:09.061110
47,ZubatLEL,Dead by Daylight,for,3615,2021-08-05 00:14:45,2021-08-05T03:06:09.061110
48,JustaMinx,Just Chatting,DONT COME HERE,3562,2021-08-05 00:41:24,2021-08-05T03:06:09.061110
49,Nokokopuffs,Apex Legends,TOP 5 PRED GRIND WITH PFITTER AND CORY,3520,2021-08-04 17:08:48,2021-08-05T03:06:09.061110
50,Destiny,Just Chatting,"Reviewing ""MAGA Icons: Where Are They Now and Are They OK"" !VPN",3510,2021-08-04 18:57:36,2021-08-05T03:06:09.061110
51,SnaggyMo,Just Chatting,BOL BOL REACTS | UNCAPPED SUBATHON DAY 4 | !Sub !Prime !Subathon,3422,2021-08-05 00:29:47,2021-08-05T03:06:09.061110
52,Biotoxz_,Grand Theft Auto V,BJORN TRIPOD CORLEONE WARDEN OF THE NORTH DOES THE 9'S | NOPIXEL WL |,3275,2021-08-04 21:07:56,2021-08-05T03:06:09.061110
53,DougDougW,Super Mario Odyssey,"Mario Speedrun, but every 5 minutes my HUD gets worse",3260,2021-08-04 20:07:59,2021-08-05T03:06:09.061110
54,Rogue,Apex Legends,NRG ROGUE · GOING FOR #1 · Twitter: @TTrebb,3190,2021-08-04 23:51:59,2021-08-05T03:06:09.061110
55,Snip3down,Apex Legends,I am Seer. I am Prowler. | TSM FTX,3189,2021-08-04 23:04:35,2021-08-05T03:06:09.061110
56,GamesDoneQuick,Aliens vs. Predator,Speedruns From the Crypt - Movie Night - Aliens vs Predator featuring Snowfats,3169,2021-08-05 00:54:46,2021-08-05T03:06:09.061110
57,Euriece,Apex Legends,【日本語/ENG】SOLOMAS SEER | !kovaaks !artesian,3145,2021-08-04 23:16:05,2021-08-05T03:06:09.061110
58,Scarra,Final Fantasy XIV Online,almost done with hw kinda maybe,3090,2021-08-04 22:04:38,2021-08-05T03:06:09.061110
59,CDNThe3rd,Splitgate,"Splitgate Referral Code: 9BFKJ2 | CaMiLLs, Req, HD | Socials: @CDNThe3rd | [+]",3077,2021-08-04 23:18:46,2021-08-05T03:06:09.061110
60,Albralelie,I'm Only Sleeping,TSMFTX - SUBATHON || SLEEPING RIGHT NOW || !sleep,3055,2021-08-03 12:35:43,2021-08-05T03:06:09.061110
61,FENGRUSH,Tribes of Midgard,(TRIBES OF MIDGARD TONIGHT) - !ARTESIAN for Custom PCs,3006,2021-08-04 21:53:12,2021-08-05T03:06:09.061110
62,MuTeX,Call of Duty: Black Ops Cold War,Hardpoint with the boys | 3x World Record Holder,2992,2021-08-04 20:59:21,2021-08-05T03:06:09.061110
63,babbsity,Minecraft,2 players 1 controller >:),2970,2021-08-05 01:48:01,2021-08-05T03:06:09.061110
64,ploo,VALORANT,hey | !corsair !elgato !gfuel,2870,2021-08-05 01:25:16,2021-08-05T03:06:09.061110
65,snuffy,VRChat,lets hangout w/ mega cuties | ( ᵔ︠ ᴗ ︡ᵔ) !merch !links !gfuel !hoodie !collab,2867,2021-08-04 23:34:04,2021-08-05T03:06:09.061110
66,QuarterJade,The Legend of Zelda: Skyward Sword HD,HYAAHHH,2850,2021-08-04 23:01:33,2021-08-05T03:06:09.061110
67,Princess,Apex Legends,beams or no beams today?,2844,2021-08-04 22:14:45,2021-08-05T03:06:09.061110
68,GMNaroditsky,Chess,Short Blitz Session,2830,2021-08-05 01:51:58,2021-08-05T03:06:09.061110
69,EliGE,Counter-Strike: Global Offensive,FPL (demo review while waiting) | @ELIGE,2828,2021-08-05 00:18:44,2021-08-05T03:06:09.061110
70,supertf,Overwatch,big powerful domination of the highest caliber and skill today,2811,2021-08-05 02:37:40,2021-08-05T03:06:09.061110
71,DatModz,Path of Exile,!RIP Deciding New Build - HCSSFBTW !Guides ,2717,2021-08-04 20:03:40,2021-08-05T03:06:09.061110
72,Jessu,Music,beats guaranteed to boost your serotonin ♪ ♫ ♬,2655,2021-08-05 00:07:39,2021-08-05T03:06:09.061110
73,Criken,Blair Witch,streamer lost in woods please send help,2637,2021-08-05 00:23:59,2021-08-05T03:06:09.061110
74,peterparkTV,Just Chatting,Reacting to spicy videos Trigger Warning | !newvid !socials,2624,2021-08-04 18:53:25,2021-08-05T03:06:09.061110
75,Artosis,StarCraft,Ladder + BANS/UNBANS artoWhoa ~ !Gfuel,2610,2021-08-05 00:24:54,2021-08-05T03:06:09.061110
76,fobm4ster,Genshin Impact,Yoimiya Mains are the real GIGACHADs Kappa !pobox !youtube,2590,2021-08-04 22:28:15,2021-08-05T03:06:09.061110
77,mang0,Pokémon Unite,PRE PATCH BULBA LOVING THE NEW PATCH EXCEPT F CHARIZARD AND LUCARIO ,2588,2021-08-04 23:01:06,2021-08-05T03:06:09.061110
78,littlethingsmingle,"Pools, Hot Tubs, and Beaches",join my morning workout by the pool ,2506,2021-08-05 01:26:21,2021-08-05T03:06:09.061110
79,CollegeCarball,Rocket League,CCA Summer Series | West Div I League Play | Arizona v. Oregon | !casters !bracket,2392,2021-08-04 23:50:43,2021-08-05T03:06:09.061110
80,BarbarousKing,Fall Guys: Ultimate Knockout,Damn you people this is golf! Go back to your shanties,2383,2021-08-04 23:06:01,2021-08-05T03:06:09.061110
81,JoeWo,Apex Legends,NRG JoeWo // Hump Day Heaters // !scuf !socials !yt,2370,2021-08-04 20:11:39,2021-08-05T03:06:09.061110
82,KYR_SP33DY,Call Of Duty: Modern Warfare,Gaming with The Crew!,2355,2021-08-05 01:33:43,2021-08-05T03:06:09.061110
83,Emiru,Hivemind Gameshow,Hivemind on TwitchGaming w/Ludwig & /MoistCr1TiKaL | ft/Atrioc /Stanz /ConnorEatsPants | Episode 8,2333,2021-08-05 00:39:31,2021-08-05T03:06:09.061110
84,Crystalst,Grand Theft Auto V,Four Tee | NoPixel,2322,2021-08-05 00:00:11,2021-08-05T03:06:09.061110
85,Odablock,Old School RuneScape,ZATS GRAZY RISKS AND SOME HCIM? | @Odablock on socials !newvid,2262,2021-08-04 21:21:22,2021-08-05T03:06:09.061110
86,HutchMF,Grand Theft Auto V," SPONSORED STREAM !raid | Jaryd ""certified but not full"" Peak | !5k !gfuel !raid",2227,2021-08-04 20:23:40,2021-08-05T03:06:09.061110
87,Co1azo,Fortnite,Solo Cash Cups | !newvid !gfuel !scuf | TSM FTX Co1azo,2138,2021-08-04 21:00:42,2021-08-05T03:06:09.061110
88,ESAMarathon,Just Chatting,[ ↪ Rerun ] !frameperfect - The ESA Summer 2021 Anthem - https://youtu.be/lMnpKgZ74Vs,2126,2021-08-04 17:46:00,2021-08-05T03:06:09.061110
89,Sanchovies,VALORANT,hi mates c: !youtube,2110,2021-08-04 23:07:01,2021-08-05T03:06:09.061110
90,imaqtpie,Warcraft III,uh oh,2085,2021-08-04 18:13:10,2021-08-05T03:06:09.061110
91,Kiva,Grand Theft Auto V,"Andi ""Ant"" Jones | NoPixel",2085,2021-08-04 23:29:10,2021-08-05T03:06:09.061110
92,TeamSp00ky,Street Fighter V,NLBC Online Week 73 - SFV! 1 sub = $1 crowdfund | Commands: !bracket !matcherino !metaview !nordvpn !Spooky ,2081,2021-08-04 22:46:34,2021-08-05T03:06:09.061110
93,TheChief1114,Grand Theft Auto V,Fingle Dan - NoPixel,1970,2021-08-04 22:38:47,2021-08-05T03:06:09.061110
94,ChefdeParty,Food & Drink,"Direct Relief Charity Stream... Outdoor BBQ, Pineapple Teriyaki Spam Burgers on Hawaiian Rolls. !dr",1913,2021-08-05 00:26:31,2021-08-05T03:06:09.061110
95,Kruzadar,Apex Legends,⚠️learning arenas,1901,2021-08-04 22:55:03,2021-08-05T03:06:09.061110
96,MurderCrumpet,Demon's Souls,What a Magnificent Crumpet! It's First Time Demon's Souls! !socials,1847,2021-08-04 20:00:10,2021-08-05T03:06:09.061110
97,Timmac,Grand Theft Auto V,Sergeant Mack | BCSO 308 | NoPixel,1830,2021-08-04 21:08:04,2021-08-05T03:06:09.061110
98,TayderTot,Apex Legends,PUFFER GAUNTLET || sub goal to solo phasmo stream,1820,2021-08-04 23:00:24,2021-08-05T03:06:09.061110
99,GunnarDotA2,Dota 2,MORE AND MORE GAMEPLAY,1807,2021-08-04 23:21:20,2021-08-05T03:06:09.061110
