,user_name,game_name,title,viewer_count,started_at,api_call_time
0,xQcOW,Fortnite,"BEST OF ALL GAMES, VIDEO GAME VIRTUAL VIRTUOSO GOES BOOM ON NOOB AND ONLY WIN (WINNING STREAMER) COME WATCH AND GET FR33 TIPS (GONE BAD)",97326,2021-06-03 20:22:13,2021-06-03T23:06:07.812359
1,Asmongold,World of Warcraft,BURNING CRUSADE RELEASE--GOING FOR 70--GETTING READY FOR RAIDS--QUESTING WITH THE BOYS,45834,2021-06-03 14:59:13,2021-06-03T23:06:07.812359
2,HasanAbi,Just Chatting,AUSSY TIME! ,44577,2021-06-03 18:00:30,2021-06-03T23:06:07.812359
3,loltyler1,League of Legends,CRAZY !!! SURE !! OK !! let know when timer for correct and circle but orange !! ,39703,2021-06-03 19:15:01,2021-06-03T23:06:07.812359
4,buddha,Grand Theft Auto V,Lang Buddha - NoPixel,33144,2021-06-03 16:04:21,2021-06-03T23:06:07.812359
5,summit1g,Grand Theft Auto V,muted for pd meeting. Merch dropped summit1g.gg  [ @summit1g ],21828,2021-06-03 19:35:43,2021-06-03T23:06:07.812359
6,Punz,Minecraft,speedruns till i beat harvey | !gfuel !merch | @Punztw on Twitter and Insta,18722,2021-06-03 20:32:12,2021-06-03T23:06:07.812359
7,Ramee,Grand Theft Auto V,Ramee | !Twitter | NoPixel | Chang Gang,18151,2021-06-03 18:48:03,2021-06-03T23:06:07.812359
8,StableRonaldo_,Slots,Gambling 10k with my mom !duelbits #ad (18+),17984,2021-06-03 20:29:50,2021-06-03T23:06:07.812359
9,LIRIK,PowerWash Simulator,cleaning,17811,2021-06-03 16:12:32,2021-06-03T23:06:07.812359
10,Crowder,Call of Duty: Warzone,Day 1 of Becoming Great at Warzone (Part 2) | #THECROWD,17325,2021-06-03 20:20:32,2021-06-03T23:06:07.812359
11,Im_Dontai,Just Chatting,SYX NEWS! - More iCarley Reboot Updates! + POLO G Track List & Checkin Out Some Of The Music I Missed Last Week!,14600,2021-06-03 22:00:36,2021-06-03T23:06:07.812359
12,MOONMOON,Grand Theft Auto V,PD meeting (muted unfortunately I guess probably not much being said anyway LuL) ,14146,2021-06-03 22:12:54,2021-06-03T23:06:07.812359
13,Aydan,Call of Duty: Warzone,"$1,000 CMG Co-Ed Tourney w/ Dani | !giveaway !bracket",14093,2021-06-03 21:58:13,2021-06-03T23:06:07.812359
14,BoweryPresents,Music,"Mac Ayres - Live from Brooklyn Steel, presented by Toyota",13226,2021-06-03 22:55:01,2021-06-03T23:06:07.812359
15,shroud,World of Warcraft,TBC GRIND CONTINUES. | Follow @shroud on socials,12794,2021-06-03 17:40:25,2021-06-03T23:06:07.812359
16,PrimeGaming,Just Chatting,Prime Gaming Insider Show - June 2021,12245,2021-06-03 22:44:33,2021-06-03T23:06:07.812359
17,sodapoppin,World of Warcraft,TBC launch! Day 3 | www.sodapoppin.shop (Discount code: POOR),11448,2021-06-03 21:29:29,2021-06-03T23:06:07.812359
18,Zerkaa,Grand Theft Auto V,TOMMY TATE | NoPixel RP (!rp - !meta - !backseat - !chathopping),11155,2021-06-03 21:18:06,2021-06-03T23:06:07.812359
19,AdmiralBahroo,Just Chatting,Art Contest 2021 Showcase!,10304,2021-06-03 15:15:16,2021-06-03T23:06:07.812359
20,lilypichu,Minecraft,ðŸŒ¸ðŸŒ¸ðŸŒ¸ðŸŒ¸,10182,2021-06-03 20:48:35,2021-06-03T23:06:07.812359
21,AsunaWEEB,VALORANT,100T Asuna TOP 3 RANKED | [!newvid] [!socials] [!leaderboard],9576,2021-06-03 19:35:04,2021-06-03T23:06:07.812359
22,SmallAnt,Minecraft,LOCKOUT REMATCH vs Krinios,9457,2021-06-03 20:03:28,2021-06-03T23:06:07.812359
23,Academy,League of Legends,LCS Academy: Dignitas vs. FlyQuest,9394,2021-06-03 19:39:44,2021-06-03T23:06:07.812359
24,VonDice,Slots,CASH RAFFLES ALL NIGHT TYPE !GAM TO REGISTER. ðŸŽ²FREESTYLE ALL NIGHTðŸŽ²!GAMDOM up to $50 FREE ðŸŽ° ,9352,2021-06-03 15:48:26,2021-06-03T23:06:07.812359
25,forsen,The Binding of Isaac: Repentance,Isuck,9269,2021-06-03 16:59:34,2021-06-03T23:06:07.812359
26,HusKerrs,Call of Duty: Warzone,2v2 CoEd Tournament w/ p90princess !giveaway !slayout | Follow @HusKerrs on all !Socials !GFuel,9236,2021-06-03 18:53:06,2021-06-03T23:06:07.812359
27,LVNDMARK,Escape from Tarkov,TARKY | !VIEWERKITS | !GLOCK | !GFUEL | Follow @LVND,8583,2021-06-03 20:33:27,2021-06-03T23:06:07.812359
28,Masayoshi,Minecraft,fred [OTV SMP] !metagame !fred,8338,2021-06-03 19:24:22,2021-06-03T23:06:07.812359
29,5uppp,Minecraft,Minecrafts on the OTV + Friends server w/ Hafu | !displate !artcompetition !otvmod,7316,2021-06-03 14:46:08,2021-06-03T23:06:07.812359
30,Warframe,Warframe,Home Time #58 - Gara Prime Or Bust!,6819,2021-06-03 22:58:42,2021-06-03T23:06:07.812359
31,Kiyoon,Teamfight Tactics,"TSM Kiyoon | 1351 LP START | getting vaccinated tom, i will be immune to lp loss  now >:) !bpatch live | !teemo3 on !yt | !blitz",6320,2021-06-03 19:23:58,2021-06-03T23:06:07.812359
32,Nightblue3,League of Legends,PagMan PagMan PagMan PagMan PagMan PagMan PagMan PagMan PagMan ,6171,2021-06-03 19:28:18,2021-06-03T23:06:07.812359
33,projektmelody,Just Chatting,Just chattin and hanging with mouse later,6054,2021-06-03 20:53:53,2021-06-03T23:06:07.812359
34,Pieface23,FIFA 21,(UK) Last chance for Neymar and RTG Rewards! I packed !Mbappe,6017,2021-06-03 21:44:19,2021-06-03T23:06:07.812359
35,pokelawls,Assetto Corsa,DAY 3 LEARNING HOW TO DRIFT (I DONT EVEN KNOW HOW TO DRIVE),5935,2021-06-03 19:50:52,2021-06-03T23:06:07.812359
36,Myth,Minecraft,Mythical Mining and Crafting [OTV SMP] - !socials !smprules,5852,2021-06-03 19:28:39,2021-06-03T23:06:07.812359
37,Pestily,Escape from Tarkov,KAPPA SPEED RUN DUOS W/ REDOPZ | !AMA,5685,2021-06-03 18:34:04,2021-06-03T23:06:07.812359
38,Distortion2,Resident Evil Village,NG Village of Shadows Speedruns ,5645,2021-06-03 16:00:21,2021-06-03T23:06:07.812359
39,Northernlion,Knockout City,"Insane Variety Thursday, Sponsored by Wealthsimple (#ad) | !wealthsimple !docket !prime",5320,2021-06-03 18:02:09,2021-06-03T23:06:07.812359
40,BeyondTheSummit,Dota 2,LIVE: Simply TOOBASED vs. The Cut (Bo3) - LOOT.BET Pro Series 6 NA/SA: LB Round 1 w/ KMart & ET,5211,2021-06-02 12:46:52,2021-06-03T23:06:07.812359
41,CodeMiko,Grand Theft Auto V,!youtube Code Psyko first GTA adventure in NoPixel,5162,2021-06-03 18:58:12,2021-06-03T23:06:07.812359
42,Smoke,DayZ,Esseker Survival - Day 942 !youtube,4867,2021-06-03 15:14:51,2021-06-03T23:06:07.812359
43,SypherPK,Call of Duty: Warzone,6'10 Gaming Machine | ðŸ‘¹ @SypherPK,4704,2021-06-03 16:34:41,2021-06-03T23:06:07.812359
44,AyeZee,Slots,"18+ | ðŸŽ¯ LOOKING FOR $200,000 BOOST  | !rollbit for most player rewarding casino | $10,000 !GIVEAWAY",4463,2021-06-03 19:45:30,2021-06-03T23:06:07.812359
45,Kalei,Call of Duty: Warzone,I JOINED FAZE  | Follow My Twitter - @KaleiRenay,4429,2021-06-03 18:17:12,2021-06-03T23:06:07.812359
46,poopernoodle,Just Chatting,3 YEAR SUBATHON UNCAPPED NO SLEEP - BAKING CAKES!,4357,2021-06-03 10:00:34,2021-06-03T23:06:07.812359
47,AvoidingThePuddle,Fallout 3,Fallout 3 - Shirts and Mugs http://teespring.com/stores/ATP,4342,2021-06-03 21:04:43,2021-06-03T23:06:07.812359
48,Burn,Grand Theft Auto V,NoYu Sukk -- NoPixel 3.0 RP -- The day before the last.,4317,2021-06-03 22:07:15,2021-06-03T23:06:07.812359
49,Zoomaa,Call of Duty: Black Ops Cold War,THE FLANK / CODS BEST POSTGAME,4266,2021-06-03 21:31:22,2021-06-03T23:06:07.812359
50,Stewie2K,Counter-Strike: Global Offensive,PRE-SALE IS LIVE | www.stewiestore.com | @StewieStore | @Stewie,4213,2021-06-03 18:22:35,2021-06-03T23:06:07.812359
51,melina,Just Chatting,GOING TO WASHINGTON STATE TOMORROW! â›°â›ºï¸ | insta: melina.goransson,4111,2021-06-03 22:03:33,2021-06-03T23:06:07.812359
52,hJune,Minecraft,OTV SMP nonstop adventure !metagame | twitter: @h7une,4081,2021-06-03 16:13:44,2021-06-03T23:06:07.812359
53,limit_maximum,World of Warcraft,Warcraftlogs recruitment tool | shark/monk raid tonight | extremely clean right now,4062,2021-06-03 21:34:25,2021-06-03T23:06:07.812359
54,Savjz,Hearthstone,NEW HEROES NEW UNIT // SAVJZ BGs,3974,2021-06-03 18:32:29,2021-06-03T23:06:07.812359
55,cyr,Grand Theft Auto V,"UCHI JONES -  NOPIXEL 3.0 , CHANG GANG USDA APPROVED RAMEE MALDING SIMULATOR. PS. NEW !YOUTUBE VID , DO YOU LOVE THE ALL CAPS?! DOES IT HELP",3906,2021-06-03 18:07:28,2021-06-03T23:06:07.812359
56,CohhCarnage,Tainted Grail: Conquest,Cozy Tainted Grail! - Wasteland 3 DLC TOMORROW! - !NewHouseMonth - !VODChat - !Birthday - #EpicPartner Creator Code: Cohh,3882,2021-06-03 22:39:51,2021-06-03T23:06:07.812359
57,EsfandTV,Grand Theft Auto V,(Sitting in PD Meeting Muted) WARLORD OF WARCRAFT - JUDGEMENT DAY,3809,2021-06-03 20:34:22,2021-06-03T23:06:07.812359
58,glermz,Don't Starve Together,NEW !DROP & !PATCH | KLEI BIG PROMO | !discord #SocialClub,3470,2021-06-03 17:40:38,2021-06-03T23:06:07.812359
59,Sweet_Anita,Just Chatting,Reading Thirst Comments | !discord !merch !social !charity,3470,2021-06-03 19:25:41,2021-06-03T23:06:07.812359
60,RTGame,Bioshock Infinite,Bring us the girl,3368,2021-06-03 17:59:08,2021-06-03T23:06:07.812359
61,Sanchovies,League of Legends,loud music and soloq climb today ... not much talkings.... relax & enjoy ðŸŒž,3354,2021-06-03 21:27:46,2021-06-03T23:06:07.812359
62,The_Happy_Hob,Dark Souls III,!S25 The Final Bet! - PYRO All Boss No Hit Run /w DLC !newbet [12.113] [Chapter 1902: Termina Looms] !displate !pc,3336,2021-06-03 20:48:08,2021-06-03T23:06:07.812359
63,Day9tv,Age of Empires II,AoE2 1v1 Laddering ALL DAY  //  Trying to make myself build archers  //  Streams Thur/Fri and next week!,3311,2021-06-03 19:57:14,2021-06-03T23:06:07.812359
64,ESL_CSGO,Counter-Strike: Global Offensive,RERUN: Gambit vs. Sprout  [Vertigo] Map 1 - IEM Summer 2021 - Group A,3291,2021-06-03 21:46:29,2021-06-03T23:06:07.812359
65,Apricot,SMITE,What do I do WHAT DO I DO SEND HELP ,3261,2021-06-03 20:42:46,2021-06-03T23:06:07.812359
66,Snip3down,Apex Legends,Keeping Vibes High All Day,3169,2021-06-03 22:47:15,2021-06-03T23:06:07.812359
67,BrookeAB,Minecraft,OTV SMP DAY 1 WOOOO,3144,2021-06-03 22:19:27,2021-06-03T23:06:07.812359
68,bmkibler,Hearthstone,Wailing Caverns Mini-Set Sweet Decks all day! !bose,3125,2021-06-03 16:53:34,2021-06-03T23:06:07.812359
69,SunBaconRelaxer,Hearthstone,"NEW PATCH, Same Old Killin it",3069,2021-06-03 21:08:06,2021-06-03T23:06:07.812359
70,Payo,World of Warcraft,WORLD FIRST TO NOTHING - TBC ROGUE QUESTING - !GoodBye Classic,3051,2021-06-03 15:24:09,2021-06-03T23:06:07.812359
71,lilsimsie,Story of Seasons: Pioneers of Olive Town,I LOVE TO FARM | !olivetown #ad,3015,2021-06-03 19:59:58,2021-06-03T23:06:07.812359
72,SmiteGame,SMITE,SMITE Pro League Phase 1 Week 5: Day 1,3000,2021-06-03 22:01:42,2021-06-03T23:06:07.812359
73,Awesomejake408,SMITE,OWNING IN RANKED SERIOUS GM,2970,2021-06-03 21:42:32,2021-06-03T23:06:07.812359
74,itsHafu,Minecraft,HAFU -- OFFLINETV SMP,2855,2021-06-03 14:56:22,2021-06-03T23:06:07.812359
75,ZeRoyalViking,Gartic Phone,Gartic Phone... then TOWN OF US! w/ Friends! !group,2843,2021-06-03 18:56:49,2021-06-03T23:06:07.812359
76,sleepy,Minecraft,OTV SMP / partaking in a miniscule amount of tomfoolery,2819,2021-06-03 22:08:19,2021-06-03T23:06:07.812359
77,ClassyBeef,Slots,ðŸ”¥ 1.5 MEN vs SLOTS!! ðŸ”¥ | $50.000 !Tournament | !Stake for best Casino,2767,2021-06-02 04:07:03,2021-06-03T23:06:07.812359
78,boxbox,Minecraft,minecraft virgin day 2 [OTV SMP],2732,2021-06-03 20:18:36,2021-06-03T23:06:07.812359
79,OfficialBoaster,VALORANT,ðŸ”¥FNATIC BOASTER BACK FROM MASTERS!!ðŸ”¥ ,2731,2021-06-03 19:57:50,2021-06-03T23:06:07.812359
80,IFrostBolt,Destiny 2,STASIS NERFS TODAY | Electric Frost Berry + Frost Shaker Cup = !focus,2695,2021-06-03 16:58:08,2021-06-03T23:06:07.812359
81,DansGaming,The Last Spell,The Last Spell (PC) *Sponsored*,2677,2021-06-03 18:36:22,2021-06-03T23:06:07.812359
82,Odablock,Old School RuneScape,TODAY IS GONNA BE A SPECIAL DAY - ASK ME WHY - @Odablock on socials !newvid !nopixel !scarecompilation,2540,2021-06-03 19:33:12,2021-06-03T23:06:07.812359
83,Limmy,Dead by Daylight,Toxic survivor... and PROUD!,2507,2021-06-03 21:53:36,2021-06-03T23:06:07.812359
84,Lobanjicaa,Counter-Strike: Global Offensive,#1 FPL PLAYER WORLD -> !FPL | 560â‚¬ KNIFE @ 2500 SUBS | !gamersupps !hellcase !gamdom !shadowpay,2494,2021-06-03 18:26:30,2021-06-03T23:06:07.812359
85,Emongg,Overwatch,"PATCH IS LIVE GOING TO WIN MORE GAMES BY WINNING THE GAMES THAT WE WIN - !shock !ibuypower !minecraft
",2476,2021-06-03 15:04:53,2021-06-03T23:06:07.812359
86,PointCrow,The Legend of Zelda: Breath of the Wild,100% SPEEDRUNS [day 1],2446,2021-06-03 16:31:04,2021-06-03T23:06:07.812359
87,Ayrun,Dead by Daylight,DEAD BY DAYLIGHT,2420,2021-06-03 20:04:14,2021-06-03T23:06:07.812359
88,FollowGrubby,Heroes of the Storm,We are here to collect on a win streak - ![heroname] for builds - done about 50 out of 90 ,2406,2021-06-03 18:04:14,2021-06-03T23:06:07.812359
89,ChessWeeb,Chess,"GM Denes Boros  -   Rappin' Rosen Snippin' GM!- Chess Clubbin' [HU/ENG]  | !New,
!300, !club",2392,2021-06-03 22:07:04,2021-06-03T23:06:07.812359
90,Taylor_Jevaux,Just Chatting,BODY PAINT WITH CHATðŸ’• !youtube !insta,2379,2021-06-03 19:43:51,2021-06-03T23:06:07.812359
91,ShnaggyHose,Just Chatting,Mark Henry and Future plays It Takes 2 !sub !prime,2351,2021-06-03 21:37:43,2021-06-03T23:06:07.812359
92,Mathil1,Path of Exile,"Mathil - Less sick? Raider Lacerate into endgame stuff sometimes, massive mtx action",2317,2021-06-03 19:41:17,2021-06-03T23:06:07.812359
93,xChocoBars,Minecraft,OTV SMP LETS GO0O0O,2273,2021-06-03 22:39:51,2021-06-03T23:06:07.812359
94,UMGGaming,Gears 5,Emergence Days: Season 3 Week 24,2251,2021-06-03 21:00:02,2021-06-03T23:06:07.812359
95,FGmoo,Minecraft,FIRST SUMMER STREAM ,2207,2021-06-03 21:24:46,2021-06-03T23:06:07.812359
96,Avast,Overwatch,Plat Chat Survivor Stream,2187,2021-06-03 18:30:39,2021-06-03T23:06:07.812359
97,starsmitten,Minecraft,wheee [otv] !smprules,2170,2021-06-03 18:50:24,2021-06-03T23:06:07.812359
98,Zapman,SMITE,Watching SPL then Ranked! | Solar Scarabs,2117,2021-06-03 19:55:06,2021-06-03T23:06:07.812359
99,CalebDMTG,Magic: The Gathering,MH2 IS LIVELIVELIVE let's DRAFTDRAFTDRAFT,2101,2021-06-03 18:19:10,2021-06-03T23:06:07.812359
