,username,video_title,publish_time,view_count,comment_count,like_count,dislike count,api_call_time
0,Bizarrap,Nicky Jam || BZRP Music Sessions #41,2021-06-30T22:00:09Z,21354693,156657,2366618,19708,2021-07-03T02:37:08.753916
1,Stray Kids,"Bang Chan, Lee Know &quot;Drive&quot; | [Stray Kids : SKZ-PLAYER]",2021-07-02T14:59:57Z,1248385,50168,396117,476,2021-07-03T02:37:08.753916
2,iggyazaleamusicVEVO,Iggy Azalea - I Am The Stripclub [Official Music Video],2021-07-02T04:00:05Z,969868,10539,68642,4549,2021-07-03T02:37:08.753916
3,Animation max,Awaken the jungle king clash of clans season challenges,2021-07-02T07:09:00Z,3909258,4067,100967,2085,2021-07-03T02:37:08.753916
4,MikyWoodz,Miky Woodz   Necesario (Video Oficial),2021-07-01T23:06:11Z,473834,1642,32427,206,2021-07-03T02:37:08.753916
5,Mrhugo,Spawner con diamante en Minecraft #Shorts,2021-07-01T17:30:00Z,139930,42,12343,525,2021-07-03T02:37:08.753916
6,Fortnite Fun TV,She is foxy but not enough #Shorts,2021-06-29T00:47:43Z,76849428,1205,2877755,65211,2021-07-03T02:37:08.753916
7,Ed Sheeran,Ed Sheeran - Bad Habits [Official Video],2021-06-25T04:00:33Z,34652049,72323,1171496,37077,2021-07-03T02:37:08.753916
8,Bleacher Report,Patrick Beverley Gets Ejected After Shoving Chris Paul In Game 6 Loss,2021-07-01T04:28:10Z,3006648,7085,17480,831,2021-07-03T02:37:08.753916
9,Ibai,REACCIONANDO a BIZARRAP Music Sessions #41 | Nicky Jam,2021-06-30T22:30:47Z,2204046,3894,226959,2001,2021-07-03T02:37:08.753916
10,ImagineDragonsVEVO,Imagine Dragons - Wrecked (Lyric Video),2021-07-02T04:00:01Z,687851,5673,94027,405,2021-07-03T02:37:08.753916
11,DeuceReacts,Big Red Machine - Renegade feat. Taylor Swift - REACTION,2021-07-03T02:22:26Z,645271,4936,76429,313,2021-07-03T02:37:08.753916
12,NOW UNITED,Now Love Live From Abu Dhabi,2021-07-01T19:04:56Z,2567705,27882,316246,2316,2021-07-03T02:37:08.753916
13,Doja Cat,"Doja Cat, The Weeknd - You Right (Official Video)",2021-06-25T04:00:10Z,31961390,46108,878112,14920,2021-07-03T02:37:08.753916
14,The Royal Family Channel,Prince William and Harry Unveil Diana Statue on What Would Have Been Her 60th Birthday,2021-07-01T15:15:28Z,1244154,6429,20524,1026,2021-07-03T02:37:08.753916
15,Beast Reacts,Inside an Ice Cream Factory!,2021-06-28T20:14:23Z,9112587,18410,420483,5265,2021-07-03T02:37:08.753916
16,Veritasium,"A Physics Prof Bet Me $10,000 I&#39;m Wrong",2021-06-30T18:31:01Z,3647457,27149,266347,2603,2021-07-03T02:37:08.753916
17,MANIACITV,G Herbo - Cry No More feat. Polo G &amp; Lil Tjay (Official Audio) REACTION,2021-07-02T16:50:33Z,333496,1812,25137,182,2021-07-03T02:37:08.753916
18,Toosii 2x,Toosii - heart cold (Official Video),2021-07-02T04:20:49Z,352195,1682,28716,356,2021-07-03T02:37:08.753916
19,SmarterEveryDay,"How Does A Carburetor Work? | Transparent Carburetor at 28,546 fps Slow Mo - Smarter Every Day 259",2021-06-30T16:01:11Z,2484595,15185,169975,916,2021-07-03T02:37:08.753916
20,MrBeast Gaming,1 vs 100 Player Manhunt!,2021-06-30T19:25:11Z,9038832,27205,448799,7619,2021-07-03T02:37:08.753916
21,GRM Daily,Russ Millions - Big Shark [Music Video] | GRM Daily,2021-07-01T20:00:13Z,717327,3811,57781,837,2021-07-03T02:37:08.753916
22,Fortnite Fun TV,I did it! I connected them all #Shorts,2021-06-20T13:02:05Z,135007515,3561,3922538,113466,2021-07-03T02:37:08.753916
23,PearlescentMoon,Hermitcraft S8: Recruited into Tree Chaos! | Episode 3,2021-07-02T20:36:15Z,517371,3266,34891,280,2021-07-03T02:37:08.753916
24,PlayStation,"Ghost of Tsushima Director&#39;s Cut - Announcement Trailer | PS5, PS4",2021-07-01T16:00:04Z,628648,4065,34477,971,2021-07-03T02:37:08.753916
25,ChrisMD,We Took 100 Shots vs a Premier League Keeper and Scored ___ Goals,2021-06-29T19:11:54Z,2554636,2200,130926,660,2021-07-03T02:37:08.753916
26,AD-WISE MEDIA ACTION MOVIEPLEX,"A1 EXPRESS (2021) NEW Released Hindi Dubbed Movie | Sundeep Kishan, Lavanya | New South Movie 2021",2021-06-28T06:30:10Z,22120775,9620,417048,21148,2021-07-03T02:37:08.753916
27,Bruno Mars,"Bruno Mars, Anderson .Paak, Silk Sonic - Leave The Door Open (Live from the BET Awards)",2021-06-28T07:00:11Z,5942659,9742,285058,1761,2021-07-03T02:37:08.753916
28,New Rockstars,LOKI EPISODE 4 BREAKDOWN! Easter Eggs &amp; Details You Missed!,2021-07-01T19:41:46Z,1265758,3648,53545,3062,2021-07-03T02:37:08.753916
29,How To Cook That,NEW Debunking &quot;Organic Food&quot; Viral Videos | How To Cook That Ann Reardon,2021-07-02T09:30:01Z,373776,3784,38869,138,2021-07-03T02:37:08.753916
30,Sidemen,THE WHEEL: SIDEMEN EDITION,2021-06-27T17:01:46Z,8158408,24620,520138,2928,2021-07-03T02:37:08.753916
31,Bretman Rock,Is Bretman Rock Moving to the Jungle? | 30 Days With: Bretman Rock,2021-06-30T20:00:12Z,1459437,3967,114757,621,2021-07-03T02:37:08.753916
32,Premier Boxing Champions,"Gervonta Davis vs Mario Barrios Knockout HIGHLIGHTS: June 26, 2021 - PBC on Showtime PPV",2021-06-27T06:27:34Z,5293847,7802,44748,2520,2021-07-03T02:37:08.753916
33,Jake Fellman,Minecraft RTX 58% HEROBRINE #Shorts,2021-06-30T11:44:36Z,1599367,867,101468,4127,2021-07-03T02:37:08.753916
34,ALLES ODER NIX RECORDS,ENO x M HUNCHO &quot;Heavy Duty&quot; Official Musicvideo,2021-07-01T22:00:14Z,168022,1078,14710,901,2021-07-03T02:37:08.753916
35,MadisonBeerMusicVEVO,Madison Beer - Reckless (Official Music Video),2021-06-29T04:00:11Z,2879061,12893,263264,3220,2021-07-03T02:37:08.753916
36,TODAY,Watch: Statue Of Princess Diana Revealed On Her 60th birthday,2021-07-01T14:54:43Z,460335,1744,6844,289,2021-07-03T02:37:08.753916
37,Fortnite Fun TV,Turn into jelly balls - Tutorial #Shorts,2021-06-30T00:38:48Z,5717647,90,214749,12390,2021-07-03T02:37:08.753916
38,TIKTORIKI,What else to try? #shorts Funn Tiktok new food Challenge by Tiktoriki,2021-06-19T07:15:00Z,31653048,780,658352,60555,2021-07-03T02:37:08.753916
39,FloBikes,Spectator Causes Entire Peloton To Crash At Tour de France,2021-06-26T16:32:06Z,6185714,9336,23434,1596,2021-07-03T02:37:08.753916
40,Shirin David,Shirin David - Lieben wir [Official Video],2021-07-01T22:00:11Z,1023313,5201,86596,8683,2021-07-03T02:37:08.753916
41,Kiry Curu,Kiry Curu - Amaneci Chuky | Video Oficial | Dir Rochy RD,2021-06-29T16:32:44Z,1318402,5146,74069,975,2021-07-03T02:37:08.753916
42,Memeulous,The Lowest Rated Movie EVER,2021-07-01T18:52:11Z,435718,2111,36211,380,2021-07-03T02:37:08.753916
43,Windies Cricket,Highlights | West Indies vs South Africa | Lewis &amp; Gayle Star! | 1st CG Insurance T20I 2021,2021-06-26T23:10:08Z,4320000,3687,84813,2626,2021-07-03T02:37:08.753916
44,MORGENSHTERN,"MORGENSHTERN - ARISTOCRAT (Official Video, 2021)",2021-06-15T10:30:03Z,22638175,62702,1037079,109476,2021-07-03T02:37:08.753916
45,Austin Sprinz,Colored Zorbo + Fan #shorts,2021-06-15T21:15:59Z,29705556,1138,421829,30586,2021-07-03T02:37:08.753916
46,DRIVETRIBE,James May has bought ANOTHER new car!,2021-06-30T18:00:17Z,1041158,3359,40759,1773,2021-07-03T02:37:08.753916
47,Cody & Ko,The REAL reason Cody Ko became a millionaire,2021-06-30T17:00:29Z,726188,1630,62957,261,2021-07-03T02:37:08.753916
48,The United Stand,SANCHO SIGNS for MAN UTD! Man Utd Transfer News,2021-06-30T19:14:13Z,441487,934,24648,439,2021-07-03T02:37:08.753916
49,MrBeast,"Hit The Target, Win $300,000",2021-06-12T20:00:01Z,38512597,82191,1725923,25314,2021-07-03T02:37:08.753916
