,username,video_title,publish_time,view_count,comment_count,like_count,dislike count,api_call_time
0,The Tonight Show Starring Jimmy Fallon,BTS: Permission to Dance (TV Debut) | The Tonight Show Starring Jimmy Fallon,2021-07-14T04:30:11Z,7286439,38773,1121267,5905,2021-07-15T08:37:06.250559
1,Last X Reacts,Ariana Grande - My Hair (Official Live Performance) | Vevo REACTION,2021-07-15T00:33:47Z,2008735,28162,320530,1477,2021-07-15T08:37:06.250559
2,CamiloVEVO,"Camilo, Shawn Mendes - KESI (Remix - Audio)",2021-07-14T16:00:06Z,1389897,17752,206988,2547,2021-07-15T08:37:06.250559
3,Ryan Reynolds,Deadpool and Korg React,2021-07-13T16:39:18Z,6529307,14038,492017,2490,2021-07-15T08:37:06.250559
4,Goodwin Family,Bringing Down the House #shorts,2021-07-04T06:47:53Z,53899729,6402,1467602,87309,2021-07-15T08:37:06.250559
5,MrBeast,"Offering Kids $100,000 To Quit School",2021-07-10T20:00:09Z,27118710,66055,1389136,17770,2021-07-15T08:37:06.250559
6,BLACKPINK,BLACKPINK - 5th ANNIVERSARY [4+1] THE MOVIE MAIN TRAILER,2021-07-14T09:00:18Z,3406077,47769,787694,5240,2021-07-15T08:37:06.250559
7,Lau Dumé,Nuevo WhatsApp Estilo IPhone en Android 2021,2021-07-12T17:14:28Z,645520,2250,37113,1159,2021-07-15T08:37:06.250559
8,TheKidLAROIVEVO,"The Kid LAROI, Justin Bieber - Stay (Official Video)",2021-07-09T04:00:12Z,14484918,46815,761601,9769,2021-07-15T08:37:06.250559
9,EA SPORTS FIFA,FIFA 22 | Official Reveal Trailer,2021-07-11T15:30:10Z,3164983,12132,134847,25770,2021-07-15T08:37:06.250559
10,BT Sport,&quot;This guy is a dirtbag!&quot; Dustin Poirier on Conor McGregor after heated UFC 264 main event.,2021-07-11T04:43:13Z,6710566,13526,77612,5449,2021-07-15T08:37:06.250559
11,BustaRhymesVEVO,Busta Rhymes - Deep Thought (Official Video),2021-06-17T16:00:31Z,4265772,1126,31905,1098,2021-07-15T08:37:06.250559
12,XXL,"DDG, Lakeyah, Morray and Coi Leray&#39;s 2021 XXL Freshman Cypher",2021-07-13T16:00:07Z,1952977,29382,94596,21225,2021-07-15T08:37:06.250559
13,Safiya Nygaard,I Made Lipstick From Scratch,2021-07-13T20:16:35Z,1561918,6012,121006,766,2021-07-15T08:37:06.250559
14,ESPN MMA,"Khabib on Conor McGregor vs. Dustin Poirier 3, retiring at the top and coaching | MMA on ESPN",2021-07-13T17:24:11Z,1136051,7328,40543,771,2021-07-15T08:37:06.250559
15,Kurtis Conner,Undercover Boss is Ridiculous,2021-07-13T18:00:02Z,986313,7837,105898,900,2021-07-15T08:37:06.250559
16,Dude Perfect,I Got Hit By A Car,2021-07-12T21:59:59Z,6912432,11064,320369,4872,2021-07-15T08:37:06.250559
17,Virgin Galactic,WATCH LIVE: Virgin Galactic Unity 22 Spaceflight Livestream,2021-07-11T17:00:43Z,7891570,4199,107107,4351,2021-07-15T08:37:06.250559
18,Pixar,Turning Red | Teaser Trailer,2021-07-13T12:12:39Z,1948348,6241,63989,2323,2021-07-15T08:37:06.250559
19,Joe Porter,Cool Musical Sound Effects on Different Instruments #shorts,2021-07-06T04:10:27Z,23399536,6320,1499946,23214,2021-07-15T08:37:06.250559
20,Hidden Creation,Brazil vs Argentina !! Copa America Final ! Amazing Goal by Ángel Fabián Di María. 🇦🇷🇦🇷🇦🇷,2021-07-14T17:27:21Z,7241110,5208,158366,5568,2021-07-15T08:37:06.250559
21,Heavy Spoilers,LOKI Episode 6 Breakdown &amp; Ending Explained Spoiler Review | MCU Easter Eggs &amp; Season 2 Theories,2021-07-14T11:12:05Z,752475,5272,31992,1737,2021-07-15T08:37:06.250559
22,BillieEilishVEVO,Billie Eilish - NDA (Official Music Video),2021-07-09T04:00:09Z,16183483,87482,1152018,32879,2021-07-15T08:37:06.250559
23,WGN News,Man &#39;viciously executed&#39; at Wisconsin gas station; police kill suspect,2021-07-13T22:09:36Z,486376,3221,5931,287,2021-07-15T08:37:06.250559
24,The Swoon,"Song Kang gives Han So-hee birthday kisses on the kitchen countertop | Nevertheless, Ep 4 [ENG SUB]",2021-07-12T01:00:05Z,3223434,1311,38800,942,2021-07-15T08:37:06.250559
25,Sanjay 10,"Italy England|Euro2020,Final(3-2)Penalty Shoot Out|Repeated same like of Euro2012,Semi Final",2021-07-12T06:50:30Z,2054245,2239,32844,1013,2021-07-15T08:37:06.250559
26,Soccer Stories - Oh My Goal,What Bonucci Screamed On Camera Made England Fans Go Crazy | Oh My Goal,2021-07-13T16:00:16Z,524785,3122,15402,569,2021-07-15T08:37:06.250559
27,Liverpool FC,Inside Training: Squad returns for first full pre-season session in Austria,2021-07-13T15:30:13Z,785027,2146,33194,304,2021-07-15T08:37:06.250559
28,Copa América,HIGHLIGHTS ARGENTINA 1 - 0 BRASIL | COPA AMÉRICA 2021 | 10-07-21,2021-07-11T03:10:03Z,3050844,3137,47284,915,2021-07-15T08:37:06.250559
29,Fight Focus,What ACTUALLY HAPPENED at UFC 264 (Conor McGregor Vs Dustin Poirier 3) Full Fight + Highlights Recap,2021-07-11T07:23:47Z,4435039,3873,19487,17478,2021-07-15T08:37:06.250559
30,Hella Cash,ASHAFAR x MORAD - AMS - BCN (prod. Keyser Soze),2021-07-12T12:00:11Z,445759,785,20507,458,2021-07-15T08:37:06.250559
31,PostMaloneVEVO,Post Malone - Motley Crew (Official Video),2021-07-12T20:00:12Z,2173470,8950,171299,4011,2021-07-15T08:37:06.250559
32,MORGENSHTERN,"MORGENSHTERN - NOMINALO (Official Video, 2021)",2021-07-06T20:05:00Z,9127065,56427,722366,42205,2021-07-15T08:37:06.250559
33,LARRAY,I LIVED IN PARIS FOR A WEEK,2021-07-12T20:40:02Z,1385418,5983,114149,1010,2021-07-15T08:37:06.250559
34,UEFA,Vote for your EURO 2020 Goal of the Tournament!!,2021-07-13T13:18:33Z,1383951,8881,34872,476,2021-07-15T08:37:06.250559
35,MMA Junkie,"Khabib Nurmagomedov reacts to Conor McGregor&#39;s loss, leg break | UFC 264",2021-07-13T00:34:46Z,1263519,5353,37036,984,2021-07-15T08:37:06.250559
36,Arsenal,HIGHLIGHTS | Hibernian vs Arsenal (2-1) | Pre-season friendly | Smith Rowe scores,2021-07-13T22:00:08Z,430492,1849,6404,1124,2021-07-15T08:37:06.250559
37,Thogden,The Moment England Lose to Italy on Penalties | EURO 2020 Final,2021-07-12T00:31:57Z,1135620,19276,40309,3847,2021-07-15T08:37:06.250559
38,IDJVideos.TV,VOYAGE X SNIK - BOUNCE (OFFICIAL VIDEO),2021-07-04T10:00:10Z,6453542,7770,117452,5989,2021-07-15T08:37:06.250559
39,Mora,Mora x Bad Bunny x Sech - Volando Remix (Video Oficial),2021-07-08T19:00:09Z,15983209,22384,689628,8256,2021-07-15T08:37:06.250559
40,America's Got Talent,Golden Buzzer: 9-Year-Old Victory Brinker Makes AGT HISTORY! - America&#39;s Got Talent 2021,2021-07-07T01:58:39Z,8497396,11140,166346,4718,2021-07-15T08:37:06.250559
41,Sidhu Moose Wala,295 (Official Audio) | Sidhu Moose Wala | The Kidd | Moosetape,2021-07-14T06:30:10Z,5176743,666075,527867,10034,2021-07-15T08:37:06.250559
42,Christian Wedoy,How to hold your breath longer part 2 #shorts,2021-07-12T18:30:45Z,909310,422,40161,832,2021-07-15T08:37:06.250559
43,Nika TUBE,"Creative Video | Pub street food and cooking , dinner, drink , BBQ restaurant",2021-06-29T11:44:50Z,23848783,1515,158219,28144,2021-07-15T08:37:06.250559
44,Concacaf,Qatar vs Panama | Unfiltered Match Preview presented by Angry Orchard,2021-07-12T16:45:49Z,79484,188,589,31,2021-07-15T08:37:06.250559
45,Indian Rapscallion,Heel Step Smash Gameplay #3 #shorts #Heelstepsmash,2021-06-29T12:21:28Z,23020126,1750,315540,53202,2021-07-15T08:37:06.250559
46,Score! TV,https://youtu.be/czHHdpuZKhs,2021-07-14T23:33:53Z,87201,160,1212,46,2021-07-15T08:37:06.250559
47,BD10HD,Lionel Messi Celebrations &amp; Crazy Moments After Winning !,2021-07-11T03:27:00Z,2089571,2671,46516,916,2021-07-15T08:37:06.250559
48,Ed Sheeran,Ed Sheeran - Bad Habits [Official Video],2021-06-25T04:00:33Z,62040530,92377,1555949,54485,2021-07-15T08:37:06.250559
49,BT Sport,&quot;What are you doing bro? That&#39;s disgusting!&quot; Dustin Poirier heated interview after UFC 264,2021-07-11T07:21:24Z,3577921,9042,49455,1933,2021-07-15T08:37:06.250559
