,username,video_title,publish_time,view_count,comment_count,like_count,dislike count,api_call_time
0,Ed Sheeran,Ed Sheeran - Bad Habits [Official Video],2021-06-25T04:00:33Z,14160957,56060,802488,20995,2021-06-27T20:37:06.830652
1,Doja Cat,"Doja Cat, The Weeknd - You Right (Official Video)",2021-06-25T04:00:10Z,16008858,37778,620741,9655,2021-06-27T20:37:06.830652
2,Premier Boxing Champions,"Gervonta Davis vs Mario Barrios Knockout HIGHLIGHTS: June 26, 2021 - PBC on Showtime PPV",2021-06-27T06:27:34Z,1905104,5094,24664,1007,2021-06-27T20:37:06.830652
3,FloBikes,Spectator Causes Entire Peloton To Crash At Tour de France,2021-06-26T16:32:06Z,2078558,3173,7925,630,2021-06-27T20:37:06.830652
4,MrBeast,I Spent 50 Hours In Prison,2021-06-26T20:00:02Z,15953815,67478,1138777,12498,2021-06-27T20:37:06.830652
5,MariahVEVO,"Mariah Angeliq, Bad Gyal, Maria Becerra - BOBO (Official Video)",2021-06-25T00:00:12Z,2289953,8925,130235,4926,2021-06-27T20:37:06.830652
6,BLACKPINK,BLACKPINK x Today&#39;s Top Hits,2021-06-24T15:00:03Z,6528984,47711,981687,8977,2021-06-27T20:37:06.830652
7,WWE,"Edge returns to launch a surprise attack on Roman Reigns: SmackDown, June 25, 2021",2021-06-26T02:41:30Z,2994485,7296,91104,2582,2021-06-27T20:37:06.830652
8,MrDs4,Minecraft pero Hay Dimensiones Custom OP,2021-06-25T18:00:06Z,2995888,6461,114222,2703,2021-06-27T20:37:06.830652
9,CHASE ATLANTIC,Chase Atlantic - OHMAMI (Official Lyric Video),2021-06-25T04:00:11Z,1249862,21338,212149,733,2021-06-27T20:37:06.830652
10,Windies Cricket,Highlights | West Indies vs South Africa | Lewis &amp; Gayle Star! | 1st CG Insurance T20I 2021,2021-06-26T23:10:08Z,748453,1411,18020,603,2021-06-27T20:37:06.830652
11,Top Rank Boxing,"LOMA IS BACK!  Vintage Lomachenko, Dominates Nakatani &amp; finishes him in Round 9 | FIGHT HIGHLIGHTS",2021-06-27T04:45:00Z,499688,1620,6194,197,2021-06-27T20:37:06.830652
12,Myke Towers,Myke Towers - SR De Los Cielos,2021-06-24T18:42:19Z,4741415,3116,76558,685,2021-06-27T20:37:06.830652
13,TIKTORIKI,What else to try? #shorts Funn Tiktok new food Challenge by Tiktoriki,2021-06-19T07:15:00Z,30636508,764,643105,57419,2021-06-27T20:37:06.830652
14,L4hf0,My favourite moments from Quackity&#39;s new video 👁️👄👁️ (Part 1),2021-06-27T17:18:42Z,555982,2280,77572,356,2021-06-27T20:37:06.830652
15,Averly Morillo,Averly Morillo - Ante Tu Altar - Oficial,2021-06-26T04:00:11Z,112520,759,13981,50,2021-06-27T20:37:06.830652
16,Flicks And The City,LUCA&#39;s Alternate Ending &amp; DELETED SCENES You Never Got To See!,2021-06-26T12:39:32Z,1203910,428,14357,555,2021-06-27T20:37:06.830652
17,Captain Bling Bling,GENIUS PEOPLE WHO BEAT THE SYSTEM,2021-06-25T15:00:17Z,1806979,996,131697,4227,2021-06-27T20:37:06.830652
18,Coltyy,COCA-COLA ROCKETS WITH MY GRANDMA! #shorts,2021-06-01T07:02:49Z,29976703,16974,1548595,42650,2021-06-27T20:37:06.830652
19,TIKTORIKI,What else to try? #shorts Tiktok Food Challenge by Tiktoriki,2021-06-24T10:00:06Z,10543446,262,228166,26621,2021-06-27T20:37:06.830652
20,Zerkaa,SIDEMEN REACT TO MY NEW SONG,2021-06-25T21:08:11Z,1492553,7600,137158,569,2021-06-27T20:37:06.830652
21,Rachit Rojha,LOCKDOWN WITH COUSIN ( Episode -3 ) || Rachit Rojha,2021-06-23T03:59:54Z,6463905,19948,187407,16367,2021-06-27T20:37:06.830652
22,Dominic Brack,Surprising My Friends With My New Hair!!!,2021-06-26T18:00:12Z,594937,2446,100806,888,2021-06-27T20:37:06.830652
23,Aileen and Deven,Will my boyfriend punch me in the face for a billion dollars?,2021-06-14T15:00:14Z,10123433,7626,592166,9614,2021-06-27T20:37:06.830652
24,men vs wild nepal,https://youtu.be/ZRgjE_I7qMM,2021-06-22T18:47:23Z,75538813,2093,1226648,104883,2021-06-27T20:37:06.830652
25,Moriah Elizabeth,Letting Opie Choose What I Paint,2021-06-25T20:00:20Z,1876834,13666,103599,805,2021-06-27T20:37:06.830652
26,Tea Pack,My name is steve (MINECRAFT ANIMATION),2021-06-26T18:41:26Z,361084,2516,29059,206,2021-06-27T20:37:06.830652
27,Sipover,Minecraft&#39;s Most Game Breaking Glitches...,2021-06-25T20:17:35Z,659245,2402,34312,500,2021-06-27T20:37:06.830652
28,GCN Racing,"Tour de France Stage 1 Highlights | Crashes, Chaos &amp; An Epic Final Climb!",2021-06-26T16:15:44Z,400309,505,4537,76,2021-06-27T20:37:06.830652
29,Triggered Insaan,I Found The Funniest Songs - Tony Kakkar Special,2021-06-23T07:00:27Z,7364594,58726,836597,14622,2021-06-27T20:37:06.830652
30,The Food Theorists,Food Theory: The CORRECT Way To Build A Burger!,2021-06-26T17:05:37Z,1359406,14419,92522,1270,2021-06-27T20:37:06.830652
31,Mo Syed,KSI Tries INDIAN Snacks!,2021-06-26T14:30:13Z,804355,4887,96905,483,2021-06-27T20:37:06.830652
32,MORGENSHTERN,"MORGENSHTERN - ARISTOCRAT (Official Video, 2021)",2021-06-15T10:30:03Z,19559311,60661,984827,101733,2021-06-27T20:37:06.830652
33,JustDustin,100 Mystery Ropes.. Only 1 Lets You Escape!,2021-06-26T19:00:15Z,637424,977,26059,475,2021-06-27T20:37:06.830652
34,FORMULA 1,Qualifying Highlights | 2021 Styrian Grand Prix,2021-06-26T14:50:10Z,2881983,4035,66098,758,2021-06-27T20:37:06.830652
35,GeorgeNotFound,"Minecraft, But My Friend Is An Axolotl...",2021-06-24T17:02:13Z,7215122,46693,703066,6452,2021-06-27T20:37:06.830652
36,America's Got Talent,Golden Buzzer: Jimmie Herrod Surprises the Judges With &quot;Tomorrow&quot; - America&#39;s Got Talent 2021,2021-06-23T01:34:30Z,7188917,10645,162461,3124,2021-06-27T20:37:06.830652
37,Rusher King,Rusherking - LOBA (Official Video),2021-06-23T23:00:10Z,2239114,12073,233670,2355,2021-06-27T20:37:06.830652
38,MrBeast,"Hit The Target, Win $300,000",2021-06-12T20:00:01Z,36311065,81862,1679326,24327,2021-06-27T20:37:06.830652
39,ANC 24/7,BREAKING: Former PH President Noynoy Aquino passes away- sources | ANC,2021-06-24T01:30:36Z,964391,4059,6420,563,2021-06-27T20:37:06.830652
40,SSSniperWolf,Cool Things I Learned On Tik Tok,2021-06-26T19:16:35Z,3868744,12211,143236,1584,2021-06-27T20:37:06.830652
41,Fortnite Fun TV,Turn into eggnog - Tutorial #Shorts,2021-06-20T02:17:45Z,6328746,89,226074,13216,2021-06-27T20:37:06.830652
